Sheet: Import
B2: REF HLDP | C2: REF LF | D2: STATUT | E2: Produits
D3: =IF(ISNA(VLOOKUP(RC[-1],Details!R2C1:R1741C3,2,FALSE)),"Non","ok") -> Non | E3: =VLOOKUP(RC[-2],Liste!R2C2:R2001C3,2,FALSE) -> #N/A
D4: =IF(ISNA(VLOOKUP(RC[-1],Details!R2C1:R1741C3,2,FALSE)),"Non","ok") -> Non | E4: =VLOOKUP(RC[-2],Liste!R2C2:R2001C3,2,FALSE) -> #N/A
D5: =IF(ISNA(VLOOKUP(RC[-1],Details!R2C1:R1741C3,2,FALSE)),"Non","ok") -> Non | E5: =VLOOKUP(RC[-2],Liste!R2C2:R2001C3,2,FALSE) -> #N/A
D6: =IF(ISNA(VLOOKUP(RC[-1],Details!R2C1:R1741C3,2,FALSE)),"Non","ok") -> Non | E6: =VLOOKUP(RC[-2],Liste!R2C2:R2001C3,2,FALSE) -> #N/A
D7: =IF(ISNA(VLOOKUP(RC[-1],Details!R2C1:R1741C3,2,FALSE)),"Non","ok") -> Non | E7: =VLOOKUP(RC[-2],Liste!R2C2:R2001C3,2,FALSE) -> #N/A
D8: =IF(ISNA(VLOOKUP(RC[-1],Details!R2C1:R1741C3,2,FALSE)),"Non","ok") -> Non | E8: =VLOOKUP(RC[-2],Liste!R2C2:R2001C3,2,FALSE) -> #N/A
D9: =IF(ISNA(VLOOKUP(RC[-1],Details!R2C1:R1741C3,2,FALSE)),"Non","ok") -> Non | E9: =VLOOKUP(RC[-2],Liste!R2C2:R2001C3,2,FALSE) -> #N/A
D10: =IF(ISNA(VLOOKUP(RC[-1],Details!R2C1:R1741C3,2,FALSE)),"Non","ok") -> Non | E10: =VLOOKUP(RC[-2],Liste!R2C2:R2001C3,2,FALSE) -> #N/A
D11: =IF(ISNA(VLOOKUP(RC[-1],Details!R2C1:R1741C3,2,FALSE)),"Non","ok") -> Non | E11: =VLOOKUP(RC[-2],Liste!R2C2:R2001C3,2,FALSE) -> #N/A
D12: =IF(ISNA(VLOOKUP(RC[-1],Details!R2C1:R1741C3,2,FALSE)),"Non","ok") -> Non | E12: =VLOOKUP(RC[-2],Liste!R2C2:R2001C3,2,FALSE) -> #N/A
D13: =IF(ISNA(VLOOKUP(RC[-1],Details!R2C1:R1741C3,2,FALSE)),"Non","ok") -> Non | E13: =VLOOKUP(RC[-2],Liste!R2C2:R2001C3,2,FALSE) -> #N/A
D14: =IF(ISNA(VLOOKUP(RC[-1],Details!R2C1:R1741C3,2,FALSE)),"Non","ok") -> Non | E14: =VLOOKUP(RC[-2],Liste!R2C2:R2001C3,2,FALSE) -> #N/A
D15: =IF(ISNA(VLOOKUP(RC[-1],Details!R2C1:R1741C3,2,FALSE)),"Non","ok") -> Non | E15: =VLOOKUP(RC[-2],Liste!R2C2:R2001C3,2,FALSE) -> #N/A
D16: =IF(ISNA(VLOOKUP(RC[-1],Details!R2C1:R1741C3,2,FALSE)),"Non","ok") -> Non | E16: =VLOOKUP(RC[-2],Liste!R2C2:R2001C3,2,FALSE) -> #N/A
D17: =IF(ISNA(VLOOKUP(RC[-1],Details!R2C1:R1741C3,2,FALSE)),"Non","ok") -> Non | E17: =VLOOKUP(RC[-2],Liste!R2C2:R2001C3,2,FALSE) -> #N/A
D18: =IF(ISNA(VLOOKUP(RC[-1],Details!R2C1:R1741C3,2,FALSE)),"Non","ok") -> Non | E18: =VLOOKUP(RC[-2],Liste!R2C2:R2001C3,2,FALSE) -> #N/A
D19: =IF(ISNA(VLOOKUP(RC[-1],Details!R2C1:R1741C3,2,FALSE)),"Non","ok") -> Non | E19: =VLOOKUP(RC[-2],Liste!R2C2:R2001C3,2,FALSE) -> #N/A
D20: =IF(ISNA(VLOOKUP(RC[-1],Details!R2C1:R1741C3,2,FALSE)),"Non","ok") -> Non | E20: =VLOOKUP(RC[-2],Liste!R2C2:R2001C3,2,FALSE) -> #N/A
D21: =IF(ISNA(VLOOKUP(RC[-1],Details!R2C1:R1741C3,2,FALSE)),"Non","ok") -> Non | E21: =VLOOKUP(RC[-2],Liste!R2C2:R2001C3,2,FALSE) -> #N/A
D22: =IF(ISNA(VLOOKUP(RC[-1],Details!R2C1:R1741C3,2,FALSE)),"Non","ok") -> Non | E22: =VLOOKUP(RC[-2],Liste!R2C2:R2001C3,2,FALSE) -> #N/A
D23: =IF(ISNA(VLOOKUP(RC[-1],Details!R2C1:R1741C3,2,FALSE)),"Non","ok") -> Non | E23: =VLOOKUP(RC[-2],Liste!R2C2:R2001C3,2,FALSE) -> #N/A
D24: =IF(ISNA(VLOOKUP(RC[-1],Details!R2C1:R1741C3,2,FALSE)),"Non","ok") -> Non | E24: =VLOOKUP(RC[-2],Liste!R2C2:R2001C3,2,FALSE) -> #N/A
D25: =IF(ISNA(VLOOKUP(RC[-1],Details!R2C1:R1741C3,2,FALSE)),"Non","ok") -> Non | E25: =VLOOKUP(RC[-2],Liste!R2C2:R2001C3,2,FALSE) -> #N/A
D26: =IF(ISNA(VLOOKUP(RC[-1],Details!R2C1:R1741C3,2,FALSE)),"Non","ok") -> Non | E26: =VLOOKUP(RC[-2],Liste!R2C2:R2001C3,2,FALSE) -> #N/A
D27: =IF(ISNA(VLOOKUP(RC[-1],Details!R2C1:R1741C3,2,FALSE)),"Non","ok") -> Non | E27: =VLOOKUP(RC[-2],Liste!R2C2:R2001C3,2,FALSE) -> #N/A
D28: =IF(ISNA(VLOOKUP(RC[-1],Details!R2C1:R1741C3,2,FALSE)),"Non","ok") -> Non | E28: =VLOOKUP(RC[-2],Liste!R2C2:R2001C3,2,FALSE) -> #N/A
D29: =IF(ISNA(VLOOKUP(RC[-1],Details!R2C1:R1741C3,2,FALSE)),"Non","ok") -> Non | E29: =VLOOKUP(RC[-2],Liste!R2C2:R2001C3,2,FALSE) -> #N/A
D30: =IF(ISNA(VLOOKUP(RC[-1],Details!R2C1:R1741C3,2,FALSE)),"Non","ok") -> Non | E30: =VLOOKUP(RC[-2],Liste!R2C2:R2001C3,2,FALSE) -> #N/A
D31: =IF(ISNA(VLOOKUP(RC[-1],Details!R2C1:R1741C3,2,FALSE)),"Non","ok") -> Non | E31: =VLOOKUP(RC[-2],Liste!R2C2:R2001C3,2,FALSE) -> #N/A
D32: =IF(ISNA(VLOOKUP(RC[-1],Details!R2C1:R1741C3,2,FALSE)),"Non","ok") -> Non | E32: =VLOOKUP(RC[-2],Liste!R2C2:R2001C3,2,FALSE) -> #N/A
D33: =IF(ISNA(VLOOKUP(RC[-1],Details!R2C1:R1741C3,2,FALSE)),"Non","ok") -> Non | E33: =VLOOKUP(RC[-2],Liste!R2C2:R2001C3,2,FALSE) -> #N/A
D34: =IF(ISNA(VLOOKUP(RC[-1],Details!R2C1:R1741C3,2,FALSE)),"Non","ok") -> Non | E34: =VLOOKUP(RC[-2],Liste!R2C2:R2001C3,2,FALSE) -> #N/A
D35: =IF(ISNA(VLOOKUP(RC[-1],Details!R2C1:R1741C3,2,FALSE)),"Non","ok") -> Non | E35: =VLOOKUP(RC[-2],Liste!R2C2:R2001C3,2,FALSE) -> #N/A
D36: =IF(ISNA(VLOOKUP(RC[-1],Details!R2C1:R1741C3,2,FALSE)),"Non","ok") -> Non | E36: =VLOOKUP(RC[-2],Liste!R2C2:R2001C3,2,FALSE) -> #N/A
D37: =IF(ISNA(VLOOKUP(RC[-1],Details!R2C1:R1741C3,2,FALSE)),"Non","ok") -> Non | E37: =VLOOKUP(RC[-2],Liste!R2C2:R2001C3,2,FALSE) -> #N/A
D38: =IF(ISNA(VLOOKUP(RC[-1],Details!R2C1:R1741C3,2,FALSE)),"Non","ok") -> Non | E38: =VLOOKUP(RC[-2],Liste!R2C2:R2001C3,2,FALSE) -> #N/A
D39: =IF(ISNA(VLOOKUP(RC[-1],Details!R2C1:R1741C3,2,FALSE)),"Non","ok") -> Non | E39: =VLOOKUP(RC[-2],Liste!R2C2:R2001C3,2,FALSE) -> #N/A
D40: =IF(ISNA(VLOOKUP(RC[-1],Details!R2C1:R1741C3,2,FALSE)),"Non","ok") -> Non | E40: =VLOOKUP(RC[-2],Liste!R2C2:R2001C3,2,FALSE) -> #N/A
D41: =IF(ISNA(VLOOKUP(RC[-1],Details!R2C1:R1741C3,2,FALSE)),"Non","ok") -> Non | E41: =VLOOKUP(RC[-2],Liste!R2C2:R2001C3,2,FALSE) -> #N/A
D42: =IF(ISNA(VLOOKUP(RC[-1],Details!R2C1:R1741C3,2,FALSE)),"Non","ok") -> Non | E42: =VLOOKUP(RC[-2],Liste!R2C2:R2001C3,2,FALSE) -> #N/A
D43: =IF(ISNA(VLOOKUP(RC[-1],Details!R2C1:R1741C3,2,FALSE)),"Non","ok") -> Non | E43: =VLOOKUP(RC[-2],Liste!R2C2:R2001C3,2,FALSE) -> #N/A
D44: =IF(ISNA(VLOOKUP(RC[-1],Details!R2C1:R1741C3,2,FALSE)),"Non","ok") -> Non | E44: =VLOOKUP(RC[-2],Liste!R2C2:R2001C3,2,FALSE) -> #N/A
D45: =IF(ISNA(VLOOKUP(RC[-1],Details!R2C1:R1741C3,2,FALSE)),"Non","ok") -> Non | E45: =VLOOKUP(RC[-2],Liste!R2C2:R2001C3,2,FALSE) -> #N/A
D46: =IF(ISNA(VLOOKUP(RC[-1],Details!R2C1:R1741C3,2,FALSE)),"Non","ok") -> Non | E46: =VLOOKUP(RC[-2],Liste!R2C2:R2001C3,2,FALSE) -> #N/A
D47: =IF(ISNA(VLOOKUP(RC[-1],Details!R2C1:R1741C3,2,FALSE)),"Non","ok") -> Non | E47: =VLOOKUP(RC[-2],Liste!R2C2:R2001C3,2,FALSE) -> #N/A
D48: =IF(ISNA(VLOOKUP(RC[-1],Details!R2C1:R1741C3,2,FALSE)),"Non","ok") -> Non | E48: =VLOOKUP(RC[-2],Liste!R2C2:R2001C3,2,FALSE) -> #N/A
D49: =IF(ISNA(VLOOKUP(RC[-1],Details!R2C1:R1741C3,2,FALSE)),"Non","ok") -> Non | E49: =VLOOKUP(RC[-2],Liste!R2C2:R2001C3,2,FALSE) -> #N/A
D50: =IF(ISNA(VLOOKUP(RC[-1],Details!R2C1:R1741C3,2,FALSE)),"Non","ok") -> Non | E50: =VLOOKUP(RC[-2],Liste!R2C2:R2001C3,2,FALSE) -> #N/A
D51: =IF(ISNA(VLOOKUP(RC[-1],Details!R2C1:R1741C3,2,FALSE)),"Non","ok") -> Non | E51: =VLOOKUP(RC[-2],Liste!R2C2:R2001C3,2,FALSE) -> #N/A
D52: =IF(ISNA(VLOOKUP(RC[-1],Details!R2C1:R1741C3,2,FALSE)),"Non","ok") -> Non | E52: =VLOOKUP(RC[-2],Liste!R2C2:R2001C3,2,FALSE) -> #N/A
D53: =IF(ISNA(VLOOKUP(RC[-1],Details!R2C1:R1741C3,2,FALSE)),"Non","ok") -> Non | E53: =VLOOKUP(RC[-2],Liste!R2C2:R2001C3,2,FALSE) -> #N/A
D54: =IF(ISNA(VLOOKUP(RC[-1],Details!R2C1:R1741C3,2,FALSE)),"Non","ok") -> Non | E54: =VLOOKUP(RC[-2],Liste!R2C2:R2001C3,2,FALSE) -> #N/A
D55: =IF(ISNA(VLOOKUP(RC[-1],Details!R2C1:R1741C3,2,FALSE)),"Non","ok") -> Non | E55: =VLOOKUP(RC[-2],Liste!R2C2:R2001C3,2,FALSE) -> #N/A
D56: =IF(ISNA(VLOOKUP(RC[-1],Details!R2C1:R1741C3,2,FALSE)),"Non","ok") -> Non | E56: =VLOOKUP(RC[-2],Liste!R2C2:R2001C3,2,FALSE) -> #N/A
D57: =IF(ISNA(VLOOKUP(RC[-1],Details!R2C1:R1741C3,2,FALSE)),"Non","ok") -> Non | E57: =VLOOKUP(RC[-2],Liste!R2C2:R2001C3,2,FALSE) -> #N/A
D58: =IF(ISNA(VLOOKUP(RC[-1],Details!R2C1:R1741C3,2,FALSE)),"Non","ok") -> Non | E58: =VLOOKUP(RC[-2],Liste!R2C2:R2001C3,2,FALSE) -> #N/A
D59: =IF(ISNA(VLOOKUP(RC[-1],Details!R2C1:R1741C3,2,FALSE)),"Non","ok") -> Non | E59: =VLOOKUP(RC[-2],Liste!R2C2:R2001C3,2,FALSE) -> #N/A
D60: =IF(ISNA(VLOOKUP(RC[-1],Details!R2C1:R1741C3,2,FALSE)),"Non","ok") -> Non | E60: =VLOOKUP(RC[-2],Liste!R2C2:R2001C3,2,FALSE) -> #N/A
D61: =IF(ISNA(VLOOKUP(RC[-1],Details!R2C1:R1741C3,2,FALSE)),"Non","ok") -> Non | E61: =VLOOKUP(RC[-2],Liste!R2C2:R2001C3,2,FALSE) -> #N/A
D62: =IF(ISNA(VLOOKUP(RC[-1],Details!R2C1:R1741C3,2,FALSE)),"Non","ok") -> Non | E62: =VLOOKUP(RC[-2],Liste!R2C2:R2001C3,2,FALSE) -> #N/A
D63: =IF(ISNA(VLOOKUP(RC[-1],Details!R2C1:R1741C3,2,FALSE)),"Non","ok") -> Non | E63: =VLOOKUP(RC[-2],Liste!R2C2:R2001C3,2,FALSE) -> #N/A
D64: =IF(ISNA(VLOOKUP(RC[-1],Details!R2C1:R1741C3,2,FALSE)),"Non","ok") -> Non | E64: =VLOOKUP(RC[-2],Liste!R2C2:R2001C3,2,FALSE) -> #N/A
D65: =IF(ISNA(VLOOKUP(RC[-1],Details!R2C1:R1741C3,2,FALSE)),"Non","ok") -> Non | E65: =VLOOKUP(RC[-2],Liste!R2C2:R2001C3,2,FALSE) -> #N/A
D66: =IF(ISNA(VLOOKUP(RC[-1],Details!R2C1:R1741C3,2,FALSE)),"Non","ok") -> Non | E66: =VLOOKUP(RC[-2],Liste!R2C2:R2001C3,2,FALSE) -> #N/A
D67: =IF(ISNA(VLOOKUP(RC[-1],Details!R2C1:R1741C3,2,FALSE)),"Non","ok") -> Non | E67: =VLOOKUP(RC[-2],Liste!R2C2:R2001C3,2,FALSE) -> #N/A
D68: =IF(ISNA(VLOOKUP(RC[-1],Details!R2C1:R1741C3,2,FALSE)),"Non","ok") -> Non | E68: =VLOOKUP(RC[-2],Liste!R2C2:R2001C3,2,FALSE) -> #N/A
D69: =IF(ISNA(VLOOKUP(RC[-1],Details!R2C1:R1741C3,2,FALSE)),"Non","ok") -> Non | E69: =VLOOKUP(RC[-2],Liste!R2C2:R2001C3,2,FALSE) -> #N/A
D70: =IF(ISNA(VLOOKUP(RC[-1],Details!R2C1:R1741C3,2,FALSE)),"Non","ok") -> Non | E70: =VLOOKUP(RC[-2],Liste!R2C2:R2001C3,2,FALSE) -> #N/A
D71: =IF(ISNA(VLOOKUP(RC[-1],Details!R2C1:R1741C3,2,FALSE)),"Non","ok") -> Non | E71: =VLOOKUP(RC[-2],Liste!R2C2:R2001C3,2,FALSE) -> #N/A
D72: =IF(ISNA(VLOOKUP(RC[-1],Details!R2C1:R1741C3,2,FALSE)),"Non","ok") -> Non | E72: =VLOOKUP(RC[-2],Liste!R2C2:R2001C3,2,FALSE) -> #N/A
D73: =IF(ISNA(VLOOKUP(RC[-1],Details!R2C1:R1741C3,2,FALSE)),"Non","ok") -> Non | E73: =VLOOKUP(RC[-2],Liste!R2C2:R2001C3,2,FALSE) -> #N/A
D74: =IF(ISNA(VLOOKUP(RC[-1],Details!R2C1:R1741C3,2,FALSE)),"Non","ok") -> Non | E74: =VLOOKUP(RC[-2],Liste!R2C2:R2001C3,2,FALSE) -> #N/A
D75: =IF(ISNA(VLOOKUP(RC[-1],Details!R2C1:R1741C3,2,FALSE)),"Non","ok") -> Non | E75: =VLOOKUP(RC[-2],Liste!R2C2:R2001C3,2,FALSE) -> #N/A
D76: =IF(ISNA(VLOOKUP(RC[-1],Details!R2C1:R1741C3,2,FALSE)),"Non","ok") -> Non | E76: =VLOOKUP(RC[-2],Liste!R2C2:R2001C3,2,FALSE) -> #N/A
D77: =IF(ISNA(VLOOKUP(RC[-1],Details!R2C1:R1741C3,2,FALSE)),"Non","ok") -> Non | E77: =VLOOKUP(RC[-2],Liste!R2C2:R2001C3,2,FALSE) -> #N/A
D78: =IF(ISNA(VLOOKUP(RC[-1],Details!R2C1:R1741C3,2,FALSE)),"Non","ok") -> Non | E78: =VLOOKUP(RC[-2],Liste!R2C2:R2001C3,2,FALSE) -> #N/A
D79: =IF(ISNA(VLOOKUP(RC[-1],Details!R2C1:R1741C3,2,FALSE)),"Non","ok") -> Non | E79: =VLOOKUP(RC[-2],Liste!R2C2:R2001C3,2,FALSE) -> #N/A
D80: =IF(ISNA(VLOOKUP(RC[-1],Details!R2C1:R1741C3,2,FALSE)),"Non","ok") -> Non | E80: =VLOOKUP(RC[-2],Liste!R2C2:R2001C3,2,FALSE) -> #N/A
D81: =IF(ISNA(VLOOKUP(RC[-1],Details!R2C1:R1741C3,2,FALSE)),"Non","ok") -> Non | E81: =VLOOKUP(RC[-2],Liste!R2C2:R2001C3,2,FALSE) -> #N/A
D82: =IF(ISNA(VLOOKUP(RC[-1],Details!R2C1:R1741C3,2,FALSE)),"Non","ok") -> Non | E82: =VLOOKUP(RC[-2],Liste!R2C2:R2001C3,2,FALSE) -> #N/A
D83: =IF(ISNA(VLOOKUP(RC[-1],Details!R2C1:R1741C3,2,FALSE)),"Non","ok") -> Non | E83: =VLOOKUP(RC[-2],Liste!R2C2:R2001C3,2,FALSE) -> #N/A
D84: =IF(ISNA(VLOOKUP(RC[-1],Details!R2C1:R1741C3,2,FALSE)),"Non","ok") -> Non | E84: =VLOOKUP(RC[-2],Liste!R2C2:R2001C3,2,FALSE) -> #N/A
D85: =IF(ISNA(VLOOKUP(RC[-1],Details!R2C1:R1741C3,2,FALSE)),"Non","ok") -> Non | E85: =VLOOKUP(RC[-2],Liste!R2C2:R2001C3,2,FALSE) -> #N/A
D86: =IF(ISNA(VLOOKUP(RC[-1],Details!R2C1:R1741C3,2,FALSE)),"Non","ok") -> Non | E86: =VLOOKUP(RC[-2],Liste!R2C2:R2001C3,2,FALSE) -> #N/A
D87: =IF(ISNA(VLOOKUP(RC[-1],Details!R2C1:R1741C3,2,FALSE)),"Non","ok") -> Non | E87: =VLOOKUP(RC[-2],Liste!R2C2:R2001C3,2,FALSE) -> #N/A
D88: =IF(ISNA(VLOOKUP(RC[-1],Details!R2C1:R1741C3,2,FALSE)),"Non","ok") -> Non | E88: =VLOOKUP(RC[-2],Liste!R2C2:R2001C3,2,FALSE) -> #N/A
D89: =IF(ISNA(VLOOKUP(RC[-1],Details!R2C1:R1741C3,2,FALSE)),"Non","ok") -> Non | E89: =VLOOKUP(RC[-2],Liste!R2C2:R2001C3,2,FALSE) -> #N/A
D90: =IF(ISNA(VLOOKUP(RC[-1],Details!R2C1:R1741C3,2,FALSE)),"Non","ok") -> Non | E90: =VLOOKUP(RC[-2],Liste!R2C2:R2001C3,2,FALSE) -> #N/A
D91: =IF(ISNA(VLOOKUP(RC[-1],Details!R2C1:R1741C3,2,FALSE)),"Non","ok") -> Non | E91: =VLOOKUP(RC[-2],Liste!R2C2:R2001C3,2,FALSE) -> #N/A
D92: =IF(ISNA(VLOOKUP(RC[-1],Details!R2C1:R1741C3,2,FALSE)),"Non","ok") -> Non | E92: =VLOOKUP(RC[-2],Liste!R2C2:R2001C3,2,FALSE) -> #N/A
D93: =IF(ISNA(VLOOKUP(RC[-1],Details!R2C1:R1741C3,2,FALSE)),"Non","ok") -> Non | E93: =VLOOKUP(RC[-2],Liste!R2C2:R2001C3,2,FALSE) -> #N/A
D94: =IF(ISNA(VLOOKUP(RC[-1],Details!R2C1:R1741C3,2,FALSE)),"Non","ok") -> Non | E94: =VLOOKUP(RC[-2],Liste!R2C2:R2001C3,2,FALSE) -> #N/A
D95: =IF(ISNA(VLOOKUP(RC[-1],Details!R2C1:R1741C3,2,FALSE)),"Non","ok") -> Non | E95: =VLOOKUP(RC[-2],Liste!R2C2:R2001C3,2,FALSE) -> #N/A
D96: =IF(ISNA(VLOOKUP(RC[-1],Details!R2C1:R1741C3,2,FALSE)),"Non","ok") -> Non | E96: =VLOOKUP(RC[-2],Liste!R2C2:R2001C3,2,FALSE) -> #N/A
D97: =IF(ISNA(VLOOKUP(RC[-1],Details!R2C1:R1741C3,2,FALSE)),"Non","ok") -> Non | E97: =VLOOKUP(RC[-2],Liste!R2C2:R2001C3,2,FALSE) -> #N/A
D98: =IF(ISNA(VLOOKUP(RC[-1],Details!R2C1:R1741C3,2,FALSE)),"Non","ok") -> Non | E98: =VLOOKUP(RC[-2],Liste!R2C2:R2001C3,2,FALSE) -> #N/A
D99: =IF(ISNA(VLOOKUP(RC[-1],Details!R2C1:R1741C3,2,FALSE)),"Non","ok") -> Non | E99: =VLOOKUP(RC[-2],Liste!R2C2:R2001C3,2,FALSE) -> #N/A
D100: =IF(ISNA(VLOOKUP(RC[-1],Details!R2C1:R1741C3,2,FALSE)),"Non","ok") -> Non | E100: =VLOOKUP(RC[-2],Liste!R2C2:R2001C3,2,FALSE) -> #N/A
D101: =IF(ISNA(VLOOKUP(RC[-1],Details!R2C1:R1741C3,2,FALSE)),"Non","ok") -> Non | E101: =VLOOKUP(RC[-2],Liste!R2C2:R2001C3,2,FALSE) -> #N/A
D102: =IF(ISNA(VLOOKUP(RC[-1],Details!R2C1:R1741C3,2,FALSE)),"Non","ok") -> Non | E102: =VLOOKUP(RC[-2],Liste!R2C2:R2001C3,2,FALSE) -> #N/A
D103: =IF(ISNA(VLOOKUP(RC[-1],Details!R2C1:R1741C3,2,FALSE)),"Non","ok") -> Non | E103: =VLOOKUP(RC[-2],Liste!R2C2:R2001C3,2,FALSE) -> #N/A
D104: =IF(ISNA(VLOOKUP(RC[-1],Details!R2C1:R1741C3,2,FALSE)),"Non","ok") -> Non | E104: =VLOOKUP(RC[-2],Liste!R2C2:R2001C3,2,FALSE) -> #N/A
D105: =IF(ISNA(VLOOKUP(RC[-1],Details!R2C1:R1741C3,2,FALSE)),"Non","ok") -> Non | E105: =VLOOKUP(RC[-2],Liste!R2C2:R2001C3,2,FALSE) -> #N/A
D106: =IF(ISNA(VLOOKUP(RC[-1],Details!R2C1:R1741C3,2,FALSE)),"Non","ok") -> Non | E106: =VLOOKUP(RC[-2],Liste!R2C2:R2001C3,2,FALSE) -> #N/A
D107: =IF(ISNA(VLOOKUP(RC[-1],Details!R2C1:R1741C3,2,FALSE)),"Non","ok") -> Non | E107: =VLOOKUP(RC[-2],Liste!R2C2:R2001C3,2,FALSE) -> #N/A
D108: =IF(ISNA(VLOOKUP(RC[-1],Details!R2C1:R1741C3,2,FALSE)),"Non","ok") -> Non | E108: =VLOOKUP(RC[-2],Liste!R2C2:R2001C3,2,FALSE) -> #N/A
D109: =IF(ISNA(VLOOKUP(RC[-1],Details!R2C1:R1741C3,2,FALSE)),"Non","ok") -> Non | E109: =VLOOKUP(RC[-2],Liste!R2C2:R2001C3,2,FALSE) -> #N/A
D110: =IF(ISNA(VLOOKUP(RC[-1],Details!R2C1:R1741C3,2,FALSE)),"Non","ok") -> Non | E110: =VLOOKUP(RC[-2],Liste!R2C2:R2001C3,2,FALSE) -> #N/A
D111: =IF(ISNA(VLOOKUP(RC[-1],Details!R2C1:R1741C3,2,FALSE)),"Non","ok") -> Non | E111: =VLOOKUP(RC[-2],Liste!R2C2:R2001C3,2,FALSE) -> #N/A
D112: =IF(ISNA(VLOOKUP(RC[-1],Details!R2C1:R1741C3,2,FALSE)),"Non","ok") -> Non | E112: =VLOOKUP(RC[-2],Liste!R2C2:R2001C3,2,FALSE) -> #N/A
D113: =IF(ISNA(VLOOKUP(RC[-1],Details!R2C1:R1741C3,2,FALSE)),"Non","ok") -> Non | E113: =VLOOKUP(RC[-2],Liste!R2C2:R2001C3,2,FALSE) -> #N/A
D114: =IF(ISNA(VLOOKUP(RC[-1],Details!R2C1:R1741C3,2,FALSE)),"Non","ok") -> Non | E114: =VLOOKUP(RC[-2],Liste!R2C2:R2001C3,2,FALSE) -> #N/A
D115: =IF(ISNA(VLOOKUP(RC[-1],Details!R2C1:R1741C3,2,FALSE)),"Non","ok") -> Non | E115: =VLOOKUP(RC[-2],Liste!R2C2:R2001C3,2,FALSE) -> #N/A
D116: =IF(ISNA(VLOOKUP(RC[-1],Details!R2C1:R1741C3,2,FALSE)),"Non","ok") -> Non | E116: =VLOOKUP(RC[-2],Liste!R2C2:R2001C3,2,FALSE) -> #N/A
D117: =IF(ISNA(VLOOKUP(RC[-1],Details!R2C1:R1741C3,2,FALSE)),"Non","ok") -> Non | E117: =VLOOKUP(RC[-2],Liste!R2C2:R2001C3,2,FALSE) -> #N/A
D118: =IF(ISNA(VLOOKUP(RC[-1],Details!R2C1:R1741C3,2,FALSE)),"Non","ok") -> Non | E118: =VLOOKUP(RC[-2],Liste!R2C2:R2001C3,2,FALSE) -> #N/A
D119: =IF(ISNA(VLOOKUP(RC[-1],Details!R2C1:R1741C3,2,FALSE)),"Non","ok") -> Non | E119: =VLOOKUP(RC[-2],Liste!R2C2:R2001C3,2,FALSE) -> #N/A
D120: =IF(ISNA(VLOOKUP(RC[-1],Details!R2C1:R1741C3,2,FALSE)),"Non","ok") -> Non | E120: =VLOOKUP(RC[-2],Liste!R2C2:R2001C3,2,FALSE) -> #N/A
D121: =IF(ISNA(VLOOKUP(RC[-1],Details!R2C1:R1741C3,2,FALSE)),"Non","ok") -> Non | E121: =VLOOKUP(RC[-2],Liste!R2C2:R2001C3,2,FALSE) -> #N/A
D122: =IF(ISNA(VLOOKUP(RC[-1],Details!R2C1:R1741C3,2,FALSE)),"Non","ok") -> Non | E122: =VLOOKUP(RC[-2],Liste!R2C2:R2001C3,2,FALSE) -> #N/A
D123: =IF(ISNA(VLOOKUP(RC[-1],Details!R2C1:R1741C3,2,FALSE)),"Non","ok") -> Non | E123: =VLOOKUP(RC[-2],Liste!R2C2:R2001C3,2,FALSE) -> #N/A
D124: =IF(ISNA(VLOOKUP(RC[-1],Details!R2C1:R1741C3,2,FALSE)),"Non","ok") -> Non | E124: =VLOOKUP(RC[-2],Liste!R2C2:R2001C3,2,FALSE) -> #N/A
D125: =IF(ISNA(VLOOKUP(RC[-1],Details!R2C1:R1741C3,2,FALSE)),"Non","ok") -> Non | E125: =VLOOKUP(RC[-2],Liste!R2C2:R2001C3,2,FALSE) -> #N/A
D126: =IF(ISNA(VLOOKUP(RC[-1],Details!R2C1:R1741C3,2,FALSE)),"Non","ok") -> Non | E126: =VLOOKUP(RC[-2],Liste!R2C2:R2001C3,2,FALSE) -> #N/A
D127: =IF(ISNA(VLOOKUP(RC[-1],Details!R2C1:R1741C3,2,FALSE)),"Non","ok") -> Non | E127: =VLOOKUP(RC[-2],Liste!R2C2:R2001C3,2,FALSE) -> #N/A
D128: =IF(ISNA(VLOOKUP(RC[-1],Details!R2C1:R1741C3,2,FALSE)),"Non","ok") -> Non | E128: =VLOOKUP(RC[-2],Liste!R2C2:R2001C3,2,FALSE) -> #N/A
D129: =IF(ISNA(VLOOKUP(RC[-1],Details!R2C1:R1741C3,2,FALSE)),"Non","ok") -> Non | E129: =VLOOKUP(RC[-2],Liste!R2C2:R2001C3,2,FALSE) -> #N/A
D130: =IF(ISNA(VLOOKUP(RC[-1],Details!R2C1:R1741C3,2,FALSE)),"Non","ok") -> Non | E130: =VLOOKUP(RC[-2],Liste!R2C2:R2001C3,2,FALSE) -> #N/A
D131: =IF(ISNA(VLOOKUP(RC[-1],Details!R2C1:R1741C3,2,FALSE)),"Non","ok") -> Non | E131: =VLOOKUP(RC[-2],Liste!R2C2:R2001C3,2,FALSE) -> #N/A
D132: =IF(ISNA(VLOOKUP(RC[-1],Details!R2C1:R1741C3,2,FALSE)),"Non","ok") -> Non | E132: =VLOOKUP(RC[-2],Liste!R2C2:R2001C3,2,FALSE) -> #N/A
D133: =IF(ISNA(VLOOKUP(RC[-1],Details!R2C1:R1741C3,2,FALSE)),"Non","ok") -> Non | E133: =VLOOKUP(RC[-2],Liste!R2C2:R2001C3,2,FALSE) -> #N/A
D134: =IF(ISNA(VLOOKUP(RC[-1],Details!R2C1:R1741C3,2,FALSE)),"Non","ok") -> Non | E134: =VLOOKUP(RC[-2],Liste!R2C2:R2001C3,2,FALSE) -> #N/A
D135: =IF(ISNA(VLOOKUP(RC[-1],Details!R2C1:R1741C3,2,FALSE)),"Non","ok") -> Non | E135: =VLOOKUP(RC[-2],Liste!R2C2:R2001C3,2,FALSE) -> #N/A
D136: =IF(ISNA(VLOOKUP(RC[-1],Details!R2C1:R1741C3,2,FALSE)),"Non","ok") -> Non | E136: =VLOOKUP(RC[-2],Liste!R2C2:R2001C3,2,FALSE) -> #N/A
D137: =IF(ISNA(VLOOKUP(RC[-1],Details!R2C1:R1741C3,2,FALSE)),"Non","ok") -> Non | E137: =VLOOKUP(RC[-2],Liste!R2C2:R2001C3,2,FALSE) -> #N/A
D138: =IF(ISNA(VLOOKUP(RC[-1],Details!R2C1:R1741C3,2,FALSE)),"Non","ok") -> Non | E138: =VLOOKUP(RC[-2],Liste!R2C2:R2001C3,2,FALSE) -> #N/A
D139: =IF(ISNA(VLOOKUP(RC[-1],Details!R2C1:R1741C3,2,FALSE)),"Non","ok") -> Non | E139: =VLOOKUP(RC[-2],Liste!R2C2:R2001C3,2,FALSE) -> #N/A
D140: =IF(ISNA(VLOOKUP(RC[-1],Details!R2C1:R1741C3,2,FALSE)),"Non","ok") -> Non | E140: =VLOOKUP(RC[-2],Liste!R2C2:R2001C3,2,FALSE) -> #N/A
D141: =IF(ISNA(VLOOKUP(RC[-1],Details!R2C1:R1741C3,2,FALSE)),"Non","ok") -> Non | E141: =VLOOKUP(RC[-2],Liste!R2C2:R2001C3,2,FALSE) -> #N/A
D142: =IF(ISNA(VLOOKUP(RC[-1],Details!R2C1:R1741C3,2,FALSE)),"Non","ok") -> Non | E142: =VLOOKUP(RC[-2],Liste!R2C2:R2001C3,2,FALSE) -> #N/A
D143: =IF(ISNA(VLOOKUP(RC[-1],Details!R2C1:R1741C3,2,FALSE)),"Non","ok") -> Non | E143: =VLOOKUP(RC[-2],Liste!R2C2:R2001C3,2,FALSE) -> #N/A
D144: =IF(ISNA(VLOOKUP(RC[-1],Details!R2C1:R1741C3,2,FALSE)),"Non","ok") -> Non | E144: =VLOOKUP(RC[-2],Liste!R2C2:R2001C3,2,FALSE) -> #N/A
D145: =IF(ISNA(VLOOKUP(RC[-1],Details!R2C1:R1741C3,2,FALSE)),"Non","ok") -> Non | E145: =VLOOKUP(RC[-2],Liste!R2C2:R2001C3,2,FALSE) -> #N/A
D146: =IF(ISNA(VLOOKUP(RC[-1],Details!R2C1:R1741C3,2,FALSE)),"Non","ok") -> Non | E146: =VLOOKUP(RC[-2],Liste!R2C2:R2001C3,2,FALSE) -> #N/A
D147: =IF(ISNA(VLOOKUP(RC[-1],Details!R2C1:R1741C3,2,FALSE)),"Non","ok") -> Non | E147: =VLOOKUP(RC[-2],Liste!R2C2:R2001C3,2,FALSE) -> #N/A
D148: =IF(ISNA(VLOOKUP(RC[-1],Details!R2C1:R1741C3,2,FALSE)),"Non","ok") -> Non | E148: =VLOOKUP(RC[-2],Liste!R2C2:R2001C3,2,FALSE) -> #N/A
D149: =IF(ISNA(VLOOKUP(RC[-1],Details!R2C1:R1741C3,2,FALSE)),"Non","ok") -> Non | E149: =VLOOKUP(RC[-2],Liste!R2C2:R2001C3,2,FALSE) -> #N/A
D150: =IF(ISNA(VLOOKUP(RC[-1],Details!R2C1:R1741C3,2,FALSE)),"Non","ok") -> Non | E150: =VLOOKUP(RC[-2],Liste!R2C2:R2001C3,2,FALSE) -> #N/A
D151: =IF(ISNA(VLOOKUP(RC[-1],Details!R2C1:R1741C3,2,FALSE)),"Non","ok") -> Non | E151: =VLOOKUP(RC[-2],Liste!R2C2:R2001C3,2,FALSE) -> #N/A
D152: =IF(ISNA(VLOOKUP(RC[-1],Details!R2C1:R1741C3,2,FALSE)),"Non","ok") -> Non | E152: =VLOOKUP(RC[-2],Liste!R2C2:R2001C3,2,FALSE) -> #N/A
D153: =IF(ISNA(VLOOKUP(RC[-1],Details!R2C1:R1741C3,2,FALSE)),"Non","ok") -> Non | E153: =VLOOKUP(RC[-2],Liste!R2C2:R2001C3,2,FALSE) -> #N/A
D154: =IF(ISNA(VLOOKUP(RC[-1],Details!R2C1:R1741C3,2,FALSE)),"Non","ok") -> Non | E154: =VLOOKUP(RC[-2],Liste!R2C2:R2001C3,2,FALSE) -> #N/A
D155: =IF(ISNA(VLOOKUP(RC[-1],Details!R2C1:R1741C3,2,FALSE)),"Non","ok") -> Non | E155: =VLOOKUP(RC[-2],Liste!R2C2:R2001C3,2,FALSE) -> #N/A
D156: =IF(ISNA(VLOOKUP(RC[-1],Details!R2C1:R1741C3,2,FALSE)),"Non","ok") -> Non | E156: =VLOOKUP(RC[-2],Liste!R2C2:R2001C3,2,FALSE) -> #N/A
D157: =IF(ISNA(VLOOKUP(RC[-1],Details!R2C1:R1741C3,2,FALSE)),"Non","ok") -> Non | E157: =VLOOKUP(RC[-2],Liste!R2C2:R2001C3,2,FALSE) -> #N/A
D158: =IF(ISNA(VLOOKUP(RC[-1],Details!R2C1:R1741C3,2,FALSE)),"Non","ok") -> Non | E158: =VLOOKUP(RC[-2],Liste!R2C2:R2001C3,2,FALSE) -> #N/A
D159: =IF(ISNA(VLOOKUP(RC[-1],Details!R2C1:R1741C3,2,FALSE)),"Non","ok") -> Non | E159: =VLOOKUP(RC[-2],Liste!R2C2:R2001C3,2,FALSE) -> #N/A
D160: =IF(ISNA(VLOOKUP(RC[-1],Details!R2C1:R1741C3,2,FALSE)),"Non","ok") -> Non | E160: =VLOOKUP(RC[-2],Liste!R2C2:R2001C3,2,FALSE) -> #N/A
D161: =IF(ISNA(VLOOKUP(RC[-1],Details!R2C1:R1741C3,2,FALSE)),"Non","ok") -> Non | E161: =VLOOKUP(RC[-2],Liste!R2C2:R2001C3,2,FALSE) -> #N/A
D162: =IF(ISNA(VLOOKUP(RC[-1],Details!R2C1:R1741C3,2,FALSE)),"Non","ok") -> Non | E162: =VLOOKUP(RC[-2],Liste!R2C2:R2001C3,2,FALSE) -> #N/A
D163: =IF(ISNA(VLOOKUP(RC[-1],Details!R2C1:R1741C3,2,FALSE)),"Non","ok") -> Non | E163: =VLOOKUP(RC[-2],Liste!R2C2:R2001C3,2,FALSE) -> #N/A
D164: =IF(ISNA(VLOOKUP(RC[-1],Details!R2C1:R1741C3,2,FALSE)),"Non","ok") -> Non | E164: =VLOOKUP(RC[-2],Liste!R2C2:R2001C3,2,FALSE) -> #N/A
D165: =IF(ISNA(VLOOKUP(RC[-1],Details!R2C1:R1741C3,2,FALSE)),"Non","ok") -> Non | E165: =VLOOKUP(RC[-2],Liste!R2C2:R2001C3,2,FALSE) -> #N/A
D166: =IF(ISNA(VLOOKUP(RC[-1],Details!R2C1:R1741C3,2,FALSE)),"Non","ok") -> Non | E166: =VLOOKUP(RC[-2],Liste!R2C2:R2001C3,2,FALSE) -> #N/A
D167: =IF(ISNA(VLOOKUP(RC[-1],Details!R2C1:R1741C3,2,FALSE)),"Non","ok") -> Non | E167: =VLOOKUP(RC[-2],Liste!R2C2:R2001C3,2,FALSE) -> #N/A
D168: =IF(ISNA(VLOOKUP(RC[-1],Details!R2C1:R1741C3,2,FALSE)),"Non","ok") -> Non | E168: =VLOOKUP(RC[-2],Liste!R2C2:R2001C3,2,FALSE) -> #N/A
D169: =IF(ISNA(VLOOKUP(RC[-1],Details!R2C1:R1741C3,2,FALSE)),"Non","ok") -> Non | E169: =VLOOKUP(RC[-2],Liste!R2C2:R2001C3,2,FALSE) -> #N/A
D170: =IF(ISNA(VLOOKUP(RC[-1],Details!R2C1:R1741C3,2,FALSE)),"Non","ok") -> Non | E170: =VLOOKUP(RC[-2],Liste!R2C2:R2001C3,2,FALSE) -> #N/A
D171: =IF(ISNA(VLOOKUP(RC[-1],Details!R2C1:R1741C3,2,FALSE)),"Non","ok") -> Non | E171: =VLOOKUP(RC[-2],Liste!R2C2:R2001C3,2,FALSE) -> #N/A
D172: =IF(ISNA(VLOOKUP(RC[-1],Details!R2C1:R1741C3,2,FALSE)),"Non","ok") -> Non | E172: =VLOOKUP(RC[-2],Liste!R2C2:R2001C3,2,FALSE) -> #N/A
D173: =IF(ISNA(VLOOKUP(RC[-1],Details!R2C1:R1741C3,2,FALSE)),"Non","ok") -> Non | E173: =VLOOKUP(RC[-2],Liste!R2C2:R2001C3,2,FALSE) -> #N/A
D174: =IF(ISNA(VLOOKUP(RC[-1],Details!R2C1:R1741C3,2,FALSE)),"Non","ok") -> Non | E174: =VLOOKUP(RC[-2],Liste!R2C2:R2001C3,2,FALSE) -> #N/A
D175: =IF(ISNA(VLOOKUP(RC[-1],Details!R2C1:R1741C3,2,FALSE)),"Non","ok") -> Non | E175: =VLOOKUP(RC[-2],Liste!R2C2:R2001C3,2,FALSE) -> #N/A
D176: =IF(ISNA(VLOOKUP(RC[-1],Details!R2C1:R1741C3,2,FALSE)),"Non","ok") -> Non | E176: =VLOOKUP(RC[-2],Liste!R2C2:R2001C3,2,FALSE) -> #N/A
D177: =IF(ISNA(VLOOKUP(RC[-1],Details!R2C1:R1741C3,2,FALSE)),"Non","ok") -> Non | E177: =VLOOKUP(RC[-2],Liste!R2C2:R2001C3,2,FALSE) -> #N/A
D178: =IF(ISNA(VLOOKUP(RC[-1],Details!R2C1:R1741C3,2,FALSE)),"Non","ok") -> Non | E178: =VLOOKUP(RC[-2],Liste!R2C2:R2001C3,2,FALSE) -> #N/A
D179: =IF(ISNA(VLOOKUP(RC[-1],Details!R2C1:R1741C3,2,FALSE)),"Non","ok") -> Non | E179: =VLOOKUP(RC[-2],Liste!R2C2:R2001C3,2,FALSE) -> #N/A
D180: =IF(ISNA(VLOOKUP(RC[-1],Details!R2C1:R1741C3,2,FALSE)),"Non","ok") -> Non | E180: =VLOOKUP(RC[-2],Liste!R2C2:R2001C3,2,FALSE) -> #N/A
D181: =IF(ISNA(VLOOKUP(RC[-1],Details!R2C1:R1741C3,2,FALSE)),"Non","ok") -> Non | E181: =VLOOKUP(RC[-2],Liste!R2C2:R2001C3,2,FALSE) -> #N/A
D182: =IF(ISNA(VLOOKUP(RC[-1],Details!R2C1:R1741C3,2,FALSE)),"Non","ok") -> Non | E182: =VLOOKUP(RC[-2],Liste!R2C2:R2001C3,2,FALSE) -> #N/A
D183: =IF(ISNA(VLOOKUP(RC[-1],Details!R2C1:R1741C3,2,FALSE)),"Non","ok") -> Non | E183: =VLOOKUP(RC[-2],Liste!R2C2:R2001C3,2,FALSE) -> #N/A
D184: =IF(ISNA(VLOOKUP(RC[-1],Details!R2C1:R1741C3,2,FALSE)),"Non","ok") -> Non | E184: =VLOOKUP(RC[-2],Liste!R2C2:R2001C3,2,FALSE) -> #N/A
D185: =IF(ISNA(VLOOKUP(RC[-1],Details!R2C1:R1741C3,2,FALSE)),"Non","ok") -> Non | E185: =VLOOKUP(RC[-2],Liste!R2C2:R2001C3,2,FALSE) -> #N/A
D186: =IF(ISNA(VLOOKUP(RC[-1],Details!R2C1:R1741C3,2,FALSE)),"Non","ok") -> Non | E186: =VLOOKUP(RC[-2],Liste!R2C2:R2001C3,2,FALSE) -> #N/A
D187: =IF(ISNA(VLOOKUP(RC[-1],Details!R2C1:R1741C3,2,FALSE)),"Non","ok") -> Non | E187: =VLOOKUP(RC[-2],Liste!R2C2:R2001C3,2,FALSE) -> #N/A
D188: =IF(ISNA(VLOOKUP(RC[-1],Details!R2C1:R1741C3,2,FALSE)),"Non","ok") -> Non | E188: =VLOOKUP(RC[-2],Liste!R2C2:R2001C3,2,FALSE) -> #N/A
D189: =IF(ISNA(VLOOKUP(RC[-1],Details!R2C1:R1741C3,2,FALSE)),"Non","ok") -> Non | E189: =VLOOKUP(RC[-2],Liste!R2C2:R2001C3,2,FALSE) -> #N/A
D190: =IF(ISNA(VLOOKUP(RC[-1],Details!R2C1:R1741C3,2,FALSE)),"Non","ok") -> Non | E190: =VLOOKUP(RC[-2],Liste!R2C2:R2001C3,2,FALSE) -> #N/A
D191: =IF(ISNA(VLOOKUP(RC[-1],Details!R2C1:R1741C3,2,FALSE)),"Non","ok") -> Non | E191: =VLOOKUP(RC[-2],Liste!R2C2:R2001C3,2,FALSE) -> #N/A
D192: =IF(ISNA(VLOOKUP(RC[-1],Details!R2C1:R1741C3,2,FALSE)),"Non","ok") -> Non | E192: =VLOOKUP(RC[-2],Liste!R2C2:R2001C3,2,FALSE) -> #N/A
D193: =IF(ISNA(VLOOKUP(RC[-1],Details!R2C1:R1741C3,2,FALSE)),"Non","ok") -> Non | E193: =VLOOKUP(RC[-2],Liste!R2C2:R2001C3,2,FALSE) -> #N/A
D194: =IF(ISNA(VLOOKUP(RC[-1],Details!R2C1:R1741C3,2,FALSE)),"Non","ok") -> Non | E194: =VLOOKUP(RC[-2],Liste!R2C2:R2001C3,2,FALSE) -> #N/A
D195: =IF(ISNA(VLOOKUP(RC[-1],Details!R2C1:R1741C3,2,FALSE)),"Non","ok") -> Non | E195: =VLOOKUP(RC[-2],Liste!R2C2:R2001C3,2,FALSE) -> #N/A
D196: =IF(ISNA(VLOOKUP(RC[-1],Details!R2C1:R1741C3,2,FALSE)),"Non","ok") -> Non | E196: =VLOOKUP(RC[-2],Liste!R2C2:R2001C3,2,FALSE) -> #N/A
D197: =IF(ISNA(VLOOKUP(RC[-1],Details!R2C1:R1741C3,2,FALSE)),"Non","ok") -> Non | E197: =VLOOKUP(RC[-2],Liste!R2C2:R2001C3,2,FALSE) -> #N/A
D198: =IF(ISNA(VLOOKUP(RC[-1],Details!R2C1:R1741C3,2,FALSE)),"Non","ok") -> Non | E198: =VLOOKUP(RC[-2],Liste!R2C2:R2001C3,2,FALSE) -> #N/A
D199: =IF(ISNA(VLOOKUP(RC[-1],Details!R2C1:R1741C3,2,FALSE)),"Non","ok") -> Non | E199: =VLOOKUP(RC[-2],Liste!R2C2:R2001C3,2,FALSE) -> #N/A
D200: =IF(ISNA(VLOOKUP(RC[-1],Details!R2C1:R1741C3,2,FALSE)),"Non","ok") -> Non | E200: =VLOOKUP(RC[-2],Liste!R2C2:R2001C3,2,FALSE) -> #N/A
D201: =IF(ISNA(VLOOKUP(RC[-1],Details!R2C1:R1741C3,2,FALSE)),"Non","ok") -> Non | E201: =VLOOKUP(RC[-2],Liste!R2C2:R2001C3,2,FALSE) -> #N/A
D202: =IF(ISNA(VLOOKUP(RC[-1],Details!R2C1:R1741C3,2,FALSE)),"Non","ok") -> Non | E202: =VLOOKUP(RC[-2],Liste!R2C2:R2001C3,2,FALSE) -> #N/A
D203: =IF(ISNA(VLOOKUP(RC[-1],Details!R2C1:R1741C3,2,FALSE)),"Non","ok") -> Non | E203: =VLOOKUP(RC[-2],Liste!R2C2:R2001C3,2,FALSE) -> #N/A
D204: =IF(ISNA(VLOOKUP(RC[-1],Details!R2C1:R1741C3,2,FALSE)),"Non","ok") -> Non | E204: =VLOOKUP(RC[-2],Liste!R2C2:R2001C3,2,FALSE) -> #N/A
D205: =IF(ISNA(VLOOKUP(RC[-1],Details!R2C1:R1741C3,2,FALSE)),"Non","ok") -> Non | E205: =VLOOKUP(RC[-2],Liste!R2C2:R2001C3,2,FALSE) -> #N/A
D206: =IF(ISNA(VLOOKUP(RC[-1],Details!R2C1:R1741C3,2,FALSE)),"Non","ok") -> Non | E206: =VLOOKUP(RC[-2],Liste!R2C2:R2001C3,2,FALSE) -> #N/A
D207: =IF(ISNA(VLOOKUP(RC[-1],Details!R2C1:R1741C3,2,FALSE)),"Non","ok") -> Non | E207: =VLOOKUP(RC[-2],Liste!R2C2:R2001C3,2,FALSE) -> #N/A
D208: =IF(ISNA(VLOOKUP(RC[-1],Details!R2C1:R1741C3,2,FALSE)),"Non","ok") -> Non | E208: =VLOOKUP(RC[-2],Liste!R2C2:R2001C3,2,FALSE) -> #N/A
D209: =IF(ISNA(VLOOKUP(RC[-1],Details!R2C1:R1741C3,2,FALSE)),"Non","ok") -> Non | E209: =VLOOKUP(RC[-2],Liste!R2C2:R2001C3,2,FALSE) -> #N/A
D210: =IF(ISNA(VLOOKUP(RC[-1],Details!R2C1:R1741C3,2,FALSE)),"Non","ok") -> Non | E210: =VLOOKUP(RC[-2],Liste!R2C2:R2001C3,2,FALSE) -> #N/A
D211: =IF(ISNA(VLOOKUP(RC[-1],Details!R2C1:R1741C3,2,FALSE)),"Non","ok") -> Non | E211: =VLOOKUP(RC[-2],Liste!R2C2:R2001C3,2,FALSE) -> #N/A
D212: =IF(ISNA(VLOOKUP(RC[-1],Details!R2C1:R1741C3,2,FALSE)),"Non","ok") -> Non | E212: =VLOOKUP(RC[-2],Liste!R2C2:R2001C3,2,FALSE) -> #N/A
D213: =IF(ISNA(VLOOKUP(RC[-1],Details!R2C1:R1741C3,2,FALSE)),"Non","ok") -> Non | E213: =VLOOKUP(RC[-2],Liste!R2C2:R2001C3,2,FALSE) -> #N/A
D214: =IF(ISNA(VLOOKUP(RC[-1],Details!R2C1:R1741C3,2,FALSE)),"Non","ok") -> Non | E214: =VLOOKUP(RC[-2],Liste!R2C2:R2001C3,2,FALSE) -> #N/A
D215: =IF(ISNA(VLOOKUP(RC[-1],Details!R2C1:R1741C3,2,FALSE)),"Non","ok") -> Non | E215: =VLOOKUP(RC[-2],Liste!R2C2:R2001C3,2,FALSE) -> #N/A
D216: =IF(ISNA(VLOOKUP(RC[-1],Details!R2C1:R1741C3,2,FALSE)),"Non","ok") -> Non | E216: =VLOOKUP(RC[-2],Liste!R2C2:R2001C3,2,FALSE) -> #N/A
D217: =IF(ISNA(VLOOKUP(RC[-1],Details!R2C1:R1741C3,2,FALSE)),"Non","ok") -> Non | E217: =VLOOKUP(RC[-2],Liste!R2C2:R2001C3,2,FALSE) -> #N/A
D218: =IF(ISNA(VLOOKUP(RC[-1],Details!R2C1:R1741C3,2,FALSE)),"Non","ok") -> Non | E218: =VLOOKUP(RC[-2],Liste!R2C2:R2001C3,2,FALSE) -> #N/A
D219: =IF(ISNA(VLOOKUP(RC[-1],Details!R2C1:R1741C3,2,FALSE)),"Non","ok") -> Non | E219: =VLOOKUP(RC[-2],Liste!R2C2:R2001C3,2,FALSE) -> #N/A
D220: =IF(ISNA(VLOOKUP(RC[-1],Details!R2C1:R1741C3,2,FALSE)),"Non","ok") -> Non | E220: =VLOOKUP(RC[-2],Liste!R2C2:R2001C3,2,FALSE) -> #N/A
D221: =IF(ISNA(VLOOKUP(RC[-1],Details!R2C1:R1741C3,2,FALSE)),"Non","ok") -> Non | E221: =VLOOKUP(RC[-2],Liste!R2C2:R2001C3,2,FALSE) -> #N/A
D222: =IF(ISNA(VLOOKUP(RC[-1],Details!R2C1:R1741C3,2,FALSE)),"Non","ok") -> Non | E222: =VLOOKUP(RC[-2],Liste!R2C2:R2001C3,2,FALSE) -> #N/A
D223: =IF(ISNA(VLOOKUP(RC[-1],Details!R2C1:R1741C3,2,FALSE)),"Non","ok") -> Non | E223: =VLOOKUP(RC[-2],Liste!R2C2:R2001C3,2,FALSE) -> #N/A
D224: =IF(ISNA(VLOOKUP(RC[-1],Details!R2C1:R1741C3,2,FALSE)),"Non","ok") -> Non | E224: =VLOOKUP(RC[-2],Liste!R2C2:R2001C3,2,FALSE) -> #N/A
D225: =IF(ISNA(VLOOKUP(RC[-1],Details!R2C1:R1741C3,2,FALSE)),"Non","ok") -> Non | E225: =VLOOKUP(RC[-2],Liste!R2C2:R2001C3,2,FALSE) -> #N/A
D226: =IF(ISNA(VLOOKUP(RC[-1],Details!R2C1:R1741C3,2,FALSE)),"Non","ok") -> Non | E226: =VLOOKUP(RC[-2],Liste!R2C2:R2001C3,2,FALSE) -> #N/A
D227: =IF(ISNA(VLOOKUP(RC[-1],Details!R2C1:R1741C3,2,FALSE)),"Non","ok") -> Non | E227: =VLOOKUP(RC[-2],Liste!R2C2:R2001C3,2,FALSE) -> #N/A
D228: =IF(ISNA(VLOOKUP(RC[-1],Details!R2C1:R1741C3,2,FALSE)),"Non","ok") -> Non | E228: =VLOOKUP(RC[-2],Liste!R2C2:R2001C3,2,FALSE) -> #N/A
D229: =IF(ISNA(VLOOKUP(RC[-1],Details!R2C1:R1741C3,2,FALSE)),"Non","ok") -> Non | E229: =VLOOKUP(RC[-2],Liste!R2C2:R2001C3,2,FALSE) -> #N/A
D230: =IF(ISNA(VLOOKUP(RC[-1],Details!R2C1:R1741C3,2,FALSE)),"Non","ok") -> Non | E230: =VLOOKUP(RC[-2],Liste!R2C2:R2001C3,2,FALSE) -> #N/A
D231: =IF(ISNA(VLOOKUP(RC[-1],Details!R2C1:R1741C3,2,FALSE)),"Non","ok") -> Non | E231: =VLOOKUP(RC[-2],Liste!R2C2:R2001C3,2,FALSE) -> #N/A
D232: =IF(ISNA(VLOOKUP(RC[-1],Details!R2C1:R1741C3,2,FALSE)),"Non","ok") -> Non | E232: =VLOOKUP(RC[-2],Liste!R2C2:R2001C3,2,FALSE) -> #N/A
D233: =IF(ISNA(VLOOKUP(RC[-1],Details!R2C1:R1741C3,2,FALSE)),"Non","ok") -> Non | E233: =VLOOKUP(RC[-2],Liste!R2C2:R2001C3,2,FALSE) -> #N/A
D234: =IF(ISNA(VLOOKUP(RC[-1],Details!R2C1:R1741C3,2,FALSE)),"Non","ok") -> Non | E234: =VLOOKUP(RC[-2],Liste!R2C2:R2001C3,2,FALSE) -> #N/A
D235: =IF(ISNA(VLOOKUP(RC[-1],Details!R2C1:R1741C3,2,FALSE)),"Non","ok") -> Non | E235: =VLOOKUP(RC[-2],Liste!R2C2:R2001C3,2,FALSE) -> #N/A
D236: =IF(ISNA(VLOOKUP(RC[-1],Details!R2C1:R1741C3,2,FALSE)),"Non","ok") -> Non | E236: =VLOOKUP(RC[-2],Liste!R2C2:R2001C3,2,FALSE) -> #N/A
D237: =IF(ISNA(VLOOKUP(RC[-1],Details!R2C1:R1741C3,2,FALSE)),"Non","ok") -> Non | E237: =VLOOKUP(RC[-2],Liste!R2C2:R2001C3,2,FALSE) -> #N/A
D238: =IF(ISNA(VLOOKUP(RC[-1],Details!R2C1:R1741C3,2,FALSE)),"Non","ok") -> Non | E238: =VLOOKUP(RC[-2],Liste!R2C2:R2001C3,2,FALSE) -> #N/A
D239: =IF(ISNA(VLOOKUP(RC[-1],Details!R2C1:R1741C3,2,FALSE)),"Non","ok") -> Non | E239: =VLOOKUP(RC[-2],Liste!R2C2:R2001C3,2,FALSE) -> #N/A
D240: =IF(ISNA(VLOOKUP(RC[-1],Details!R2C1:R1741C3,2,FALSE)),"Non","ok") -> Non | E240: =VLOOKUP(RC[-2],Liste!R2C2:R2001C3,2,FALSE) -> #N/A
D241: =IF(ISNA(VLOOKUP(RC[-1],Details!R2C1:R1741C3,2,FALSE)),"Non","ok") -> Non | E241: =VLOOKUP(RC[-2],Liste!R2C2:R2001C3,2,FALSE) -> #N/A
D242: =IF(ISNA(VLOOKUP(RC[-1],Details!R2C1:R1741C3,2,FALSE)),"Non","ok") -> Non | E242: =VLOOKUP(RC[-2],Liste!R2C2:R2001C3,2,FALSE) -> #N/A
D243: =IF(ISNA(VLOOKUP(RC[-1],Details!R2C1:R1741C3,2,FALSE)),"Non","ok") -> Non | E243: =VLOOKUP(RC[-2],Liste!R2C2:R2001C3,2,FALSE) -> #N/A
D244: =IF(ISNA(VLOOKUP(RC[-1],Details!R2C1:R1741C3,2,FALSE)),"Non","ok") -> Non | E244: =VLOOKUP(RC[-2],Liste!R2C2:R2001C3,2,FALSE) -> #N/A
D245: =IF(ISNA(VLOOKUP(RC[-1],Details!R2C1:R1741C3,2,FALSE)),"Non","ok") -> Non | E245: =VLOOKUP(RC[-2],Liste!R2C2:R2001C3,2,FALSE) -> #N/A
D246: =IF(ISNA(VLOOKUP(RC[-1],Details!R2C1:R4C3,2)),"Non","ok") -> Non | E246: =VLOOKUP(RC[-2],Liste!R2C2:R2001C3,2,FALSE) -> #N/A
D247: =IF(ISNA(VLOOKUP(RC[-1],Details!R2C1:R4C3,2)),"Non","ok") -> Non | E247: =VLOOKUP(RC[-2],Liste!R2C2:R2001C3,2,FALSE) -> #N/A
D248: =IF(ISNA(VLOOKUP(RC[-1],Details!R2C1:R4C3,2)),"Non","ok") -> Non | E248: =VLOOKUP(RC[-2],Liste!R2C2:R2001C3,2,FALSE) -> #N/A
D249: =IF(ISNA(VLOOKUP(RC[-1],Details!R2C1:R4C3,2)),"Non","ok") -> Non | E249: =VLOOKUP(RC[-2],Liste!R2C2:R2001C3,2,FALSE) -> #N/A
D250: =IF(ISNA(VLOOKUP(RC[-1],Details!R2C1:R4C3,2)),"Non","ok") -> Non | E250: =VLOOKUP(RC[-2],Liste!R2C2:R2001C3,2,FALSE) -> #N/A
D251: =IF(ISNA(VLOOKUP(RC[-1],Details!R2C1:R4C3,2)),"Non","ok") -> Non | E251: =VLOOKUP(RC[-2],Liste!R2C2:R2001C3,2,FALSE) -> #N/A
D252: =IF(ISNA(VLOOKUP(RC[-1],Details!R2C1:R4C3,2)),"Non","ok") -> Non | E252: =VLOOKUP(RC[-2],Liste!R2C2:R2001C3,2,FALSE) -> #N/A
D253: =IF(ISNA(VLOOKUP(RC[-1],Details!R2C1:R4C3,2)),"Non","ok") -> Non | E253: =VLOOKUP(RC[-2],Liste!R2C2:R2001C3,2,FALSE) -> #N/A
D254: =IF(ISNA(VLOOKUP(RC[-1],Details!R2C1:R4C3,2)),"Non","ok") -> Non | E254: =VLOOKUP(RC[-2],Liste!R2C2:R2001C3,2,FALSE) -> #N/A
D255: =IF(ISNA(VLOOKUP(RC[-1],Details!R2C1:R4C3,2)),"Non","ok") -> Non | E255: =VLOOKUP(RC[-2],Liste!R2C2:R2001C3,2,FALSE) -> #N/A
D256: =IF(ISNA(VLOOKUP(RC[-1],Details!R2C1:R4C3,2)),"Non","ok") -> Non | E256: =VLOOKUP(RC[-2],Liste!R2C2:R2001C3,2,FALSE) -> #N/A
D257: =IF(ISNA(VLOOKUP(RC[-1],Details!R2C1:R4C3,2)),"Non","ok") -> Non | E257: =VLOOKUP(RC[-2],Liste!R2C2:R2001C3,2,FALSE) -> #N/A
D258: =IF(ISNA(VLOOKUP(RC[-1],Details!R2C1:R4C3,2)),"Non","ok") -> Non | E258: =VLOOKUP(RC[-2],Liste!R2C2:R2001C3,2,FALSE) -> #N/A
D259: =IF(ISNA(VLOOKUP(RC[-1],Details!R2C1:R4C3,2)),"Non","ok") -> Non | E259: =VLOOKUP(RC[-2],Liste!R2C2:R2001C3,2,FALSE) -> #N/A
D260: =IF(ISNA(VLOOKUP(RC[-1],Details!R2C1:R4C3,2)),"Non","ok") -> Non | E260: =VLOOKUP(RC[-2],Liste!R2C2:R2001C3,2,FALSE) -> #N/A
D261: =IF(ISNA(VLOOKUP(RC[-1],Details!R2C1:R4C3,2)),"Non","ok") -> Non | E261: =VLOOKUP(RC[-2],Liste!R2C2:R2001C3,2,FALSE) -> #N/A
D262: =IF(ISNA(VLOOKUP(RC[-1],Details!R2C1:R4C3,2)),"Non","ok") -> Non | E262: =VLOOKUP(RC[-2],Liste!R2C2:R2001C3,2,FALSE) -> #N/A
D263: =IF(ISNA(VLOOKUP(RC[-1],Details!R2C1:R4C3,2)),"Non","ok") -> Non | E263: =VLOOKUP(RC[-2],Liste!R2C2:R2001C3,2,FALSE) -> #N/A
D264: =IF(ISNA(VLOOKUP(RC[-1],Details!R2C1:R4C3,2)),"Non","ok") -> Non | E264: =VLOOKUP(RC[-2],Liste!R2C2:R2001C3,2,FALSE) -> #N/A
D265: =IF(ISNA(VLOOKUP(RC[-1],Details!R2C1:R4C3,2)),"Non","ok") -> Non | E265: =VLOOKUP(RC[-2],Liste!R2C2:R2001C3,2,FALSE) -> #N/A
D266: =IF(ISNA(VLOOKUP(RC[-1],Details!R2C1:R4C3,2)),"Non","ok") -> Non | E266: =VLOOKUP(RC[-2],Liste!R2C2:R2001C3,2,FALSE) -> #N/A
D267: =IF(ISNA(VLOOKUP(RC[-1],Details!R2C1:R4C3,2)),"Non","ok") -> Non | E267: =VLOOKUP(RC[-2],Liste!R2C2:R2001C3,2,FALSE) -> #N/A
D268: =IF(ISNA(VLOOKUP(RC[-1],Details!R2C1:R4C3,2)),"Non","ok") -> Non | E268: =VLOOKUP(RC[-2],Liste!R2C2:R2001C3,2,FALSE) -> #N/A
D269: =IF(ISNA(VLOOKUP(RC[-1],Details!R2C1:R4C3,2)),"Non","ok") -> Non | E269: =VLOOKUP(RC[-2],Liste!R2C2:R2001C3,2,FALSE) -> #N/A
D270: =IF(ISNA(VLOOKUP(RC[-1],Details!R2C1:R4C3,2)),"Non","ok") -> Non | E270: =VLOOKUP(RC[-2],Liste!R2C2:R2001C3,2,FALSE) -> #N/A
D271: =IF(ISNA(VLOOKUP(RC[-1],Details!R2C1:R4C3,2)),"Non","ok") -> Non | E271: =VLOOKUP(RC[-2],Liste!R2C2:R2001C3,2,FALSE) -> #N/A
D272: =IF(ISNA(VLOOKUP(RC[-1],Details!R2C1:R4C3,2)),"Non","ok") -> Non | E272: =VLOOKUP(RC[-2],Liste!R2C2:R2001C3,2,FALSE) -> #N/A
D273: =IF(ISNA(VLOOKUP(RC[-1],Details!R2C1:R4C3,2)),"Non","ok") -> Non | E273: =VLOOKUP(RC[-2],Liste!R2C2:R2001C3,2,FALSE) -> #N/A
D274: =IF(ISNA(VLOOKUP(RC[-1],Details!R2C1:R4C3,2)),"Non","ok") -> Non | E274: =VLOOKUP(RC[-2],Liste!R2C2:R2001C3,2,FALSE) -> #N/A
D275: =IF(ISNA(VLOOKUP(RC[-1],Details!R2C1:R4C3,2)),"Non","ok") -> Non | E275: =VLOOKUP(RC[-2],Liste!R2C2:R2001C3,2,FALSE) -> #N/A
D276: =IF(ISNA(VLOOKUP(RC[-1],Details!R2C1:R4C3,2)),"Non","ok") -> Non | E276: =VLOOKUP(RC[-2],Liste!R2C2:R2001C3,2,FALSE) -> #N/A
D277: =IF(ISNA(VLOOKUP(RC[-1],Details!R2C1:R4C3,2)),"Non","ok") -> Non
D278: =IF(ISNA(VLOOKUP(RC[-1],Details!R2C1:R4C3,2)),"Non","ok") -> Non
D279: =IF(ISNA(VLOOKUP(RC[-1],Details!R2C1:R4C3,2)),"Non","ok") -> Non
D280: =IF(ISNA(VLOOKUP(RC[-1],Details!R2C1:R4C3,2)),"Non","ok") -> Non
D281: =IF(ISNA(VLOOKUP(RC[-1],Details!R2C1:R4C3,2)),"Non","ok") -> Non
D282: =IF(ISNA(VLOOKUP(RC[-1],Details!R2C1:R4C3,2)),"Non","ok") -> Non
D283: =IF(ISNA(VLOOKUP(RC[-1],Details!R2C1:R4C3,2)),"Non","ok") -> Non
D284: =IF(ISNA(VLOOKUP(RC[-1],Details!R2C1:R4C3,2)),"Non","ok") -> Non
D285: =IF(ISNA(VLOOKUP(RC[-1],Details!R2C1:R4C3,2)),"Non","ok") -> Non
D286: =IF(ISNA(VLOOKUP(RC[-1],Details!R2C1:R4C3,2)),"Non","ok") -> Non
D287: =IF(ISNA(VLOOKUP(RC[-1],Details!R2C1:R4C3,2)),"Non","ok") -> Non
D288: =IF(ISNA(VLOOKUP(RC[-1],Details!R2C1:R4C3,2)),"Non","ok") -> Non
D289: =IF(ISNA(VLOOKUP(RC[-1],Details!R2C1:R4C3,2)),"Non","ok") -> Non
D290: =IF(ISNA(VLOOKUP(RC[-1],Details!R2C1:R4C3,2)),"Non","ok") -> Non
D291: =IF(ISNA(VLOOKUP(RC[-1],Details!R2C1:R4C3,2)),"Non","ok") -> Non
D292: =IF(ISNA(VLOOKUP(RC[-1],Details!R2C1:R4C3,2)),"Non","ok") -> Non
D293: =IF(ISNA(VLOOKUP(RC[-1],Details!R2C1:R4C3,2)),"Non","ok") -> Non
D294: =IF(ISNA(VLOOKUP(RC[-1],Details!R2C1:R4C3,2)),"Non","ok") -> Non
D295: =IF(ISNA(VLOOKUP(RC[-1],Details!R2C1:R4C3,2)),"Non","ok") -> Non
D296: =IF(ISNA(VLOOKUP(RC[-1],Details!R2C1:R4C3,2)),"Non","ok") -> Non
D297: =IF(ISNA(VLOOKUP(RC[-1],Details!R2C1:R4C3,2)),"Non","ok") -> Non
D298: =IF(ISNA(VLOOKUP(RC[-1],Details!R2C1:R4C3,2)),"Non","ok") -> Non
D299: =IF(ISNA(VLOOKUP(RC[-1],Details!R2C1:R4C3,2)),"Non","ok") -> Non
D300: =IF(ISNA(VLOOKUP(RC[-1],Details!R2C1:R4C3,2)),"Non","ok") -> Non
D301: =IF(ISNA(VLOOKUP(RC[-1],Details!R2C1:R4C3,2)),"Non","ok") -> Non
D302: =IF(ISNA(VLOOKUP(RC[-1],Details!R2C1:R4C3,2)),"Non","ok") -> Non
D303: =IF(ISNA(VLOOKUP(RC[-1],Details!R2C1:R4C3,2)),"Non","ok") -> Non
D304: =IF(ISNA(VLOOKUP(RC[-1],Details!R2C1:R4C3,2)),"Non","ok") -> Non
D305: =IF(ISNA(VLOOKUP(RC[-1],Details!R2C1:R4C3,2)),"Non","ok") -> Non
D306: =IF(ISNA(VLOOKUP(RC[-1],Details!R2C1:R4C3,2)),"Non","ok") -> Non
D307: =IF(ISNA(VLOOKUP(RC[-1],Details!R2C1:R4C3,2)),"Non","ok") -> Non
D308: =IF(ISNA(VLOOKUP(RC[-1],Details!R2C1:R4C3,2)),"Non","ok") -> Non
D309: =IF(ISNA(VLOOKUP(RC[-1],Details!R2C1:R4C3,2)),"Non","ok") -> Non
D310: =IF(ISNA(VLOOKUP(RC[-1],Details!R2C1:R4C3,2)),"Non","ok") -> Non
D311: =IF(ISNA(VLOOKUP(RC[-1],Details!R2C1:R4C3,2)),"Non","ok") -> Non
D312: =IF(ISNA(VLOOKUP(RC[-1],Details!R2C1:R4C3,2)),"Non","ok") -> Non
D313: =IF(ISNA(VLOOKUP(RC[-1],Details!R2C1:R4C3,2)),"Non","ok") -> Non

Sheet: Details
A1: ref | C1: FRENCH PRODUCT NAME | D1: PRODUCT | E1: PHOTOS | F1: FEATURES | G1: LOGO & LOGO SIZE | H1: PACKING | I1: FRENCH REFERENCE | J1: EAN
A2: 1491 | B2: =IF(ISNA(VLOOKUP(RC[-1],Import!R3C3:R2000C3,1,FALSE)),"","1") ->  | C2: 1 - CORDE DE TIRAGE | D2: TRICEPS ROPE WITH RUBBER ENDS | F2: Dimensions: 70 cm | H2: 0,85 kgs | I2: =RC[-8] -> 1491 | J2: =VLOOKUP(RC[-9],'/Users/marcvilfeu/Dropbox/HLDP/Docs importants/[Commande Fournisseurs.xlsm]COMPARATIF'!R4C28:R2500C52,9,FALSE) -> 3760223791419
A3: 1518 | B3: =IF(ISNA(VLOOKUP(RC[-1],Import!R3C3:R2000C3,1,FALSE)),"","1") ->  | C3: 2 - TRIANGLE DE TIRAGE AVEC POIGNEES | D3: 2 - Machine accessories | F3: Dimension: 13cm | I3: =RC[-8] -> 1518 | J3: =VLOOKUP(RC[-9],'/Users/marcvilfeu/Dropbox/HLDP/Docs importants/[Commande Fournisseurs.xlsm]COMPARATIF'!R4C28:R2500C52,9,FALSE) -> 3760223793659
A4: 1686 | B4: =IF(ISNA(VLOOKUP(RC[-1],Import!R3C3:R2000C3,1,FALSE)),"","1") ->  | C4: 3 - POIGNEE DE TIRAGE | D4: 3 - Machine accessories | F4: Dimension: 14cm | I4: =RC[-8] -> 1686 | J4: =VLOOKUP(RC[-9],'/Users/marcvilfeu/Dropbox/HLDP/Docs importants/[Commande Fournisseurs.xlsm]COMPARATIF'!R4C28:R2500C52,9,FALSE) -> 3760223793666
A5: 1459 | B5: =IF(ISNA(VLOOKUP(RC[-1],Import!R3C3:R2000C3,1,FALSE)),"","1") ->  | C5: 4 - BARRE ROWING DE TIRAGE DORSAL | D5: 4 - Machine accessories | F5: Dimension: 96cm | I5: =RC[-8] -> 1459 | J5: =VLOOKUP(RC[-9],'/Users/marcvilfeu/Dropbox/HLDP/Docs importants/[Commande Fournisseurs.xlsm]COMPARATIF'!R4C28:R2500C52,9,FALSE) -> 3760223791433
A6: 1457 | B6: =IF(ISNA(VLOOKUP(RC[-1],Import!R3C3:R2000C3,1,FALSE)),"","1") ->  | C6: 5 - BARRE ROWING BICEPS TRICEPS | D6: 5 - Machine accessories | F6: Dimension: 50cm | I6: =RC[-8] -> 1457 | J6: =VLOOKUP(RC[-9],'/Users/marcvilfeu/Dropbox/HLDP/Docs importants/[Commande Fournisseurs.xlsm]COMPARATIF'!R4C28:R2500C52,9,FALSE) -> 3760223791440
A7: 1520 | B7: =IF(ISNA(VLOOKUP(RC[-1],Import!R3C3:R2000C3,1,FALSE)),"","1") ->  | C7: 6 - DOUBLE POIGNEES DE TIRAGE BICEPS-TRICEPS | D7: 6 - Machine accessories | F7: Dimension: 50cm | I7: =RC[-8] -> 1520 | J7: =VLOOKUP(RC[-9],'/Users/marcvilfeu/Dropbox/HLDP/Docs importants/[Commande Fournisseurs.xlsm]COMPARATIF'!R4C28:R2500C52,9,FALSE) -> 3760223790931
A8: 1519 | B8: =IF(ISNA(VLOOKUP(RC[-1],Import!R3C3:R2000C3,1,FALSE)),"","1") ->  | D8: 7 - Machine accessories | F8: Dimension: 36cm | I8: =RC[-8] -> 1519 | J8: =VLOOKUP(RC[-9],'/Users/marcvilfeu/Dropbox/HLDP/Docs importants/[Commande Fournisseurs.xlsm]COMPARATIF'!R4C28:R2500C52,9,FALSE) -> 3760223790948
A9: 1521 | B9: =IF(ISNA(VLOOKUP(RC[-1],Import!R3C3:R2000C3,1,FALSE)),"","1") ->  | C9: 8 - DOUBLE POIGNEE ROWING DE TIRAGE DORSAL | D9: 8 - Machine accessories | F9: Dimension: 40cm | I9: =RC[-8] -> 1521 | J9: =VLOOKUP(RC[-9],'/Users/marcvilfeu/Dropbox/HLDP/Docs importants/[Commande Fournisseurs.xlsm]COMPARATIF'!R4C28:R2500C52,9,FALSE) -> 3760223791457
A10: 1517 | B10: =IF(ISNA(VLOOKUP(RC[-1],Import!R3C3:R2000C3,1,FALSE)),"","1") ->  | C10: 9 - TRIANGLE DE TIRAGE | D10: 9 - Machine accessories | F10: Dimension: 36cm | I10: =RC[-8] -> 1517 | J10: =VLOOKUP(RC[-9],'/Users/marcvilfeu/Dropbox/HLDP/Docs importants/[Commande Fournisseurs.xlsm]COMPARATIF'!R4C28:R2500C52,9,FALSE) -> 3760223791464
A11: 1456 | B11: =IF(ISNA(VLOOKUP(RC[-1],Import!R3C3:R2000C3,1,FALSE)),"","1") ->  | C11: 10 - BARRE DROITE DE TIRAGE DORSAL | D11: 10 - Machine accessories | F11: Dimension: 122cm | I11: =RC[-8] -> 1456 | J11: =VLOOKUP(RC[-9],'/Users/marcvilfeu/Dropbox/HLDP/Docs importants/[Commande Fournisseurs.xlsm]COMPARATIF'!R4C28:R2500C52,9,FALSE) -> 3760223791426
A12: 3397 | B12: =IF(ISNA(VLOOKUP(RC[-1],Import!R3C3:R2000C3,1,FALSE)),"","1") ->  | C12: AB SLINGS | D12: Ab Slings | F12: Dimensions : 30 × 25 × 5 cm Brushed nylon lining for enhanced comfort Forged steel carabineers lock on to any universal gym | H12: Gross Weight: 0,6 kgs | I12: =RC[-8] -> 3397 | J12: =VLOOKUP(RC[-9],'/Users/marcvilfeu/Dropbox/HLDP/Docs importants/[Commande Fournisseurs.xlsm]COMPARATIF'!R4C28:R2500C52,9,FALSE) -> 3760223792201
A13: 1725 | B13: =IF(ISNA(VLOOKUP(RC[-1],Import!R3C3:R2000C3,1,FALSE)),"","1") ->  | C13: AB WHEEL | D13: Ab Wheel | F13: Plastic wheel with metal structure Handles covered with Rubber Non-slip discs around of wheels Inside pantone color: yellow pantone 102C Size: 18*26 cm Diameter: 19 cm | H13: Gross Weight: 0,5 kgs Colorbox | I13: =RC[-8] -> 1725 | J13: =VLOOKUP(RC[-9],'/Users/marcvilfeu/Dropbox/HLDP/Docs importants/[Commande Fournisseurs.xlsm]COMPARATIF'!R4C28:R2500C52,9,FALSE) -> 3760223792218
A14: 2025 | B14: =IF(ISNA(VLOOKUP(RC[-1],Import!R3C3:R2000C3,1,FALSE)),"","1") ->  | C14: AB WHEEL PRO | D14: Ab Wheel Pro | F14: Dimensions: 54,5x34,5cm Handles covered with foam Straps to hold the shoes Molded plastic discs iron rod with comfortable grip | H14: Gross Weight: 2,95 kgs Colorbox | I14: =RC[-8] -> 2025 | J14: =VLOOKUP(RC[-9],'/Users/marcvilfeu/Dropbox/HLDP/Docs importants/[Commande Fournisseurs.xlsm]COMPARATIF'!R4C28:R2500C52,9,FALSE) -> 3760223790405
A15: 2980 | B15: =IF(ISNA(VLOOKUP(RC[-1],Import!R3C3:R2000C3,1,FALSE)),"","1") ->  | C15: COUSSIN APPUI LOMBAIRE | D15: Ab-Mat | F15: Dimensions : 36.5 x 30.5 x 7.5cm Color: black LOGO : Leaderfit, in Yellow (pantone 102C) on both sides | H15: Gross Weight: 1 kg | I15: =RC[-8] -> 2980 | J15: =VLOOKUP(RC[-9],'/Users/marcvilfeu/Dropbox/HLDP/Docs importants/[Commande Fournisseurs.xlsm]COMPARATIF'!R4C28:R2500C52,9,FALSE) -> 3760223792225
A16: 1980 | B16: =IF(ISNA(VLOOKUP(RC[-1],Import!R3C3:R2000C3,1,FALSE)),"","1") ->  | C16: COUSSIN APPUI LOMBAIRE PRO | D16: Ab-Mat | F16: SIZE:30*36*60MM Weight: 650g Color: black LOGO : Leaderfit, in Yellow (pantone 102C) | H16: Gross Weight: 0,8 kg | I16: =RC[-8] -> 1980 | J16: =VLOOKUP(RC[-9],'/Users/marcvilfeu/Dropbox/HLDP/Docs importants/[Commande Fournisseurs.xlsm]COMPARATIF'!R4C28:R2500C52,9,FALSE) -> 3760223794007
A17: 1430 | B17: =IF(ISNA(VLOOKUP(RC[-1],Import!R3C3:R2000C3,1,FALSE)),"","1") ->  | C17: ANNEAU BALLONS FITNESS | D17: GYM BALL STACKER | F17: Color: Transparent Attached with velcro Dimensions: 1.6mm x 14cm x120cm Material:PET Velcro attached dimensions: 8 x 5 cm Sold by set of 3 | H17: packed by set of 3. Gross Weight: 0,15 kgs | I17: =RC[-8] -> 1430 | J17: =VLOOKUP(RC[-9],'/Users/marcvilfeu/Dropbox/HLDP/Docs importants/[Commande Fournisseurs.xlsm]COMPARATIF'!R4C28:R2500C52,9,FALSE) -> 3760223790801
A18: 2341 | B18: =IF(ISNA(VLOOKUP(RC[-1],Import!R3C3:R2000C3,1,FALSE)),"","1") ->  | C18: ANNEAUX DE SUSPENSION | D18: CLASSIC GYM RINGS | F18: Diameter: 23,5 cm Length of the straps: 4,5 m Width of the straps: 2,5 cm Material: ABS Sold by pair | H18: Gross Weight: 1,1 kg PE bag into white box to avoid rust | I18: =RC[-8] -> 2341 | J18: =VLOOKUP(RC[-9],'/Users/marcvilfeu/Dropbox/HLDP/Docs importants/[Commande Fournisseurs.xlsm]COMPARATIF'!R4C28:R2500C52,9,FALSE) -> 3760223791471
A19: 4008 | B19: =IF(ISNA(VLOOKUP(RC[-1],Import!R3C3:R2000C3,1,FALSE)),"","1") ->  | C19: ANNEAUX DE SUSPENSION BOIS | D19: WOODEN GYM RINGS | F19: Diameter: 23,5 cm Length of the straps: 4,5 m Width of the straps: 2,5 cm Material: natural wood Sold by pair | H19: Gross Weight: 1,1 kg PE bag into white box carton to avoid rust | I19: =RC[-8] -> 4008 | J19: =VLOOKUP(RC[-9],'/Users/marcvilfeu/Dropbox/HLDP/Docs importants/[Commande Fournisseurs.xlsm]COMPARATIF'!R4C28:R2500C52,9,FALSE) -> 3760223790412
A20: 2363 | B20: =IF(ISNA(VLOOKUP(RC[-1],Import!R3C3:R2000C3,1,FALSE)),"","1") ->  | C20: BAGUES STOP DISQUES 50MM | D20: COLLARS FOR OLYMPIC BAR | F20: Inside diameter: 51 mm Sold by pair LOGO: “LEADERFIT” printed in white. | H20: Gross Weight: 0,45 kgs | I20: =RC[-8] -> 2363 | J20: =VLOOKUP(RC[-9],'/Users/marcvilfeu/Dropbox/HLDP/Docs importants/[Commande Fournisseurs.xlsm]COMPARATIF'!R4C28:R2500C52,9,FALSE) -> 3760223791488
A21: 2365 | B21: =IF(ISNA(VLOOKUP(RC[-1],Import!R3C3:R2000C3,1,FALSE)),"","1") ->  | C21: BAGUES STOP DISQUES 30MM | D21: COLLARS FOR REGULAR BAR | F21: Inside diameter: 30 mm Sold by pair Color: Black and green (pantone 361C) LOGO: “LEADERFIT” printed in white on the edge | H21: Gross Weight: 0,25 kgs | I21: =RC[-8] -> 2365 | J21: =VLOOKUP(RC[-9],'/Users/marcvilfeu/Dropbox/HLDP/Docs importants/[Commande Fournisseurs.xlsm]COMPARATIF'!R4C28:R2500C52,9,FALSE) -> 3760223792232
A22: 1436 | B22: =IF(ISNA(VLOOKUP(RC[-1],Import!R3C3:R2000C3,1,FALSE)),"","1") ->  | C22: BALANCE BOARD | D22: WOODEN BALANCE BOARD | F22: Material: wood Diameter 40 cm Height: 50mm LOGO: “LF’ Pilates”, in black | H22: Gross Weight: 1,35 kgs | I22: =RC[-8] -> 1436 | J22: =VLOOKUP(RC[-9],'/Users/marcvilfeu/Dropbox/HLDP/Docs importants/[Commande Fournisseurs.xlsm]COMPARATIF'!R4C28:R2500C52,9,FALSE) -> 3760223792249
A23: 1437 | B23: =IF(ISNA(VLOOKUP(RC[-1],Import!R3C3:R2000C3,1,FALSE)),"","1") ->  | C23: BALLE A REACTION | D23: RUBBER REACTION BALL | F23: Material: rubber Color: Red/Blue/Orange or Yellow Net Weight: 60g | H23: 1pc/double blister, 12pcs/inner box, 72pcs/ctn | I23: =RC[-8] -> 1437 | J23: =VLOOKUP(RC[-9],'/Users/marcvilfeu/Dropbox/HLDP/Docs importants/[Commande Fournisseurs.xlsm]COMPARATIF'!R4C28:R2500C52,9,FALSE) -> 3760223792256
A24: 1989 | B24: =IF(ISNA(VLOOKUP(RC[-1],Import!R3C3:R2000C3,1,FALSE)),"","1") ->  | C24: BALANCE CUSHION | D24: BALANCE CUSHION | F24: SIZE:52CM*25CM(H) Weight: 300g Color: Blue | I24: =RC[-8] -> 1989 | J24: =VLOOKUP(RC[-9],'/Users/marcvilfeu/Dropbox/HLDP/Docs importants/[Commande Fournisseurs.xlsm]COMPARATIF'!R4C28:R2500C52,9,FALSE) -> 3760223794014
A25: 1438 | B25: =IF(ISNA(VLOOKUP(RC[-1],Import!R3C3:R2000C3,1,FALSE)),"","1") ->  | C25: BALLE PICOTS | D25: SOFT MASSAGE BALL | F25: Diameter: 8 cm Density: 55°, Soft Color: Purple (pantone 255C) | H25: Colorbox | I25: =RC[-8] -> 1438 | J25: =VLOOKUP(RC[-9],'/Users/marcvilfeu/Dropbox/HLDP/Docs importants/[Commande Fournisseurs.xlsm]COMPARATIF'!R4C28:R2500C52,9,FALSE) -> 3760223791051
A26: 1439 | B26: =IF(ISNA(VLOOKUP(RC[-1],Import!R3C3:R2000C3,1,FALSE)),"","1") ->  | C26: BALLES LESTEES 0,5KG BLEU | D26: WEIGHTED BALL 0,5 kgs, Blue | F26: Diameter: 10cm(0,5kgs), 12cm(1kg), 13cm(1,5kgs) Weight: 0,5/1/1,5/2 kgs The weight must be printed on the ball, in white. Color: Blue (pantone 300C) or Grey (pantone 877C), according to the PI Sold by pair Filled with sand Material: PVC LOGO: “LF’Pilates”, printed in white on blue balls, and in black on grey balls | H26: 2pcs/Colorbox | I26: =RC[-8] -> 1439 | J26: =VLOOKUP(RC[-9],'/Users/marcvilfeu/Dropbox/HLDP/Docs importants/[Commande Fournisseurs.xlsm]COMPARATIF'!R4C28:R2500C52,9,FALSE) -> 3760223790351
A27: 1442 | B27: =IF(ISNA(VLOOKUP(RC[-1],Import!R3C3:R2000C3,1,FALSE)),"","1") ->  | C27: BALLES LESTEES 0,5KG GRIS | D27: WEIGHTED BALL 0,5 kgs, Grey | I27: =RC[-8] -> 1442 | J27: =VLOOKUP(RC[-9],'/Users/marcvilfeu/Dropbox/HLDP/Docs importants/[Commande Fournisseurs.xlsm]COMPARATIF'!R4C28:R2500C52,9,FALSE) -> 3760223790184
A28: 1441 | B28: =IF(ISNA(VLOOKUP(RC[-1],Import!R3C3:R2000C3,1,FALSE)),"","1") ->  | C28: BALLES LESTEES 1KG BLEU | D28: WEIGHTED BALL 1 kg, Blue | I28: =RC[-8] -> 1441 | J28: =VLOOKUP(RC[-9],'/Users/marcvilfeu/Dropbox/HLDP/Docs importants/[Commande Fournisseurs.xlsm]COMPARATIF'!R4C28:R2500C52,9,FALSE) -> 3760223790368
A29: 1444 | B29: =IF(ISNA(VLOOKUP(RC[-1],Import!R3C3:R2000C3,1,FALSE)),"","1") ->  | C29: BALLES LESTEES 1KG GRIS | D29: WEIGHTED BALL 1 kg, Grey | I29: =RC[-8] -> 1444 | J29: =VLOOKUP(RC[-9],'/Users/marcvilfeu/Dropbox/HLDP/Docs importants/[Commande Fournisseurs.xlsm]COMPARATIF'!R4C28:R2500C52,9,FALSE) -> 3760223791952
A30: 1440 | B30: =IF(ISNA(VLOOKUP(RC[-1],Import!R3C3:R2000C3,1,FALSE)),"","1") ->  | C30: BALLES LESTEES 1,5KG BLEU | D30: WEIGHTED BALL 1,5 kg, Blue | I30: =RC[-8] -> 1440 | J30: =VLOOKUP(RC[-9],'/Users/marcvilfeu/Dropbox/HLDP/Docs importants/[Commande Fournisseurs.xlsm]COMPARATIF'!R4C28:R2500C52,9,FALSE) -> 3760223790382
A31: 1443 | B31: =IF(ISNA(VLOOKUP(RC[-1],Import!R3C3:R2000C3,1,FALSE)),"","1") ->  | C31: BALLES LESTEES 1,5KG GRIS | D31: WEIGHTED BALL 1 kg, Grey | I31: =RC[-8] -> 1443 | J31: =VLOOKUP(RC[-9],'/Users/marcvilfeu/Dropbox/HLDP/Docs importants/[Commande Fournisseurs.xlsm]COMPARATIF'!R4C28:R2500C52,9,FALSE) -> 3760223792263
A32: 3212 | B32: =IF(ISNA(VLOOKUP(RC[-1],Import!R3C3:R2000C3,1,FALSE)),"","1") ->  | C32: BALLON FITNESS 55CM BLEU | D32: ANTI-BURST GYM BALL 55CM BLUE | F32: Diameter: 55/65/75 cm Color: Blue (pantone 300C) or Grey (pantone 877C), according to the PI Anti-burst Gymballs Material: PVC Maximum user weight limit: 110kg Tested to 300kgs The shape must be well round once pumped. Weight: 55cm (800g), 65cm (984g, 0,80mm thick), 75cm (1200g) Thick tolerance within 10%. The weight tolerance controled as +-5g. LOGO: “LF’Pilates”, printed in white on blue balls, and in black on grey balls | H32: 1pc/colorbox The colorbox and the manual are translated in french. | I32: =RC[-8] -> 3212 | J32: =VLOOKUP(RC[-9],'/Users/marcvilfeu/Dropbox/HLDP/Docs importants/[Commande Fournisseurs.xlsm]COMPARATIF'!R4C28:R2500C52,9,FALSE) -> 3760223790085
A33: 2666 | B33: =IF(ISNA(VLOOKUP(RC[-1],Import!R3C3:R2000C3,1,FALSE)),"","1") ->  | C33: BALLON FITNESS 55CM GRIS | D33: ANTI-BURST GYM BALL 55CM GREY | I33: =RC[-8] -> 2666 | J33: =VLOOKUP(RC[-9],'/Users/marcvilfeu/Dropbox/HLDP/Docs importants/[Commande Fournisseurs.xlsm]COMPARATIF'!R4C28:R2500C52,9,FALSE) -> 3760223790641
A34: 1571 | B34: =IF(ISNA(VLOOKUP(RC[-1],Import!R3C3:R2000C3,1,FALSE)),"","1") ->  | C34: BALLON FITNESS 65CM BLEU | D34: ANTI-BURST GYM BALL 65CM BLUE | I34: =RC[-8] -> 1571 | J34: =VLOOKUP(RC[-9],'/Users/marcvilfeu/Dropbox/HLDP/Docs importants/[Commande Fournisseurs.xlsm]COMPARATIF'!R4C28:R2500C52,9,FALSE) -> 3760223790108
A35: 1572 | B35: =IF(ISNA(VLOOKUP(RC[-1],Import!R3C3:R2000C3,1,FALSE)),"","1") ->  | C35: BALLON FITNESS 65CM GRIS | D35: ANTI-BURST GYM BALL 65CM GREY | I35: =RC[-8] -> 1572 | J35: =VLOOKUP(RC[-9],'/Users/marcvilfeu/Dropbox/HLDP/Docs importants/[Commande Fournisseurs.xlsm]COMPARATIF'!R4C28:R2500C52,9,FALSE) -> 3760223790207
A36: 1574 | B36: =IF(ISNA(VLOOKUP(RC[-1],Import!R3C3:R2000C3,1,FALSE)),"","1") ->  | C36: BALLON FITNESS 75CM GRIS | D36: ANTI-BURST GYM BALL 75CM GREY | I36: =RC[-8] -> 1574 | J36: =VLOOKUP(RC[-9],'/Users/marcvilfeu/Dropbox/HLDP/Docs importants/[Commande Fournisseurs.xlsm]COMPARATIF'!R4C28:R2500C52,9,FALSE) -> 3760223790115
A37: 1445 | B37: =IF(ISNA(VLOOKUP(RC[-1],Import!R3C3:R2000C3,1,FALSE)),"","1") ->  | C37: BALLON PAILLE BLEU | D37: AEROBIC BALL 25cm Blue | F37: Diameter: 26 cm, weight: 153g, Thickness: 0,70mm Thick tolerance within 10%. The weight tolerance controled as +-5g. Color: Blue (pantone 300C) Grey (pantone 877C ) Material: PVC A straw and a cap are included with each ball The shape must be well round once pumped. LOGO: “LF’Pilates”, printed in white Length of the caps: 5cm A recess must be present where the cap is put, so that customer doesnt feel the cap | H37: 1pc/polybag | I37: =RC[-8] -> 1445 | J37: =VLOOKUP(RC[-9],'/Users/marcvilfeu/Dropbox/HLDP/Docs importants/[Commande Fournisseurs.xlsm]COMPARATIF'!R4C28:R2500C52,9,FALSE) -> 3760223790344
A38: 1449 | B38: =IF(ISNA(VLOOKUP(RC[-1],Import!R3C3:R2000C3,1,FALSE)),"","1") ->  | C38: BALLON PAILLE GRIS | D38: AEROBIC BALL 25cm Grey | I38: =RC[-8] -> 1449 | J38: =VLOOKUP(RC[-9],'/Users/marcvilfeu/Dropbox/HLDP/Docs importants/[Commande Fournisseurs.xlsm]COMPARATIF'!R4C28:R2500C52,9,FALSE) -> 3760223794311
A39: 1446 | B39: =IF(ISNA(VLOOKUP(RC[-1],Import!R3C3:R2000C3,1,FALSE)),"","1") ->  | C39: BALLON PAILLE ROSE | D39: AEROBIC BALL 25cm Pink | I39: =RC[-8] -> 1446 | J39: =VLOOKUP(RC[-9],'/Users/marcvilfeu/Dropbox/HLDP/Docs importants/[Commande Fournisseurs.xlsm]COMPARATIF'!R4C28:R2500C52,9,FALSE) -> 3760223791969
A40: 1447 | B40: =IF(ISNA(VLOOKUP(RC[-1],Import!R3C3:R2000C3,1,FALSE)),"","1") ->  | C40: BALLON PAILLE VIOLET | D40: AEROBIC BALL 25cm Purple | I40: =RC[-8] -> 1447 | J40: =VLOOKUP(RC[-9],'/Users/marcvilfeu/Dropbox/HLDP/Docs importants/[Commande Fournisseurs.xlsm]COMPARATIF'!R4C28:R2500C52,9,FALSE) -> 3760223791976
A41: 2230 | B41: =IF(ISNA(VLOOKUP(RC[-1],Import!R3C3:R2000C3,1,FALSE)),"","1") ->  | C41: COMMERCIAL BENCH CROSS TRAINING | D41: COMMERCIAL BENCH CROSSFIT | F41: Assembly size: 135*67*115 cm Steel frame: 70*50mm | H41: Gross Weight: 34 kg | I41: =RC[-8] -> 2230 | J41: =VLOOKUP(RC[-9],'/Users/marcvilfeu/Dropbox/HLDP/Docs importants/[Commande Fournisseurs.xlsm]COMPARATIF'!R4C28:R2500C52,9,FALSE) -> 3760223790863
A42: 1548 | B42: =IF(ISNA(VLOOKUP(RC[-1],Import!R3C3:R2000C3,1,FALSE)),"","1") ->  | C42: BANDE LATEX (LOT DE 3) | D42: Latex Band | F42: Length: 120cm Résistance light (red, 35mm) / medium (blue, 55mm) / strong (purple, 65mm) | I42: =RC[-8] -> 1548 | J42: =VLOOKUP(RC[-9],'/Users/marcvilfeu/Dropbox/HLDP/Docs importants/[Commande Fournisseurs.xlsm]COMPARATIF'!R4C28:R2500C52,9,FALSE) -> 3760223791068
A43: 2902 | B43: =IF(ISNA(VLOOKUP(RC[-1],Import!R3C3:R2000C3,1,FALSE)),"","1") ->  | C43: BANDES LESTEES CHEVILLE 2X0,5KG | D43: ANKLE WEIGHT 2X0,5 KGS | F43: Weight: 2x0,5kg or 2x1kg, according to PI Color: Black & Grey, yellow trim for 0,5kgs and green trim for 1kg (photo is green trim) Material: Neoprene Content: iron sand fills LOGO: Leaderfit, in pink or yellow on the grey part. | H43: Colorbox | I43: =RC[-8] -> 2902 | J43: =VLOOKUP(RC[-9],'/Users/marcvilfeu/Dropbox/HLDP/Docs importants/[Commande Fournisseurs.xlsm]COMPARATIF'!R4C28:R2500C52,9,FALSE) -> 3760223792287
A44: 1450 | B44: =IF(ISNA(VLOOKUP(RC[-1],Import!R3C3:R2000C3,1,FALSE)),"","1") ->  | C44: BANDES LESTEES CHEVILLE 2X1KG | D44: ANKLE WEIGHT 2X1 KGS | I44: =RC[-8] -> 1450 | J44: =VLOOKUP(RC[-9],'/Users/marcvilfeu/Dropbox/HLDP/Docs importants/[Commande Fournisseurs.xlsm]COMPARATIF'!R4C28:R2500C52,9,FALSE) -> 3760223793581
A45: 1969 | B45: =IF(ISNA(VLOOKUP(RC[-1],Import!R3C3:R2000C3,1,FALSE)),"","1") ->  | C45: BANDES LESTEES POIGNET 2X0,25KG | D45: Soft Hand Jogging Gloves | F45: Weight: 2 x 0,25 kg Color: Black with pink trim Material: Neoprene Content: iron sand fills LOGO: Leaderfit, in white. | H45: 0,55 kg | I45: =RC[-8] -> 1969 | J45: =VLOOKUP(RC[-9],'/Users/marcvilfeu/Dropbox/HLDP/Docs importants/[Commande Fournisseurs.xlsm]COMPARATIF'!R4C28:R2500C52,9,FALSE) -> 3760223793741
A46: 1451 | B46: =IF(ISNA(VLOOKUP(RC[-1],Import!R3C3:R2000C3,1,FALSE)),"","1") ->  | C46: BANDES LESTEES POIGNET 2X0,5KG | D46: Soft Hand Jogging Gloves | F46: Weight: 2 x 0,5 kg Color: Black with yellow trim Material: Neoprene Content: iron sand fills LOGO: Leaderfit, in white. | H46: 1,1 kgs | I46: =RC[-8] -> 1451 | J46: =VLOOKUP(RC[-9],'/Users/marcvilfeu/Dropbox/HLDP/Docs importants/[Commande Fournisseurs.xlsm]COMPARATIF'!R4C28:R2500C52,9,FALSE) -> 3760223792294
A47: 1451 | B47: =IF(ISNA(VLOOKUP(RC[-1],Import!R3C3:R2000C3,1,FALSE)),"","1") ->  | C47: BANDES LESTEES POIGNET 2X0,5KG | D47: WRIST WEIGHT 2X0,5 KG | F47: Weight: 2 x 0,5 kg Color: Blue & black Material: Neoprene Content: iron sand fills LOGO: Leaderfit Equipement, in white. | H47: 1,2 kgs | I47: =RC[-8] -> 1451 | J47: =VLOOKUP(RC[-9],'/Users/marcvilfeu/Dropbox/HLDP/Docs importants/[Commande Fournisseurs.xlsm]COMPARATIF'!R4C28:R2500C52,9,FALSE) -> 3760223792294
A48: 2359 | B48: =IF(ISNA(VLOOKUP(RC[-1],Import!R3C3:R2000C3,1,FALSE)),"","1") ->  | C48: BARRE KIT PUMP RENFORCEE | D48: Pump set bar reinforced | F48: 1 rubber coated hollow steel bar Length 1,40m Can hold up to 40kgs | I48: =RC[-8] -> 2359 | J48: =VLOOKUP(RC[-9],'/Users/marcvilfeu/Dropbox/HLDP/Docs importants/[Commande Fournisseurs.xlsm]COMPARATIF'!R4C28:R2500C52,9,FALSE) -> 3760223793703
A49: 3408 | B49: =IF(ISNA(VLOOKUP(RC[-1],Import!R3C3:R2000C3,1,FALSE)),"","1") ->  | C49: BARRE CROSS TRAINING HOMME 28MM | D49: OB86 20kg MEN Crossfit Bar | F49: Length: 220cm LOGO: “LEADERFIT” on both ends of the bar. Aluminum label clipped. Hard Chrome Bar Material: Alloy Steel Handle Diameter: 28mm With 8 needle bearings and brass brushing Maximum capacity: 1000lbs Net weight: 20kgs | H49: Gross Weight: 21 kg | I49: =RC[-8] -> 3408 | J49: =VLOOKUP(RC[-9],'/Users/marcvilfeu/Dropbox/HLDP/Docs importants/[Commande Fournisseurs.xlsm]COMPARATIF'!R4C28:R2500C52,9,FALSE) -> 3760223791495
A50: 3407 | B50: =IF(ISNA(VLOOKUP(RC[-1],Import!R3C3:R2000C3,1,FALSE)),"","1") ->  | C50: BARRE CROSS TRAINING FEMME 25MM | D50: OB86 15kg WOMEN Crossfit Bar | F50: Length: 201cm LOGO: “LEADERFIT” on both ends of the bar. Aluminum label clipped. Hard Chrome Bar Material: Alloy Steel Handle Diameter: 25mm With 8 needle bearings and brass brushing Maximum capacity: 800lbs Net weight: 15kgs | H50: Gross Weight: 16 kg | I50: =RC[-8] -> 3407 | J50: =VLOOKUP(RC[-9],'/Users/marcvilfeu/Dropbox/HLDP/Docs importants/[Commande Fournisseurs.xlsm]COMPARATIF'!R4C28:R2500C52,9,FALSE) -> 3760223792317
A51: 1452 | B51: =IF(ISNA(VLOOKUP(RC[-1],Import!R3C3:R2000C3,1,FALSE)),"","1") ->  | C51: BARRE CURL EZ 120CM | D51: CURL BAR EZ 120CM | F51: Length: 120cm LOGO: “LEADERFIT” on both ends of the bar. Aluminum label clipped. Material: Q45 Steel Handle Diameter: 25mm With 4 needle bearings and brass brushing Maximum capacity: 300lbs | H51: Gross Weight: 9,6 kg Net Weight: 9kg | I51: =RC[-8] -> 1452 | J51: =VLOOKUP(RC[-9],'/Users/marcvilfeu/Dropbox/HLDP/Docs importants/[Commande Fournisseurs.xlsm]COMPARATIF'!R4C28:R2500C52,9,FALSE) -> 3760223792324
A52: 1458 | B52: =IF(ISNA(VLOOKUP(RC[-1],Import!R3C3:R2000C3,1,FALSE)),"","1") ->  | C52: BARRE LYRE TRICEPS | D52: OLYMPIC TRICEPS BAR | F52: Handle diameter: 51 mm Length: 87cm Net Weight: 12,6 kgs LOGO: “LEADERFIT” on both ends of the bar. Aluminum label clipped. | H52: Gross Weight: 13 kg | I52: =RC[-8] -> 1458 | J52: =VLOOKUP(RC[-9],'/Users/marcvilfeu/Dropbox/HLDP/Docs importants/[Commande Fournisseurs.xlsm]COMPARATIF'!R4C28:R2500C52,9,FALSE) -> 3760223791501
A53: 1537 | B53: =IF(ISNA(VLOOKUP(RC[-1],Import!R3C3:R2000C3,1,FALSE)),"","1") ->  | C53: BARRE D'INITIATION A L'HALTEROPHILIE | D53: Initiation Weightlifting Bar for beginners | F53: Net Weight: 7,9kgs Hollow Bar Bar knurled for positive gripping. LOGO: “LEADERFIT” on both ends of the bar. Aluminum label clipped. Length: 200cm Handle diameter: 28mm | H53: Gross Weight: 8 kg | I53: =RC[-8] -> 1537 | J53: =VLOOKUP(RC[-9],'/Users/marcvilfeu/Dropbox/HLDP/Docs importants/[Commande Fournisseurs.xlsm]COMPARATIF'!R4C28:R2500C52,9,FALSE) -> 3760223792331
A54: 1453 | B54: =IF(ISNA(VLOOKUP(RC[-1],Import!R3C3:R2000C3,1,FALSE)),"","1") ->  | C54: BARRE OLYMPIQUE DROITE 2,20M | D54: STRAIGHT OLYMPIC BAR 220CM 20KGS | F54: Length: 220cm LOGO: “LEADERFIT” on both ends of the bar. Aluminum label clipped. Material: Q45 Steel Handle Diameter: 28mm With 8 needle bearings and brass brushing Maximum capacity: 700lbs Net weight: 20kgs | H54: Gross Weight: 21 kg | I54: =RC[-8] -> 1453 | J54: =VLOOKUP(RC[-9],'/Users/marcvilfeu/Dropbox/HLDP/Docs importants/[Commande Fournisseurs.xlsm]COMPARATIF'!R4C28:R2500C52,9,FALSE) -> 3760223791525
A55: 2986 | B55: =IF(ISNA(VLOOKUP(RC[-1],Import!R3C3:R2000C3,1,FALSE)),"","1") ->  | C55: BARRE OLYMPIQUE DROITE 1,50M | D55: STRAIGHT OLYMPIC BAR 150CM 15KGS | F55: Length: 150cm LOGO: “LEADERFIT” on both ends of the bar. Aluminum label clipped. Material: Q45 Steel Handle Diameter: 28mm With 8 needle bearings and brass brushing Maximum capacity: 450lbs Net weight: 12,5kgs | H55: Gross Weight: 12,8 kg Net Weight: 12 kg | I55: =RC[-8] -> 2986 | J55: =VLOOKUP(RC[-9],'/Users/marcvilfeu/Dropbox/HLDP/Docs importants/[Commande Fournisseurs.xlsm]COMPARATIF'!R4C28:R2500C52,9,FALSE) -> 3760223791518
A56: 1460 | B56: =IF(ISNA(VLOOKUP(RC[-1],Import!R3C3:R2000C3,1,FALSE)),"","1") ->  | C56: BASE A PICOTS BLEUE | D56: MASSAGE CUSHION BLUE | F56: Diameter: 33 cm Height: around 4,5 cm Color: Blue (pantone 300C) Net Weight: 1 kg The bottom of disc has small nodules for use in rehab and massage therapy | H56: 1pc/polybag | I56: =RC[-8] -> 1460 | J56: =VLOOKUP(RC[-9],'/Users/marcvilfeu/Dropbox/HLDP/Docs importants/[Commande Fournisseurs.xlsm]COMPARATIF'!R4C28:R2500C52,9,FALSE) -> 3760223791075
A57: 1469 | B57: =IF(ISNA(VLOOKUP(RC[-1],Import!R3C3:R2000C3,1,FALSE)),"","1") ->  | C57: BASE A PICOTS GRISE | D57: MASSAGE CUSHION GREY | F57: Diameter: 33 cm Height: around 4,5 cm Color: grey (pantone 877C) Net Weight: 1 kg The bottom of disc has small nodules for use in rehab and massage therapy | H57: 1pc/polybag | I57: =RC[-8] -> 1469 | J57: =VLOOKUP(RC[-9],'/Users/marcvilfeu/Dropbox/HLDP/Docs importants/[Commande Fournisseurs.xlsm]COMPARATIF'!R4C28:R2500C52,9,FALSE) -> 3760223793710
A58: 1461 | B58: =IF(ISNA(VLOOKUP(RC[-1],Import!R3C3:R2000C3,1,FALSE)),"","1") ->  | C58: BATONS DE BOIS 120CM PAR 10 | D58: WOODEN HANDLE 120CM | F58: Length: 120cm or 140cm, according to the PI Diameter: 24 mm Net Weight: 300g (120cm), 360g (140cm) Wood: Eucalyptus Both head and bottom egg dome ends Handles must be entirely varnished | H58: 10pcs/bundle, 3 bundles/woven bag | I58: =RC[-8] -> 1461 | J58: =VLOOKUP(RC[-9],'/Users/marcvilfeu/Dropbox/HLDP/Docs importants/[Commande Fournisseurs.xlsm]COMPARATIF'!R4C28:R2500C52,9,FALSE) -> 3760223792348
A59: 1468 | B59: =IF(ISNA(VLOOKUP(RC[-1],Import!R3C3:R2000C3,1,FALSE)),"","1") ->  | C59: BATONS DE BOIS 140CM PAR 10 | D59: WOODEN HANDLE 140CM | I59: =RC[-8] -> 1468 | J59: =VLOOKUP(RC[-9],'/Users/marcvilfeu/Dropbox/HLDP/Docs importants/[Commande Fournisseurs.xlsm]COMPARATIF'!R4C28:R2500C52,9,FALSE) -> 3760223792355
A60: 1462 | B60: =IF(ISNA(VLOOKUP(RC[-1],Import!R3C3:R2000C3,1,FALSE)),"","1") ->  | C60: BLOC PROPRIOCEPTION | D60: TPE BALANCE PAD | F60: Dimensions: 40 x 35 x 5cm Material: TPE Color: Blue Hardness: 8° LOGO “LF’Pilates”, imprit logo | H60: 0,85 kgs | I60: =RC[-8] -> 1462 | J60: =VLOOKUP(RC[-9],'/Users/marcvilfeu/Dropbox/HLDP/Docs importants/[Commande Fournisseurs.xlsm]COMPARATIF'!R4C28:R2500C52,9,FALSE) -> 3760223792362
B61: =IF(ISNA(VLOOKUP(RC[-1],Import!R3C3:R2000C3,1,FALSE)),"","1") ->  | D61: Caps for Aerobic Balls | H61: 10pcs/polybag,100polybags/big bag | I61: =RC[-8] -> 0 | J61: =VLOOKUP(RC[-9],'/Users/marcvilfeu/Dropbox/HLDP/Docs importants/[Commande Fournisseurs.xlsm]COMPARATIF'!R4C28:R2500C52,9,FALSE) -> 
A62: 1479 | B62: =IF(ISNA(VLOOKUP(RC[-1],Import!R3C3:R2000C3,1,FALSE)),"","1") ->  | C62: BRIQUES YOGA VIOLET | D62: YOGA BRICK Purple | F62: Dimensions: 22.8 x 15 x7.6 cm Material: EVA Foam Anti-slip function Color: PURPLE (pantone 683C) Sold by pair Density: High density LOGO “LF’Pilates”, printed in white | H62: Shrink Package 0,2 kgs | I62: =RC[-8] -> 1479 | J62: =VLOOKUP(RC[-9],'/Users/zilu/Desktop/HLDP/Docs Importants/Super important/[Commande Fournisseurs19122016.xlsm]COMPARATIF'!R4C28:R5000C52,9,FALSE) -> 3760223791549
A63: 1478 | B63: =IF(ISNA(VLOOKUP(RC[-1],Import!R3C3:R2000C3,1,FALSE)),"","1") ->  | C63: BRIQUES YOGA VERT | D63: YOGA BRICK Green | F63: Dimensions: 22.8 x 15 x7.6 cm Material: EVA Foam Anti-slip function Color: Green (pantone 374C) Sold by pair Density: High density LOGO “LF’Pilates”, printed in white | H63: Shrink Package 0,2 kgs | I63: =RC[-8] -> 1478 | J63: =VLOOKUP(RC[-9],'/Users/zilu/Desktop/HLDP/Docs Importants/Super important/[Commande Fournisseurs19122016.xlsm]COMPARATIF'!R4C28:R5000C52,9,FALSE) -> #N/A
A64: 1463 | B64: =IF(ISNA(VLOOKUP(RC[-1],Import!R3C3:R2000C3,1,FALSE)),"","1") ->  | C64: BLOC YOGA | D64: YOGA BLOCK | F64: Dimensions: 13x17x30,5 cm Material: EVA Foam Anti-slip function Color: Purple Density: High density LOGO “LF’Pilates”, printed in white | H64: 0,3 kgs | I64: =RC[-8] -> 1463 | J64: =VLOOKUP(RC[-9],'/Users/zilu/Desktop/HLDP/Docs Importants/Super important/[Commande Fournisseurs19122016.xlsm]COMPARATIF'!R4C28:R5000C52,9,FALSE) -> #N/A
A65: 3458 | B65: =IF(ISNA(VLOOKUP(RC[-1],Import!R3C3:R2000C3,1,FALSE)),"","1") ->  | C65: CAGE CROSS TRAINING POWER | I65: =RC[-8] -> 3458 | J65: =VLOOKUP(RC[-9],'/Users/zilu/Desktop/HLDP/Docs Importants/Super important/[Commande Fournisseurs19122016.xlsm]COMPARATIF'!R4C28:R5000C52,9,FALSE) -> 3760223790849
A66: 1968 | B66: =IF(ISNA(VLOOKUP(RC[-1],Import!R3C3:R2000C3,1,FALSE)),"","1") ->  | C66: CAGE MURALE DEPLIABLE | D66: Wall Mounted Rack | F66: Sold with the accessories on the photo. Assembly Size:286*144*87cm Width of the tubes: 60mm All tubes and accessories in black. | I66: =RC[-8] -> 1968 | J66: =VLOOKUP(RC[-9],'/Users/zilu/Desktop/HLDP/Docs Importants/Super important/[Commande Fournisseurs19122016.xlsm]COMPARATIF'!R4C28:R5000C52,9,FALSE) -> 3760223793789
A67: 2360 | B67: =IF(ISNA(VLOOKUP(RC[-1],Import!R3C3:R2000C3,1,FALSE)),"","1") ->  | C67: CEINTURE A CHARGE | D67: Nylon Dip Belt | I67: =RC[-8] -> 2360 | J67: =VLOOKUP(RC[-9],'/Users/zilu/Desktop/HLDP/Docs Importants/Super important/[Commande Fournisseurs19122016.xlsm]COMPARATIF'!R4C28:R5000C52,9,FALSE) -> 3760223793673
A68: 2369 | B68: =IF(ISNA(VLOOKUP(RC[-1],Import!R3C3:R2000C3,1,FALSE)),"","1") ->  | C68: CEINTURE FLOTTANTE SMALL | I68: =RC[-8] -> 2369 | J68: =VLOOKUP(RC[-9],'/Users/zilu/Desktop/HLDP/Docs Importants/Super important/[Commande Fournisseurs19122016.xlsm]COMPARATIF'!R4C28:R5000C52,9,FALSE) -> 0
A69: 1484 | B69: =IF(ISNA(VLOOKUP(RC[-1],Import!R3C3:R2000C3,1,FALSE)),"","1") ->  | C69: CEINTURE DE MAINTIEN | D69: LEATHER WEIGHT LIFTING BELT | F69: LOGO: Leaderfit, on white. Material: Leather Fisrt hole at 115cm | H69: Gross Weight: 0,5 kgs | I69: =RC[-8] -> 1484 | J69: =VLOOKUP(RC[-9],'/Users/marcvilfeu/Dropbox/HLDP/Docs importants/[Commande Fournisseurs.xlsm]COMPARATIF'!R4C28:R2500C52,9,FALSE) -> 3760223792423
A70: 1994 | B70: =IF(ISNA(VLOOKUP(RC[-1],Import!R3C3:R2000C3,1,FALSE)),"","1") ->  | C70: CHARIOT FOAM ROLLER | D70: FOAM ROLLER RACK | F70: Color: Black Can store 12 foam rollers (6'x15') | G70: Dimensions: 89 x 53,5 x 91,5 cm | H70: 0,2 kgs | I70: =RC[-8] -> 1994 | J70: =VLOOKUP(RC[-9],'/Users/marcvilfeu/Dropbox/HLDP/Docs importants/[Commande Fournisseurs.xlsm]COMPARATIF'!R4C28:R2500C52,9,FALSE) -> 3760223794151
A71: 3415 | B71: =IF(ISNA(VLOOKUP(RC[-1],Import!R3C3:R2000C3,1,FALSE)),"","1") ->  | C71: CHIN-UP BAR 1172MM | D71: Chin-up Bar 1172mm | F71: Dimensions: 117,2 cm | H71: Gross Weight: 7 kgs | I71: =RC[-8] -> 3415 | J71: =VLOOKUP(RC[-9],'/Users/marcvilfeu/Dropbox/HLDP/Docs importants/[Commande Fournisseurs.xlsm]COMPARATIF'!R4C28:R2500C52,9,FALSE) -> 3760223792430
A72: 1983 | B72: =IF(ISNA(VLOOKUP(RC[-1],Import!R3C3:R2000C3,1,FALSE)),"","1") ->  | C72: CHIN-UP BAR 1190MM | D72: Chin-up Bar | F72: MAIN TUBE SIZE:50*50*1.5MM ASSEMBLE SIZE:51*99*20CM | H72: Gross Weight: 7 kgs | I72: =RC[-8] -> 1983 | J72: =VLOOKUP(RC[-9],'/Users/marcvilfeu/Dropbox/HLDP/Docs importants/[Commande Fournisseurs.xlsm]COMPARATIF'!R4C28:R2500C52,9,FALSE) -> 3760223794038
A73: 3416 | B73: =IF(ISNA(VLOOKUP(RC[-1],Import!R3C3:R2000C3,1,FALSE)),"","1") ->  | C73: CHIN-UP BAR 1200MM | D73: Chin-up Bar 1200mm | F73: Dimensions: 120 cm | H73: Gross Weight: 7 kgs | I73: =RC[-8] -> 3416 | J73: =VLOOKUP(RC[-9],'/Users/marcvilfeu/Dropbox/HLDP/Docs importants/[Commande Fournisseurs.xlsm]COMPARATIF'!R4C28:R2500C52,9,FALSE) -> 3760223791983
A74: 3417 | B74: =IF(ISNA(VLOOKUP(RC[-1],Import!R3C3:R2000C3,1,FALSE)),"","1") ->  | C74: CHIN-UP BAR 1250MM | D74: Chin-up Bar 1250mm | F74: Dimensions: 125 cm | H74: Gross Weight: 8 kgs | I74: =RC[-8] -> 3417 | J74: =VLOOKUP(RC[-9],'/Users/marcvilfeu/Dropbox/HLDP/Docs importants/[Commande Fournisseurs.xlsm]COMPARATIF'!R4C28:R2500C52,9,FALSE) -> 3760223792447
A75: 3414 | B75: =IF(ISNA(VLOOKUP(RC[-1],Import!R3C3:R2000C3,1,FALSE)),"","1") ->  | C75: CHIN-UP RACK | D75: Chin-Up Rack | F75: ASSEMBLE SIZE:51*99*20CM MAIN TUBE SIZE:50*50*1.5MM Max Charge: 250kgs Net Weight: 18kgs | H75: Gross Weight: 19 kgs | I75: =RC[-8] -> 3414 | J75: =VLOOKUP(RC[-9],'/Users/marcvilfeu/Dropbox/HLDP/Docs importants/[Commande Fournisseurs.xlsm]COMPARATIF'!R4C28:R2500C52,9,FALSE) -> 3760223791990
A76: 4000 | B76: =IF(ISNA(VLOOKUP(RC[-1],Import!R3C3:R2000C3,1,FALSE)),"","1") ->  | C76: CORDE A SAUTER PRO | D76: Speed Rope | F76: Color: Black -Cable size: ø2,5mmx3m -Adjustable height | I76: =RC[-8] -> 4000 | J76: =VLOOKUP(RC[-9],'/Users/marcvilfeu/Dropbox/HLDP/Docs importants/[Commande Fournisseurs.xlsm]COMPARATIF'!R4C28:R2500C52,9,FALSE) -> 3760223793680
A77: 3998 | B77: =IF(ISNA(VLOOKUP(RC[-1],Import!R3C3:R2000C3,1,FALSE)),"","1") ->  | C77: CORDE DE VITESSE NOIR | D77: Speed Rope | F77: Color: Black -Cable size: ø2,5mmx3m -Adjustable height -LOGO: Leaderfit in yellow, on one handle -We need 4 screws in total, 2 outside the handles, and 2 between the handles. | I77: =RC[-8] -> 3998 | J77: =VLOOKUP(RC[-9],'/Users/marcvilfeu/Dropbox/HLDP/Docs importants/[Commande Fournisseurs.xlsm]COMPARATIF'!R4C28:R2500C52,9,FALSE) -> 3760223792010
A78: 3998J | B78: =IF(ISNA(VLOOKUP(RC[-1],Import!R3C3:R2000C3,1,FALSE)),"","1") ->  | C78: CORDE DE VITESSE JAUNE | D78: Speed Rope | F78: Color: Yellow/black -Cable size: ø2,5mmx3m -Adjustable height -LOGO: Leaderfit in yellow, on one handle. -We need 4 screws in total, 2 outside the handles, and 2 between the handles. | I78: =RC[-8] -> 3998J | J78: =VLOOKUP(RC[-9],'/Users/marcvilfeu/Dropbox/HLDP/Docs importants/[Commande Fournisseurs.xlsm]COMPARATIF'!R4C28:R2500C52,9,FALSE) -> 3760223793758
A79: 3998B | B79: =IF(ISNA(VLOOKUP(RC[-1],Import!R3C3:R2000C3,1,FALSE)),"","1") ->  | C79: CORDE DE VITESSE BLEU | D79: Speed Rope | F79: Color: Blue -Cable size: ø2,5mmx3m -Adjustable height -LOGO: Leaderfit Equipement, in white, on one handle | I79: =RC[-8] -> 3998B | J79: =VLOOKUP(RC[-9],'/Users/marcvilfeu/Dropbox/HLDP/Docs importants/[Commande Fournisseurs.xlsm]COMPARATIF'!R4C28:R2500C52,9,FALSE) -> 3760223792027
A80: 3998V | B80: =IF(ISNA(VLOOKUP(RC[-1],Import!R3C3:R2000C3,1,FALSE)),"","1") ->  | C80: CORDE DE VITESSE VIOLET | D80: Speed Rope | F80: Color: Purple -Cable size: ø2,5mmx3m -Adjustable height -LOGO: Leaderfit Equipement, in white, on one handle | I80: =RC[-8] -> 3998V | J80: =VLOOKUP(RC[-9],'/Users/marcvilfeu/Dropbox/HLDP/Docs importants/[Commande Fournisseurs.xlsm]COMPARATIF'!R4C28:R2500C52,9,FALSE) -> 3760223792003
A81: 1492 | B81: =IF(ISNA(VLOOKUP(RC[-1],Import!R3C3:R2000C3,1,FALSE)),"","1") ->  | C81: CORDE A SAUTER ORANGE | D81: SPEED JUMP ROPE ORANGE | F81: Length: 275 cm Diameter: 45 mm Material: PVC Color: Orange/Green or Purple, according to the PI | G81: PP Tube + Color card | H81: Gross Weight: 0,08 Kgs | I81: =RC[-8] -> 1492 | J81: =VLOOKUP(RC[-9],'/Users/marcvilfeu/Dropbox/HLDP/Docs importants/[Commande Fournisseurs.xlsm]COMPARATIF'!R4C28:R2500C52,9,FALSE) -> 3760223792454
A82: 1493 | B82: =IF(ISNA(VLOOKUP(RC[-1],Import!R3C3:R2000C3,1,FALSE)),"","1") ->  | C82: CORDE A SAUTER VERT | D82: SPEED JUMP ROPE GREEN | I82: =RC[-8] -> 1493 | J82: =VLOOKUP(RC[-9],'/Users/marcvilfeu/Dropbox/HLDP/Docs importants/[Commande Fournisseurs.xlsm]COMPARATIF'!R4C28:R2500C52,9,FALSE) -> 3760223792461
A83: 1494 | B83: =IF(ISNA(VLOOKUP(RC[-1],Import!R3C3:R2000C3,1,FALSE)),"","1") ->  | C83: CORDE A SAUTER VIOLET | D83: SPEED JUMP ROPE PURPLE | I83: =RC[-8] -> 1494 | J83: =VLOOKUP(RC[-9],'/Users/marcvilfeu/Dropbox/HLDP/Docs importants/[Commande Fournisseurs.xlsm]COMPARATIF'!R4C28:R2500C52,9,FALSE) -> 3760223792478
A84: 3479 | B84: =IF(ISNA(VLOOKUP(RC[-1],Import!R3C3:R2000C3,1,FALSE)),"","1") ->  | C84: CORDE D'OSCILLATION 38MM | D84: BATTLE ROPE 38mm | F84: Color: Black rope and ring, with black handle Material: Polypropylene fibre with Nylon cover Diameter: 38mm Net Weight: 12,5 kgs LOGO: Leaderfit on the handles, in white Length of plastic handle: 20 cm + 5cm of solid ring Total Length: 15m | H84: Gross Weight: 12,5 Kgs | I84: =RC[-8] -> 3479 | J84: =VLOOKUP(RC[-9],'/Users/marcvilfeu/Dropbox/HLDP/Docs importants/[Commande Fournisseurs.xlsm]COMPARATIF'!R4C28:R2500C52,9,FALSE) -> 3760223790655
A85: 1496 | B85: =IF(ISNA(VLOOKUP(RC[-1],Import!R3C3:R2000C3,1,FALSE)),"","1") ->  | C85: CORDE D'OSCILLATION 50MM | D85: BATTLE ROPE 50mm | F85: Color: Black rope and ring, with black handle Material: Polypropylene fibre with Nylon cover Diameter: 50mm Net Weight: 15,5 kgs LOGO: Leaderfit on the handles, in white Length of plastic handle: 20 cm + 5cm of solid ring Total Length: 15m | H85: Gross Weight: 16 Kgs | I85: =RC[-8] -> 1496 | J85: =VLOOKUP(RC[-9],'/Users/marcvilfeu/Dropbox/HLDP/Docs importants/[Commande Fournisseurs.xlsm]COMPARATIF'!R4C28:R2500C52,9,FALSE) -> 3760223790825
A86: 2332 | B86: =IF(ISNA(VLOOKUP(RC[-1],Import!R3C3:R2000C3,1,FALSE)),"","1") ->  | C86: CORE PLATE | D86: Core Plate | F86: Color: Black Sold without the olympic bar Barbell Landmine + Landmine Handle Rubber anti-slip base on base plate Includes fixing point for training ropes and bands | H86: Gross Weight: 24,5 Kgs | I86: =RC[-8] -> 2332 | J86: =VLOOKUP(RC[-9],'/Users/marcvilfeu/Dropbox/HLDP/Docs importants/[Commande Fournisseurs.xlsm]COMPARATIF'!R4C28:R2500C52,9,FALSE) -> 3760223791556
A87: 3410 | B87: =IF(ISNA(VLOOKUP(RC[-1],Import!R3C3:R2000C3,1,FALSE)),"","1") ->  | C87: CROSS BAR 1080MM | D87: CROSS BAR 1080mm | F87: Color: Black Length: 1080mm Diameter of the tube: 75 mm Thickness of the tube: 3 mm Sold by unit | H87: Gross Weight: 17 Kgs Packed by piece. | I87: =RC[-8] -> 3410 | J87: =VLOOKUP(RC[-9],'/Users/marcvilfeu/Dropbox/HLDP/Docs importants/[Commande Fournisseurs.xlsm]COMPARATIF'!R4C28:R2500C52,9,FALSE) -> 3760223790511
A88: 3411 | B88: =IF(ISNA(VLOOKUP(RC[-1],Import!R3C3:R2000C3,1,FALSE)),"","1") ->  | C88: CROSS BAR 1800MM | D88: Cross Bar - 1800Mm | F88: Color: Black Length: 1800mm Diameter of the tube: 75 mm Thickness of the tube: 3 mm Sold by unit | H88: Gross Weight: 27 Kgs Packed by piece. | I88: =RC[-8] -> 3411 | J88: =VLOOKUP(RC[-9],'/Users/marcvilfeu/Dropbox/HLDP/Docs importants/[Commande Fournisseurs.xlsm]COMPARATIF'!R4C28:R2500C52,9,FALSE) -> 3760223790528
A89: 3820 | B89: =IF(ISNA(VLOOKUP(RC[-1],Import!R3C3:R2000C3,1,FALSE)),"","1") ->  | C89: CROSS BAR 2815MM | D89: CROSS BAR 2815mm | F89: Color: Black Length: 2815mm Diameter of the tube: 75 mm Thickness of the tube: 3 mm Sold by unit | H89: Gross Weight: 40 Kgs Packed by piece. | I89: =RC[-8] -> 3820 | J89: =VLOOKUP(RC[-9],'/Users/marcvilfeu/Dropbox/HLDP/Docs importants/[Commande Fournisseurs.xlsm]COMPARATIF'!R4C28:R2500C52,9,FALSE) -> 3760223792485
A90: 3484 | B90: =IF(ISNA(VLOOKUP(RC[-1],Import!R3C3:R2000C3,1,FALSE)),"","1") ->  | C90: DIPS BARS | D90: Dip Bars | F90: Sold by pair | H90: Gross Weight: 8,6 Kgs | I90: =RC[-8] -> 3484 | J90: =VLOOKUP(RC[-9],'/Users/marcvilfeu/Dropbox/HLDP/Docs importants/[Commande Fournisseurs.xlsm]COMPARATIF'!R4C28:R2500C52,9,FALSE) -> 3760223792508
A91: 3483 | B91: =IF(ISNA(VLOOKUP(RC[-1],Import!R3C3:R2000C3,1,FALSE)),"","1") ->  | C91: DIPS HORN | D91: Dip Horn | H91: Gross Weight: 10 Kgs | I91: =RC[-8] -> 3483 | J91: =VLOOKUP(RC[-9],'/Users/marcvilfeu/Dropbox/HLDP/Docs importants/[Commande Fournisseurs.xlsm]COMPARATIF'!R4C28:R2500C52,9,FALSE) -> 3760223790658
A92: 2319 | B92: =IF(ISNA(VLOOKUP(RC[-1],Import!R3C3:R2000C3,1,FALSE)),"","1") ->  | C92: DISQUE PUMP 1,25KG ROSE | D92: PLATE FOR PUMP 1,25 KG | F92: Weight: 1,25 kg Color: Pink (pantone 213C) Thickness: 24 mm Diameter: 15 cm | H92: 1,25 kgs Packed by pair | I92: =RC[-8] -> 2319 | J92: =VLOOKUP(RC[-9],'/Users/marcvilfeu/Dropbox/HLDP/Docs importants/[Commande Fournisseurs.xlsm]COMPARATIF'!R4C28:R2500C52,9,FALSE) -> 3760223792515
A93: 2318 | B93: =IF(ISNA(VLOOKUP(RC[-1],Import!R3C3:R2000C3,1,FALSE)),"","1") ->  | C93: DISQUE PUMP 2,5KG JAUNE | D93: PLATE FOR PUMP 2,5 KG | F93: Weight: 2,5 kg Color: Yellow (pantone 102C) Thickness: 34 mm Diameter: 17,8 cm | H93: 2,75 kgs Packed by pair | I93: =RC[-8] -> 2318 | J93: =VLOOKUP(RC[-9],'/Users/marcvilfeu/Dropbox/HLDP/Docs importants/[Commande Fournisseurs.xlsm]COMPARATIF'!R4C28:R2500C52,9,FALSE) -> 3760223792546
A94: 2315 | B94: =IF(ISNA(VLOOKUP(RC[-1],Import!R3C3:R2000C3,1,FALSE)),"","1") ->  | C94: DISQUE PUMP 5KG VERT | D94: PLATE FOR PUMP 5 KG | F94: Weight: 5 kgs Color: Green (pantone 361 C) Thickness: 39 mm Diameter: 20,7 cm | H94: Packed by pair | I94: =RC[-8] -> 2315 | J94: =VLOOKUP(RC[-9],'/Users/marcvilfeu/Dropbox/HLDP/Docs importants/[Commande Fournisseurs.xlsm]COMPARATIF'!R4C28:R2500C52,9,FALSE) -> 3760223791082
A95: 2316 | B95: =IF(ISNA(VLOOKUP(RC[-1],Import!R3C3:R2000C3,1,FALSE)),"","1") ->  | C95: DISQUE PUMP 10KG BLEU | D95: PLATE FOR PUMP 10 KG | F95: Weight: 10 kgs Color: Blue (pantone 306C) Thickness: 45 mm Diameter: 25,5 cm | H95: 10,35 kgs Packed by pair | I95: =RC[-8] -> 2316 | J95: =VLOOKUP(RC[-9],'/Users/marcvilfeu/Dropbox/HLDP/Docs importants/[Commande Fournisseurs.xlsm]COMPARATIF'!R4C28:R2500C52,9,FALSE) -> 3760223792522
A96: 3995 | B96: =IF(ISNA(VLOOKUP(RC[-1],Import!R3C3:R2000C3,1,FALSE)),"","1") ->  | C96: DISQUE PUMP 1,25KG NOIR | D96: PLATE FOR PUMP 1,25 KG BLACK | F96: Weight: 1,25 kg Color: Black Thickness: 24 mm Diameter: 15 cm | H96: 1,25 kgs Packed by pair | I96: =RC[-8] -> 3995 | J96: =VLOOKUP(RC[-9],'/Users/marcvilfeu/Dropbox/HLDP/Docs importants/[Commande Fournisseurs.xlsm]COMPARATIF'!R4C28:R2500C52,9,FALSE) -> 3760223794199
A97: 3996 | B97: =IF(ISNA(VLOOKUP(RC[-1],Import!R3C3:R2000C3,1,FALSE)),"","1") ->  | C97: DISQUE PUMP 2,5KG NOIR | D97: PLATE FOR PUMP 2,5 KG BLACK | F97: Weight: 2,5 kg Color: Black Thickness: 34 mm Diameter: 17,8 cm | H97: 2,75 kgs Packed by pair | I97: =RC[-8] -> 3996 | J97: =VLOOKUP(RC[-9],'/Users/marcvilfeu/Dropbox/HLDP/Docs importants/[Commande Fournisseurs.xlsm]COMPARATIF'!R4C28:R2500C52,9,FALSE) -> 3760223794205
A98: 3997 | B98: =IF(ISNA(VLOOKUP(RC[-1],Import!R3C3:R2000C3,1,FALSE)),"","1") ->  | C98: DISQUE PUMP 5KG NOIR | D98: PLATE FOR PUMP 5 KG BLACK | F98: Weight: 5 kgs Color: Black Thickness: 39 mm Diameter: 20,7 cm | H98: Packed by pair | I98: =RC[-8] -> 3997 | J98: =VLOOKUP(RC[-9],'/Users/marcvilfeu/Dropbox/HLDP/Docs importants/[Commande Fournisseurs.xlsm]COMPARATIF'!R4C28:R2500C52,9,FALSE) -> 3760223794212
A99: 2320 | B99: =IF(ISNA(VLOOKUP(RC[-1],Import!R3C3:R2000C3,1,FALSE)),"","1") ->  | C99: DISQUE PUMP 10KG NOIR | D99: PLATE FOR PUMP 10 KG | F99: Weight: 10 kgs Color: Black Thickness: 45 mm | H99: 10,35 kgs Packed by pair | I99: =RC[-8] -> 2320 | J99: =VLOOKUP(RC[-9],'/Users/marcvilfeu/Dropbox/HLDP/Docs importants/[Commande Fournisseurs.xlsm]COMPARATIF'!R4C28:R2500C52,9,FALSE) -> 3760223792539
A100: 1979 | B100: =IF(ISNA(VLOOKUP(RC[-1],Import!R3C3:R2000C3,1,FALSE)),"","1") ->  | C100: DISQUES BUMPER 2,5KG | D100: BUMPER PLATES 2,5kgs | F100: Thickness: 6.5cm Outside Diameter 45cm Inside Diameter: 51cm Color: Red | I100: =RC[-8] -> 1979 | J100: =VLOOKUP(RC[-9],'/Users/marcvilfeu/Dropbox/HLDP/Docs importants/[Commande Fournisseurs.xlsm]COMPARATIF'!R4C28:R2500C52,9,FALSE) -> 3760223793994
A101: 3489 | B101: =IF(ISNA(VLOOKUP(RC[-1],Import!R3C3:R2000C3,1,FALSE)),"","1") ->  | C101: DISQUES BUMPER 5KG NOIR | D101: BUMPER PLATES 5kgs | F101: With metal ring in the middle Diameter of the discs: Inside diameter: 51 mm to fit a 50mm bar Colors: 5kgs: Black , thickness: 27 mm 10kgs: Green, thickness: 37 mm 15kgs: Yellow, thickness: 50 mm 20kgs: Blue, thickness: 60 mm 25kgs: Red, thickness: mm Sold by Unit Drop test: 2m 12000 repetitions Outside Diameter: 45cm | I101: =RC[-8] -> 3489 | J101: =VLOOKUP(RC[-9],'/Users/marcvilfeu/Dropbox/HLDP/Docs importants/[Commande Fournisseurs.xlsm]COMPARATIF'!R4C28:R2500C52,9,FALSE) -> 3760223792591
A102: 3485 | B102: =IF(ISNA(VLOOKUP(RC[-1],Import!R3C3:R2000C3,1,FALSE)),"","1") ->  | C102: DISQUES BUMPER 10KG VERT | D102: BUMPER PLATES 10kgs | I102: =RC[-8] -> 3485 | J102: =VLOOKUP(RC[-9],'/Users/marcvilfeu/Dropbox/HLDP/Docs importants/[Commande Fournisseurs.xlsm]COMPARATIF'!R4C28:R2500C52,9,FALSE) -> 3760223792553
A103: 3486 | B103: =IF(ISNA(VLOOKUP(RC[-1],Import!R3C3:R2000C3,1,FALSE)),"","1") ->  | C103: DISQUES BUMPER 15KG JAUNE | D103: BUMPER PLATES 15kgs | I103: =RC[-8] -> 3486 | J103: =VLOOKUP(RC[-9],'/Users/marcvilfeu/Dropbox/HLDP/Docs importants/[Commande Fournisseurs.xlsm]COMPARATIF'!R4C28:R2500C52,9,FALSE) -> 3760223792560
A104: 3487 | B104: =IF(ISNA(VLOOKUP(RC[-1],Import!R3C3:R2000C3,1,FALSE)),"","1") ->  | C104: DISQUES BUMPER 20KG BLEU | D104: BUMPER PLATES 20kgs | I104: =RC[-8] -> 3487 | J104: =VLOOKUP(RC[-9],'/Users/marcvilfeu/Dropbox/HLDP/Docs importants/[Commande Fournisseurs.xlsm]COMPARATIF'!R4C28:R2500C52,9,FALSE) -> 3760223792577
A105: 3488 | B105: =IF(ISNA(VLOOKUP(RC[-1],Import!R3C3:R2000C3,1,FALSE)),"","1") ->  | C105: DISQUES BUMPER 25KG ROUGE | D105: BUMPER PLATES 25kgs | I105: =RC[-8] -> 3488 | J105: =VLOOKUP(RC[-9],'/Users/marcvilfeu/Dropbox/HLDP/Docs importants/[Commande Fournisseurs.xlsm]COMPARATIF'!R4C28:R2500C52,9,FALSE) -> 3760223792584
A106: 1508 | B106: =IF(ISNA(VLOOKUP(RC[-1],Import!R3C3:R2000C3,1,FALSE)),"","1") ->  | C106: DISQUES NOIRS A POIGNEES 1,25 KG ROND | D106: Black Rubber Encased Olympic Plate w/metal ring 1,25kg | F106: Material: Rubber Hand grip on the handles for a better grip Inside Diameter: 51mm Weight: 1,25/5/10/15/20/25 kgs according to the PI. Sold by unit | G106: -DISQUE NOIR A POIGNÉES 1,25 KG rond [1508] > ∅ 17,5cm – épaisseur : 2,5cm | I106: =RC[-8] -> 1508 | J106: =VLOOKUP(RC[-9],'/Users/marcvilfeu/Dropbox/HLDP/Docs importants/[Commande Fournisseurs.xlsm]COMPARATIF'!R4C28:R2500C52,9,FALSE) -> 3760223791099
A107: 1511 | B107: =IF(ISNA(VLOOKUP(RC[-1],Import!R3C3:R2000C3,1,FALSE)),"","1") ->  | C107: DISQUES NOIRS A POIGNEES 2,5 KG ROND | D107: Black Rubber Encased Olympic Plate w/metal ring 2,5kg | G107: -DISQUE NOIR A POIGNEES 2,5 KG rond [1511] > ∅ 20,7cm – épaisseur : 2,5cm | I107: =RC[-8] -> 1511 | J107: =VLOOKUP(RC[-9],'/Users/marcvilfeu/Dropbox/HLDP/Docs importants/[Commande Fournisseurs.xlsm]COMPARATIF'!R4C28:R2500C52,9,FALSE) -> 3760223791105
A108: 1513 | B108: =IF(ISNA(VLOOKUP(RC[-1],Import!R3C3:R2000C3,1,FALSE)),"","1") ->  | C108: DISQUES NOIRS A POIGNEES 5 KG ROND | D108: Black Rubber Encased Olympic Plate w/metal ring 5kg | G108: -DISQUE NOIR A POIGNÉES 5 KG rond [1508] > ∅ 25,8cm – épaisseur : 3,5cm | I108: =RC[-8] -> 1513 | J108: =VLOOKUP(RC[-9],'/Users/marcvilfeu/Dropbox/HLDP/Docs importants/[Commande Fournisseurs.xlsm]COMPARATIF'!R4C28:R2500C52,9,FALSE) -> 3760223792621
A109: 1509 | B109: =IF(ISNA(VLOOKUP(RC[-1],Import!R3C3:R2000C3,1,FALSE)),"","1") ->  | C109: DISQUES NOIRS A POIGNEES 10 KG ROND | D109: Black Rubber Encased Olympic Plate w/metal ring 10 kg | G109: -DISQUE NOIR A POIGNEES 10 KG rond [1509] > ∅ 35,5cm – épaisseur : 3,8cm | I109: =RC[-8] -> 1509 | J109: =VLOOKUP(RC[-9],'/Users/marcvilfeu/Dropbox/HLDP/Docs importants/[Commande Fournisseurs.xlsm]COMPARATIF'!R4C28:R2500C52,9,FALSE) -> 3760223791594
A110: 1510 | B110: =IF(ISNA(VLOOKUP(RC[-1],Import!R3C3:R2000C3,1,FALSE)),"","1") ->  | C110: DISQUES NOIRS A POIGNEES 15 KG ROND | D110: Black Rubber Encased Olympic Plate w/metal ring 15kg | G110: -DISQUE NOIR A POIGNÉES 15 KG rond [1510] > ∅ 39,3cm – épaisseur : 4,4cm | I110: =RC[-8] -> 1510 | J110: =VLOOKUP(RC[-9],'/Users/marcvilfeu/Dropbox/HLDP/Docs importants/[Commande Fournisseurs.xlsm]COMPARATIF'!R4C28:R2500C52,9,FALSE) -> 3760223792607
A111: 1512 | B111: =IF(ISNA(VLOOKUP(RC[-1],Import!R3C3:R2000C3,1,FALSE)),"","1") ->  | C111: DISQUES NOIRS A POIGNEES 20 KG ROND | D111: Black Rubber Encased Olympic Plate w/metal ring 20kg | G111: -DISQUE NOIR A POIGNEES 20 KG rond [1512] > ∅ 42,3cm – épaisseur : 4,8cm | I111: =RC[-8] -> 1512 | J111: =VLOOKUP(RC[-9],'/Users/marcvilfeu/Dropbox/HLDP/Docs importants/[Commande Fournisseurs.xlsm]COMPARATIF'!R4C28:R2500C52,9,FALSE) -> 3760223791112
A112: 1541 | B112: =IF(ISNA(VLOOKUP(RC[-1],Import!R3C3:R2000C3,1,FALSE)),"","1") ->  | C112: DISQUES NOIRS A POIGNEES 25 KG ROND | D112: Black Rubber Encased Olympic Plate w/metal ring 25kg | G112: -DISQUE NOIR A POIGNÉES 25 KG rond [1541] > ∅ 44,8cm – épaisseur : 5cm | I112: =RC[-8] -> 1541 | J112: =VLOOKUP(RC[-9],'/Users/marcvilfeu/Dropbox/HLDP/Docs importants/[Commande Fournisseurs.xlsm]COMPARATIF'!R4C28:R2500C52,9,FALSE) -> 3760223792614
A113: 1515 | B113: =IF(ISNA(VLOOKUP(RC[-1],Import!R3C3:R2000C3,1,FALSE)),"","1") ->  | C113: DOME TRAINER BLEU | D113: Dome Trainer | F113: Diameter: 60 cm Height: 15 cm Color: Blue With plastic rim Net Weight: 7 kgs | H113: Gross Weight: 8 kgs | I113: =RC[-8] -> 1515 | J113: =VLOOKUP(RC[-9],'/Users/marcvilfeu/Dropbox/HLDP/Docs importants/[Commande Fournisseurs.xlsm]COMPARATIF'!R4C28:R2500C52,9,FALSE) -> 0
A114: 3419 | B114: =IF(ISNA(VLOOKUP(RC[-1],Import!R3C3:R2000C3,1,FALSE)),"","1") ->  | C114: DOUBLE CHIN-UP BAR 1080MM | D114: Double Chin-Up Bar - 1080Mm | F114: Length: 1080 mm | H114: Gross Weight: 9 Kgs Packed by piece. | I114: =RC[-8] -> 3419 | J114: =VLOOKUP(RC[-9],'/Users/marcvilfeu/Dropbox/HLDP/Docs importants/[Commande Fournisseurs.xlsm]COMPARATIF'!R4C28:R2500C52,9,FALSE) -> 3760223792645
A115: 3420 | B115: =IF(ISNA(VLOOKUP(RC[-1],Import!R3C3:R2000C3,1,FALSE)),"","1") ->  | C115: DOUBLE CHIN-UP BAR 1800MM | D115: Double Chin-Up Bar - 1800Mm | F115: Length: 1800 mm | H115: Gross Weight: 12,5 Kgs Packed by piece. | I115: =RC[-8] -> 3420 | J115: =VLOOKUP(RC[-9],'/Users/marcvilfeu/Dropbox/HLDP/Docs importants/[Commande Fournisseurs.xlsm]COMPARATIF'!R4C28:R2500C52,9,FALSE) -> 3760223792652
A116: 1543 | B116: =IF(ISNA(VLOOKUP(RC[-1],Import!R3C3:R2000C3,1,FALSE)),"","1") ->  | C116: ECHELLE DE VITESSE | D116: ADJUSTABLE AGILITY LADDER 4M | F116: Length: 4 m 8pcs of flat rungs Flat rungs must be in orange | H116: 1,1 kgs | I116: =RC[-8] -> 1543 | J116: =VLOOKUP(RC[-9],'/Users/marcvilfeu/Dropbox/HLDP/Docs importants/[Commande Fournisseurs.xlsm]COMPARATIF'!R4C28:R2500C52,9,FALSE) -> 3760223791617
A117: 1544 | B117: =IF(ISNA(VLOOKUP(RC[-1],Import!R3C3:R2000C3,1,FALSE)),"","1") ->  | C117: ELASTIQUE 8 POIGNEES 10KG | F117: Resistance: 10KG Color: Pink (pantone 213C) | I117: =RC[-8] -> 1544 | J117: =VLOOKUP(RC[-9],'/Users/marcvilfeu/Dropbox/HLDP/Docs importants/[Commande Fournisseurs.xlsm]COMPARATIF'!R4C28:R2500C52,9,FALSE) -> 3760223794052
A118: 1545 | B118: =IF(ISNA(VLOOKUP(RC[-1],Import!R3C3:R2000C3,1,FALSE)),"","1") ->  | C118: ELASTIQUE 8 POIGNEES 15KG | F118: Resistance: 15KG Color: Yellow (pantone 102C) | I118: =RC[-8] -> 1545 | J118: =VLOOKUP(RC[-9],'/Users/marcvilfeu/Dropbox/HLDP/Docs importants/[Commande Fournisseurs.xlsm]COMPARATIF'!R4C28:R2500C52,9,FALSE) -> 3760223794069
A119: 1546 | B119: =IF(ISNA(VLOOKUP(RC[-1],Import!R3C3:R2000C3,1,FALSE)),"","1") ->  | C119: ELASTIQUE 8 POIGNEES 20KG | F119: Resistance: 20KG Color: Green (pantone 361C) | I119: =RC[-8] -> 1546 | J119: =VLOOKUP(RC[-9],'/Users/marcvilfeu/Dropbox/HLDP/Docs importants/[Commande Fournisseurs.xlsm]COMPARATIF'!R4C28:R2500C52,9,FALSE) -> 3760223794076
A120: 1547 | B120: =IF(ISNA(VLOOKUP(RC[-1],Import!R3C3:R2000C3,1,FALSE)),"","1") ->  | C120: ELASTIQUE DE RESISTANCE POIGNEE/CHEVILLE | I120: =RC[-8] -> 1547 | J120: =VLOOKUP(RC[-9],'/Users/marcvilfeu/Dropbox/HLDP/Docs importants/[Commande Fournisseurs.xlsm]COMPARATIF'!R4C28:R2500C52,9,FALSE) -> 0
A121: 2317 | B121: =IF(ISNA(VLOOKUP(RC[-1],Import!R3C3:R2000C3,1,FALSE)),"","1") ->  | C121: ELASTIQUE DE RESISTANCE TRAVAIL SAUT | I121: =RC[-8] -> 2317 | J121: =VLOOKUP(RC[-9],'/Users/marcvilfeu/Dropbox/HLDP/Docs importants/[Commande Fournisseurs.xlsm]COMPARATIF'!R4C28:R2500C52,9,FALSE) -> 0
A122: 3412 | B122: =IF(ISNA(VLOOKUP(RC[-1],Import!R3C3:R2000C3,1,FALSE)),"","1") ->  | C122: ELEVATION CROSS BAR 1552MM | D122: Elevation Cross Bar - 1552Mm | F122: Length: 1552mm Diameter of the tube: 75 mm Thickness: 3 mm | H122: Gross Weight: 23 Kgs Packed by piece. | I122: =RC[-8] -> 3412 | J122: =VLOOKUP(RC[-9],'/Users/marcvilfeu/Dropbox/HLDP/Docs importants/[Commande Fournisseurs.xlsm]COMPARATIF'!R4C28:R2500C52,9,FALSE) -> 3760223790535
A123: 3413 | B123: =IF(ISNA(VLOOKUP(RC[-1],Import!R3C3:R2000C3,1,FALSE)),"","1") ->  | C123: ELEVATION CROSS BAR 2119MM | D123: Elevation Cross Bar - 2119Mm | F123: Length: 2119mm Diameter of the tube: 75 mm Thickness: 3 mm | H123: Gross Weight: 30 Kgs Packed by piece. | I123: =RC[-8] -> 3413 | J123: =VLOOKUP(RC[-9],'/Users/marcvilfeu/Dropbox/HLDP/Docs importants/[Commande Fournisseurs.xlsm]COMPARATIF'!R4C28:R2500C52,9,FALSE) -> 3760223790542
A124: 3813 | B124: =IF(ISNA(VLOOKUP(RC[-1],Import!R3C3:R2000C3,1,FALSE)),"","1") ->  | C124: ELEVATION CROSS BAR TRANSVERSAL 1215MM | D124: Elevation Cross Bar Length: 1215Mm | F124: Length: 1215mm Diameter of the tube: 75 mm Thickness: 3 mm | H124: Gross Weight: 12 Kgs Packed by piece. | I124: =RC[-8] -> 3813 | J124: =VLOOKUP(RC[-9],'/Users/marcvilfeu/Dropbox/HLDP/Docs importants/[Commande Fournisseurs.xlsm]COMPARATIF'!R4C28:R2500C52,9,FALSE) -> 3760223792669
A125: 2021 | B125: =IF(ISNA(VLOOKUP(RC[-1],Import!R3C3:R2000C3,1,FALSE)),"","1") ->  | C125: PARRELLELS BAR | D125: Equalizer | F125: Dimensions: 50x65x70cm Color: Yellow and black | I125: =RC[-8] -> 2021 | J125: =VLOOKUP(RC[-9],'/Users/marcvilfeu/Dropbox/HLDP/Docs importants/[Commande Fournisseurs.xlsm]COMPARATIF'!R4C28:R2500C52,9,FALSE) -> 0
A126: 2351 | B126: =IF(ISNA(VLOOKUP(RC[-1],Import!R3C3:R2000C3,1,FALSE)),"","1") ->  | C126: FITNESS TUBE LIGHT ROSE | D126: Fitness Tube Latex Light | F126: Material: Latex Dimensions: 6x10x1220mm Color: Pink (pantone 213C) Resistance: Light (10 lbs) LOGO: Leaderfit, in color, woven | H126: Gross Weight: 0,15 kgs | I126: =RC[-8] -> 2351 | J126: =VLOOKUP(RC[-9],'/Users/marcvilfeu/Dropbox/HLDP/Docs importants/[Commande Fournisseurs.xlsm]COMPARATIF'!R4C28:R2500C52,9,FALSE) -> 3760223791129
A127: 2353 | B127: =IF(ISNA(VLOOKUP(RC[-1],Import!R3C3:R2000C3,1,FALSE)),"","1") ->  | C127: FITNESS TUBE MEDIUM JAUNE | D127: Fitness Tube Latex Medium | F127: Material: Latex Dimensions: 7x11x1220mm Color: Yellow (pantone 102C) Resistance: Medium (15 lbs) LOGO: Leaderfit, in color, woven | I127: =RC[-8] -> 2353 | J127: =VLOOKUP(RC[-9],'/Users/marcvilfeu/Dropbox/HLDP/Docs importants/[Commande Fournisseurs.xlsm]COMPARATIF'!R4C28:R2500C52,9,FALSE) -> 3760223791136
A128: 1556 | B128: =IF(ISNA(VLOOKUP(RC[-1],Import!R3C3:R2000C3,1,FALSE)),"","1") ->  | C128: FITNESS TUBE STRONG VERT | D128: Fitness Tube Latex Strong | F128: Material: Latex Dimensions: 8x12x1220mm Color: Green (pantone 361C) Resistance: Strong (20 lbs) LOGO: Leaderfit, in color, woven | I128: =RC[-8] -> 1556 | J128: =VLOOKUP(RC[-9],'/Users/marcvilfeu/Dropbox/HLDP/Docs importants/[Commande Fournisseurs.xlsm]COMPARATIF'!R4C28:R2500C52,9,FALSE) -> 3760223791143
A129: 4024 | B129: =IF(ISNA(VLOOKUP(RC[-1],Import!R3C3:R2000C3,1,FALSE)),"","1") ->  | C129: FIXATION MURALE POUR CORDE | D129: ROPE ANCHOR | F129: Can allow to work with 38mm and 50mm Dimensions: 23*5*8.5cm | H129: 0,2 kgs | I129: =RC[-8] -> 4024 | J129: =VLOOKUP(RC[-9],'/Users/marcvilfeu/Dropbox/HLDP/Docs importants/[Commande Fournisseurs.xlsm]COMPARATIF'!R4C28:R2500C52,9,FALSE) -> 3760223792676
A130: 2296 | B130: =IF(ISNA(VLOOKUP(RC[-1],Import!R3C3:R2000C3,1,FALSE)),"","1") ->  | C130: FLEX BAR | D130: ASSEMBLE FLEX BAR | F130: Length: 150 cm Can be unscrewed in the middle (two parts joint) Color: Red and Black Material: TPR, Glass fiber Anti-slip TPE handle&ends Cps Diameter: 7,5 mm | H130: 0,65 kgs | I130: =RC[-8] -> 2296 | J130: =VLOOKUP(RC[-9],'/Users/marcvilfeu/Dropbox/HLDP/Docs importants/[Commande Fournisseurs.xlsm]COMPARATIF'!R4C28:R2500C52,9,FALSE) -> 3760223790757
A131: 1560 | B131: =IF(ISNA(VLOOKUP(RC[-1],Import!R3C3:R2000C3,1,FALSE)),"","1") ->  | C131: FOAM ROLLER CLASSIC BLEU | D131: EVA FOAM ROLLER | F131: Length: 90 cm Diameter: 15 cm Hardness: 30° Color: Blue Alveolus surface LOGO, “LF’Pilates”, in white, on both sides | H131: 1pc/shrink pack, 6pcs/ctn Gross Weight: 0,65 kg | I131: =RC[-8] -> 1560 | J131: =VLOOKUP(RC[-9],'/Users/marcvilfeu/Dropbox/HLDP/Docs importants/[Commande Fournisseurs.xlsm]COMPARATIF'!R4C28:R2500C52,9,FALSE) -> 3760223790764
A132: 1559 | B132: =IF(ISNA(VLOOKUP(RC[-1],Import!R3C3:R2000C3,1,FALSE)),"","1") ->  | C132: FOAM ROLLER BASIQUE | D132: EPE Foam Roller | F132: Length: 90 cm Diameter: 15 cm Color: Blue | H132: 1pc/shrink pack, 10pcs/ctn | I132: =RC[-8] -> 1559 | J132: =VLOOKUP(RC[-9],'/Users/marcvilfeu/Dropbox/HLDP/Docs importants/[Commande Fournisseurs.xlsm]COMPARATIF'!R4C28:R2500C52,9,FALSE) -> 3760223792683
A133: 2583 | B133: =IF(ISNA(VLOOKUP(RC[-1],Import!R3C3:R2000C3,1,FALSE)),"","1") ->  | C133: GANT DE SAC LF' | D133: Sandbag gloves | F133: Material: PU LOGO: Leaderfit Equipement, printed in white on both gloves | I133: =RC[-8] -> 2583 | J133: =VLOOKUP(RC[-9],'/Users/marcvilfeu/Dropbox/HLDP/Docs importants/[Commande Fournisseurs.xlsm]COMPARATIF'!R4C28:R2500C52,9,FALSE) -> 3760223792690
A134: 3525 | B134: =IF(ISNA(VLOOKUP(RC[-1],Import!R3C3:R2000C3,1,FALSE)),"","1") ->  | C134: GLUTE HAM | D134: GLUTE HAM | H134: Gross Weight: 26 Kgs | I134: =RC[-8] -> 3525 | J134: =VLOOKUP(RC[-9],'/Users/marcvilfeu/Dropbox/HLDP/Docs importants/[Commande Fournisseurs.xlsm]COMPARATIF'!R4C28:R2500C52,9,FALSE) -> 3760223790870
A135: 2331 | B135: =IF(ISNA(VLOOKUP(RC[-1],Import!R3C3:R2000C3,1,FALSE)),"","1") ->  | C135: GILET LESTE FEMME 10KG AJUSTABLE | D135: 10kgs Women weightedVEST | F135: Color: pink Adjustable from 1 to 10kgs Logo: LEADERFIT, on the front | I135: =RC[-8] -> 2331 | J135: =VLOOKUP(RC[-9],'/Users/marcvilfeu/Dropbox/HLDP/Docs importants/[Commande Fournisseurs.xlsm]COMPARATIF'!R4C28:R2500C52,9,FALSE) -> 3760223793765
A136: 4044 | B136: =IF(ISNA(VLOOKUP(RC[-1],Import!R3C3:R2000C3,1,FALSE)),"","1") ->  | C136: GILET LESTE CROSS TRAINING 20KG AJUSTABLE | D136: 20kgs crossfit weighted VEST | F136: Color: military colors Adjustable from 1 to 20kgs Logo: LEADERFIT, on the front | I136: =RC[-8] -> 4044 | J136: =VLOOKUP(RC[-9],'/Users/marcvilfeu/Dropbox/HLDP/Docs importants/[Commande Fournisseurs.xlsm]COMPARATIF'!R4C28:R2500C52,9,FALSE) -> 3760223793772
A137: 4043 | B137: =IF(ISNA(VLOOKUP(RC[-1],Import!R3C3:R2000C3,1,FALSE)),"","1") ->  | C137: GILET LESTE NEOPRENE 10KG | D137: Neoprene Weight Vest 10kgs | F137: Material: Neoprene With longer strap on the front With yellow trim for 10kgs, and pink trim on 5kgs | H137: 1PC/POLYBAG,20KG/CARTON | I137: =RC[-8] -> 4043 | J137: =VLOOKUP(RC[-9],'/Users/marcvilfeu/Dropbox/HLDP/Docs importants/[Commande Fournisseurs.xlsm]COMPARATIF'!R4C28:R2500C52,9,FALSE) -> 3760223790702
A138: 4041 | B138: =IF(ISNA(VLOOKUP(RC[-1],Import!R3C3:R2000C3,1,FALSE)),"","1") ->  | C138: GILET LESTE NEOPRENE 5KG | D138: Neoprene Weight Vest 5kgs | I138: =RC[-8] -> 4041 | J138: =VLOOKUP(RC[-9],'/Users/marcvilfeu/Dropbox/HLDP/Docs importants/[Commande Fournisseurs.xlsm]COMPARATIF'!R4C28:R2500C52,9,FALSE) -> 3760223790696
A139: 3641 | B139: =IF(ISNA(VLOOKUP(RC[-1],Import!R3C3:R2000C3,1,FALSE)),"","1") ->  | C139: GRIPBALL | D139: Grip Ball | F139: Diameter of the ball: cm | H139: 0,5 kgs | I139: =RC[-8] -> 3641 | J139: =VLOOKUP(RC[-9],'/Users/marcvilfeu/Dropbox/HLDP/Docs importants/[Commande Fournisseurs.xlsm]COMPARATIF'!R4C28:R2500C52,9,FALSE) -> 3760223790917
A140: 1966 | B140: =IF(ISNA(VLOOKUP(RC[-1],Import!R3C3:R2000C3,1,FALSE)),"","1") ->  | C140: GRIP POUR BARRE | D140: Grip for bar | F140: Color: Blue Inside Diameter: 51mm | I140: =RC[-8] -> 1966 | J140: =VLOOKUP(RC[-9],'/Users/marcvilfeu/Dropbox/HLDP/Docs importants/[Commande Fournisseurs.xlsm]COMPARATIF'!R4C28:R2500C52,9,FALSE) -> 3760223793727
A141: 1576 | B141: =IF(ISNA(VLOOKUP(RC[-1],Import!R3C3:R2000C3,1,FALSE)),"","1") ->  | C141: HAIE 15CM | I141: =RC[-8] -> 1576 | J141: =VLOOKUP(RC[-9],'/Users/marcvilfeu/Dropbox/HLDP/Docs importants/[Commande Fournisseurs.xlsm]COMPARATIF'!R4C28:R2500C52,9,FALSE) -> 0
A142: 1577 | B142: =IF(ISNA(VLOOKUP(RC[-1],Import!R3C3:R2000C3,1,FALSE)),"","1") ->  | C142: HAIE 30CM | I142: =RC[-8] -> 1577 | J142: =VLOOKUP(RC[-9],'/Users/marcvilfeu/Dropbox/HLDP/Docs importants/[Commande Fournisseurs.xlsm]COMPARATIF'!R4C28:R2500C52,9,FALSE) -> 0
A143: 1578 | B143: =IF(ISNA(VLOOKUP(RC[-1],Import!R3C3:R2000C3,1,FALSE)),"","1") ->  | C143: HAIE 50CM | I143: =RC[-8] -> 1578 | J143: =VLOOKUP(RC[-9],'/Users/marcvilfeu/Dropbox/HLDP/Docs importants/[Commande Fournisseurs.xlsm]COMPARATIF'!R4C28:R2500C52,9,FALSE) -> 0
A144: 2057 | B144: =IF(ISNA(VLOOKUP(RC[-1],Import!R3C3:R2000C3,1,FALSE)),"","1") ->  | C144: HALTERES CAOUTCHOUC HEXAGONAUX 1KG | D144: HEXAGONAL RUBBER DUMBBELL 1KG | F144: The weight of the dumbbell must be written (like on the photo with the 30kgs dumbbell). Raised numbers for easy identification Solid steel knurled ergonomic handle with zinc coating Cast metal dumbbell with rubber coating The weight must be firmly attached to the central bar, so that it cannot be removed. | I144: =RC[-8] -> 2057 | J144: =VLOOKUP(RC[-9],'/Users/marcvilfeu/Dropbox/HLDP/Docs importants/[Commande Fournisseurs.xlsm]COMPARATIF'!R4C28:R2500C52,9,FALSE) -> 3760223792706
A145: 2058 | B145: =IF(ISNA(VLOOKUP(RC[-1],Import!R3C3:R2000C3,1,FALSE)),"","1") ->  | C145: HALTERES CAOUTCHOUC HEXAGONAUX 2KG | D145: HEXAGONAL RUBBER DUMBBELL 2KG | F145: The weight of the dumbbell must be written (like on the photo with the 30kgs dumbbell). Raised numbers for easy identification Solid steel knurled ergonomic handle with zinc coating Cast metal dumbbell with rubber coating The weight must be firmly attached to the central bar, so that it cannot be removed. | I145: =RC[-8] -> 2058 | J145: =VLOOKUP(RC[-9],'/Users/marcvilfeu/Dropbox/HLDP/Docs importants/[Commande Fournisseurs.xlsm]COMPARATIF'!R4C28:R2500C52,9,FALSE) -> 3760223791648
A146: 2059 | B146: =IF(ISNA(VLOOKUP(RC[-1],Import!R3C3:R2000C3,1,FALSE)),"","1") ->  | C146: HALTERES CAOUTCHOUC HEXAGONAUX 4KG | D146: HEXAGONAL RUBBER DUMBBELL 4KG | F146: The weight of the dumbbell must be written (like on the photo with the 30kgs dumbbell). Raised numbers for easy identification Solid steel knurled ergonomic handle with zinc coating Cast metal dumbbell with rubber coating The weight must be firmly attached to the central bar, so that it cannot be removed. | I146: =RC[-8] -> 2059 | J146: =VLOOKUP(RC[-9],'/Users/marcvilfeu/Dropbox/HLDP/Docs importants/[Commande Fournisseurs.xlsm]COMPARATIF'!R4C28:R2500C52,9,FALSE) -> 3760223791655
A147: 2062 | B147: =IF(ISNA(VLOOKUP(RC[-1],Import!R3C3:R2000C3,1,FALSE)),"","1") ->  | C147: HALTERES CAOUTCHOUC HEXAGONAUX 6 KG | D147: HEXAGONAL RUBBER DUMBBELL 6KG | F147: The weight of the dumbbell must be written (like on the photo with the 30kgs dumbbell). Raised numbers for easy identification Solid steel knurled ergonomic handle with zinc coating Cast metal dumbbell with rubber coating The weight must be firmly attached to the central bar, so that it cannot be removed. | I147: =RC[-8] -> 2062 | J147: =VLOOKUP(RC[-9],'/Users/marcvilfeu/Dropbox/HLDP/Docs importants/[Commande Fournisseurs.xlsm]COMPARATIF'!R4C28:R2500C52,9,FALSE) -> 3760223791662
A148: 2064 | B148: =IF(ISNA(VLOOKUP(RC[-1],Import!R3C3:R2000C3,1,FALSE)),"","1") ->  | C148: HALTERES CAOUTCHOUC HEXAGONAUX 8 KG | D148: HEXAGONAL RUBBER DUMBBELL 8KG | F148: The weight of the dumbbell must be written (like on the photo with the 30kgs dumbbell). Raised numbers for easy identification Solid steel knurled ergonomic handle with zinc coating Cast metal dumbbell with rubber coating The weight must be firmly attached to the central bar, so that it cannot be removed. | I148: =RC[-8] -> 2064 | J148: =VLOOKUP(RC[-9],'/Users/marcvilfeu/Dropbox/HLDP/Docs importants/[Commande Fournisseurs.xlsm]COMPARATIF'!R4C28:R2500C52,9,FALSE) -> 3760223791150
A149: 2066 | B149: =IF(ISNA(VLOOKUP(RC[-1],Import!R3C3:R2000C3,1,FALSE)),"","1") ->  | C149: HALTERES CAOUTCHOUC HEXAGONAUX 10 KG | D149: HEXAGONAL RUBBER DUMBBELL 10KG | F149: The weight of the dumbbell must be written (like on the photo with the 30kgs dumbbell). Raised numbers for easy identification Solid steel knurled ergonomic handle with zinc coating Cast metal dumbbell with rubber coating The weight must be firmly attached to the central bar, so that it cannot be removed. | I149: =RC[-8] -> 2066 | J149: =VLOOKUP(RC[-9],'/Users/marcvilfeu/Dropbox/HLDP/Docs importants/[Commande Fournisseurs.xlsm]COMPARATIF'!R4C28:R2500C52,9,FALSE) -> 3760223791167
A150: 1589 | B150: =IF(ISNA(VLOOKUP(RC[-1],Import!R3C3:R2000C3,1,FALSE)),"","1") ->  | C150: HALTERES CAOUTCHOUC HEXAGONAUX 12,5 KG | D150: HEXAGONAL RUBBER DUMBBELL 12,5KG | F150: The weight of the dumbbell must be written (like on the photo with the 30kgs dumbbell). Raised numbers for easy identification Solid steel knurled ergonomic handle with zinc coating Cast metal dumbbell with rubber coating The weight must be firmly attached to the central bar, so that it cannot be removed. | I150: =RC[-8] -> 1589 | J150: =VLOOKUP(RC[-9],'/Users/marcvilfeu/Dropbox/HLDP/Docs importants/[Commande Fournisseurs.xlsm]COMPARATIF'!R4C28:R2500C52,9,FALSE) -> 3760223791174
A151: 1590 | B151: =IF(ISNA(VLOOKUP(RC[-1],Import!R3C3:R2000C3,1,FALSE)),"","1") ->  | C151: HALTERES CAOUTCHOUC HEXAGONAUX 15 KG | D151: HEXAGONAL RUBBER DUMBBELL 15KG | F151: The weight of the dumbbell must be written (like on the photo with the 30kgs dumbbell). Raised numbers for easy identification Solid steel knurled ergonomic handle with zinc coating Cast metal dumbbell with rubber coating The weight must be firmly attached to the central bar, so that it cannot be removed. | I151: =RC[-8] -> 1590 | J151: =VLOOKUP(RC[-9],'/Users/marcvilfeu/Dropbox/HLDP/Docs importants/[Commande Fournisseurs.xlsm]COMPARATIF'!R4C28:R2500C52,9,FALSE) -> 3760223794335
A152: 1591 | B152: =IF(ISNA(VLOOKUP(RC[-1],Import!R3C3:R2000C3,1,FALSE)),"","1") ->  | C152: HALTERES CAOUTCHOUC HEXAGONAUX 17,5 KG | D152: HEXAGONAL RUBBER DUMBBELL 17,5KG | F152: The weight of the dumbbell must be written (like on the photo with the 30kgs dumbbell). Raised numbers for easy identification Solid steel knurled ergonomic handle with zinc coating Cast metal dumbbell with rubber coating The weight must be firmly attached to the central bar, so that it cannot be removed. | I152: =RC[-8] -> 1591 | J152: =VLOOKUP(RC[-9],'/Users/marcvilfeu/Dropbox/HLDP/Docs importants/[Commande Fournisseurs.xlsm]COMPARATIF'!R4C28:R2500C52,9,FALSE) -> 3760223791181
A153: 1592 | B153: =IF(ISNA(VLOOKUP(RC[-1],Import!R3C3:R2000C3,1,FALSE)),"","1") ->  | C153: HALTERES CAOUTCHOUC HEXAGONAUX 20 KG | D153: HEXAGONAL RUBBER DUMBBELL 20KG | F153: The weight of the dumbbell must be written (like on the photo with the 30kgs dumbbell). Raised numbers for easy identification Solid steel knurled ergonomic handle with zinc coating Cast metal dumbbell with rubber coating The weight must be firmly attached to the central bar, so that it cannot be removed. | I153: =RC[-8] -> 1592 | J153: =VLOOKUP(RC[-9],'/Users/marcvilfeu/Dropbox/HLDP/Docs importants/[Commande Fournisseurs.xlsm]COMPARATIF'!R4C28:R2500C52,9,FALSE) -> 3760223791723
A154: 1593 | B154: =IF(ISNA(VLOOKUP(RC[-1],Import!R3C3:R2000C3,1,FALSE)),"","1") ->  | C154: HALTERES CAOUTCHOUC HEXAGONAUX 22,5 KG | D154: HEXAGONAL RUBBER DUMBBELL 22,5KG | F154: The weight of the dumbbell must be written (like on the photo with the 30kgs dumbbell). Raised numbers for easy identification Solid steel knurled ergonomic handle with zinc coating Cast metal dumbbell with rubber coating The weight must be firmly attached to the central bar, so that it cannot be removed. | I154: =RC[-8] -> 1593 | J154: =VLOOKUP(RC[-9],'/Users/marcvilfeu/Dropbox/HLDP/Docs importants/[Commande Fournisseurs.xlsm]COMPARATIF'!R4C28:R2500C52,9,FALSE) -> 3760223792713
A155: 1594 | B155: =IF(ISNA(VLOOKUP(RC[-1],Import!R3C3:R2000C3,1,FALSE)),"","1") ->  | C155: HALTERES CAOUTCHOUC HEXAGONAUX 25 KG | D155: HEXAGONAL RUBBER DUMBBELL 25KG | F155: The weight of the dumbbell must be written (like on the photo with the 30kgs dumbbell). Raised numbers for easy identification Solid steel knurled ergonomic handle with zinc coating Cast metal dumbbell with rubber coating The weight must be firmly attached to the central bar, so that it cannot be removed. | I155: =RC[-8] -> 1594 | J155: =VLOOKUP(RC[-9],'/Users/marcvilfeu/Dropbox/HLDP/Docs importants/[Commande Fournisseurs.xlsm]COMPARATIF'!R4C28:R2500C52,9,FALSE) -> 3760223791730
A156: 1595 | B156: =IF(ISNA(VLOOKUP(RC[-1],Import!R3C3:R2000C3,1,FALSE)),"","1") ->  | C156: HALTERES CAOUTCHOUC HEXAGONAUX 27,5 KG | D156: HEXAGONAL RUBBER DUMBBELL 27,5KG | F156: The weight of the dumbbell must be written (like on the photo with the 30kgs dumbbell). Raised numbers for easy identification Solid steel knurled ergonomic handle with zinc coating Cast metal dumbbell with rubber coating The weight must be firmly attached to the central bar, so that it cannot be removed. | I156: =RC[-8] -> 1595 | J156: =VLOOKUP(RC[-9],'/Users/marcvilfeu/Dropbox/HLDP/Docs importants/[Commande Fournisseurs.xlsm]COMPARATIF'!R4C28:R2500C52,9,FALSE) -> 3760223792720
A157: 1596 | B157: =IF(ISNA(VLOOKUP(RC[-1],Import!R3C3:R2000C3,1,FALSE)),"","1") ->  | C157: HALTERES CAOUTCHOUC HEXAGONAUX 30 KG | D157: HEXAGONAL RUBBER DUMBBELL 30KG | F157: The weight of the dumbbell must be written (like on the photo with the 30kgs dumbbell). Raised numbers for easy identification Solid steel knurled ergonomic handle with zinc coating Cast metal dumbbell with rubber coating The weight must be firmly attached to the central bar, so that it cannot be removed. | I157: =RC[-8] -> 1596 | J157: =VLOOKUP(RC[-9],'/Users/marcvilfeu/Dropbox/HLDP/Docs importants/[Commande Fournisseurs.xlsm]COMPARATIF'!R4C28:R2500C52,9,FALSE) -> 3760223792737
A158: 1597 | B158: =IF(ISNA(VLOOKUP(RC[-1],Import!R3C3:R2000C3,1,FALSE)),"","1") ->  | C158: HALTERES CAOUTCHOUC HEXAGONAUX 32,5 KG | D158: HEXAGONAL RUBBER DUMBBELL 32,5KG | F158: The weight of the dumbbell must be written (like on the photo with the 30kgs dumbbell). Raised numbers for easy identification Solid steel knurled ergonomic handle with zinc coating Cast metal dumbbell with rubber coating The weight must be firmly attached to the central bar, so that it cannot be removed. | I158: =RC[-8] -> 1597 | J158: =VLOOKUP(RC[-9],'/Users/marcvilfeu/Dropbox/HLDP/Docs importants/[Commande Fournisseurs.xlsm]COMPARATIF'!R4C28:R2500C52,9,FALSE) -> 3760223792744
A159: 1598 | B159: =IF(ISNA(VLOOKUP(RC[-1],Import!R3C3:R2000C3,1,FALSE)),"","1") ->  | C159: HALTERES CAOUTCHOUC HEXAGONAUX 35 KG | D159: HEXAGONAL RUBBER DUMBBELL 35KG | F159: The weight of the dumbbell must be written (like on the photo with the 30kgs dumbbell). Raised numbers for easy identification Solid steel knurled ergonomic handle with zinc coating Cast metal dumbbell with rubber coating The weight must be firmly attached to the central bar, so that it cannot be removed. | I159: =RC[-8] -> 1598 | J159: =VLOOKUP(RC[-9],'/Users/marcvilfeu/Dropbox/HLDP/Docs importants/[Commande Fournisseurs.xlsm]COMPARATIF'!R4C28:R2500C52,9,FALSE) -> 3760223791747
A160: 2484 | B160: =IF(ISNA(VLOOKUP(RC[-1],Import!R3C3:R2000C3,1,FALSE)),"","1") ->  | C160: HALTERES CAOUTCHOUC HEXAGONAUX 37,5 KG | D160: HEXAGONAL RUBBER DUMBBELL 37,5KG | F160: The weight of the dumbbell must be written (like on the photo with the 30kgs dumbbell). Raised numbers for easy identification Solid steel knurled ergonomic handle with zinc coating Cast metal dumbbell with rubber coating The weight must be firmly attached to the central bar, so that it cannot be removed. | I160: =RC[-8] -> 2484 | J160: =VLOOKUP(RC[-9],'/Users/marcvilfeu/Dropbox/HLDP/Docs importants/[Commande Fournisseurs.xlsm]COMPARATIF'!R4C28:R2500C52,9,FALSE) -> 3760223791754
A161: 2068 | B161: =IF(ISNA(VLOOKUP(RC[-1],Import!R3C3:R2000C3,1,FALSE)),"","1") ->  | C161: HALTERES CAOUTCHOUC HEXAGONAUX 40 KG | D161: HEXAGONAL RUBBER DUMBBELL 40KG | F161: The weight of the dumbbell must be written (like on the photo with the 30kgs dumbbell). Raised numbers for easy identification Solid steel knurled ergonomic handle with zinc coating Cast metal dumbbell with rubber coating The weight must be firmly attached to the central bar, so that it cannot be removed. | I161: =RC[-8] -> 2068 | J161: =VLOOKUP(RC[-9],'/Users/marcvilfeu/Dropbox/HLDP/Docs importants/[Commande Fournisseurs.xlsm]COMPARATIF'!R4C28:R2500C52,9,FALSE) -> 3760223791198
A162: 2485 | B162: =IF(ISNA(VLOOKUP(RC[-1],Import!R3C3:R2000C3,1,FALSE)),"","1") ->  | C162: HALTERES CAOUTCHOUC HEXAGONAUX 42,5 KG | D162: HEXAGONAL RUBBER DUMBBELL 42,5KG | F162: The weight of the dumbbell must be written (like on the photo with the 30kgs dumbbell). Raised numbers for easy identification Solid steel knurled ergonomic handle with zinc coating Cast metal dumbbell with rubber coating The weight must be firmly attached to the central bar, so that it cannot be removed. | I162: =RC[-8] -> 2485 | J162: =VLOOKUP(RC[-9],'/Users/marcvilfeu/Dropbox/HLDP/Docs importants/[Commande Fournisseurs.xlsm]COMPARATIF'!R4C28:R2500C52,9,FALSE) -> 3760223792751
A163: 2071 | B163: =IF(ISNA(VLOOKUP(RC[-1],Import!R3C3:R2000C3,1,FALSE)),"","1") ->  | C163: HALTERES CAOUTCHOUC HEXAGONAUX 45 KG | D163: HEXAGONAL RUBBER DUMBBELL 45KG | F163: The weight of the dumbbell must be written (like on the photo with the 30kgs dumbbell). Raised numbers for easy identification Solid steel knurled ergonomic handle with zinc coating Cast metal dumbbell with rubber coating The weight must be firmly attached to the central bar, so that it cannot be removed. | I163: =RC[-8] -> 2071 | J163: =VLOOKUP(RC[-9],'/Users/marcvilfeu/Dropbox/HLDP/Docs importants/[Commande Fournisseurs.xlsm]COMPARATIF'!R4C28:R2500C52,9,FALSE) -> 3760223791778
A164: 2486 | B164: =IF(ISNA(VLOOKUP(RC[-1],Import!R3C3:R2000C3,1,FALSE)),"","1") ->  | C164: HALTERES CAOUTCHOUC HEXAGONAUX 47,5 KG | D164: HEXAGONAL RUBBER DUMBBELL 47,5KG | F164: The weight of the dumbbell must be written (like on the photo with the 30kgs dumbbell). Raised numbers for easy identification Solid steel knurled ergonomic handle with zinc coating Cast metal dumbbell with rubber coating The weight must be firmly attached to the central bar, so that it cannot be removed. | I164: =RC[-8] -> 2486 | J164: =VLOOKUP(RC[-9],'/Users/marcvilfeu/Dropbox/HLDP/Docs importants/[Commande Fournisseurs.xlsm]COMPARATIF'!R4C28:R2500C52,9,FALSE) -> 3760223792768
A165: 2074 | B165: =IF(ISNA(VLOOKUP(RC[-1],Import!R3C3:R2000C3,1,FALSE)),"","1") ->  | C165: HALTERES CAOUTCHOUC HEXAGONAUX 50 KG | D165: HEXAGONAL RUBBER DUMBBELL 50KG | F165: The weight of the dumbbell must be written (like on the photo with the 30kgs dumbbell). Raised numbers for easy identification Solid steel knurled ergonomic handle with zinc coating Cast metal dumbbell with rubber coating The weight must be firmly attached to the central bar, so that it cannot be removed. | I165: =RC[-8] -> 2074 | J165: =VLOOKUP(RC[-9],'/Users/marcvilfeu/Dropbox/HLDP/Docs importants/[Commande Fournisseurs.xlsm]COMPARATIF'!R4C28:R2500C52,9,FALSE) -> 3760223791785
A166: 2993 | B166: =IF(ISNA(VLOOKUP(RC[-1],Import!R3C3:R2000C3,1,FALSE)),"","1") ->  | C166: HALTERES VINYLES 0,5 KG ROSE | D166: VINYL DIPPING DUMBBELL HEXAGONAL 0,5 KGS | F166: Weight: 0,5 kgs, printed in white on both sides Color: Pink (pantone 213C) Sold by Unit Cast iron dumbbell encased with vinyl shell LOGO: Leaderfit, printed in white on both sides | I166: =RC[-8] -> 2993 | J166: =VLOOKUP(RC[-9],'/Users/marcvilfeu/Dropbox/HLDP/Docs importants/[Commande Fournisseurs.xlsm]COMPARATIF'!R4C28:R2500C52,9,FALSE) -> 3760223791204
A167: 1616 | B167: =IF(ISNA(VLOOKUP(RC[-1],Import!R3C3:R2000C3,1,FALSE)),"","1") ->  | C167: HALTERES VINYLES 1 KG BLEU | D167: VINYL DIPPING DUMBBELL HEXAGONAL 1 KGS | F167: Weight: 1 kg, printed in white on both sides Color: Yellow (pantone 102C) Sold by Unit Cast iron dumbbell encased with vinyl shell LOGO: Leaderfit, printed in white on both sides | I167: =RC[-8] -> 1616 | J167: =VLOOKUP(RC[-9],'/Users/marcvilfeu/Dropbox/HLDP/Docs importants/[Commande Fournisseurs.xlsm]COMPARATIF'!R4C28:R2500C52,9,FALSE) -> 3760223791808
A168: 2994 | B168: =IF(ISNA(VLOOKUP(RC[-1],Import!R3C3:R2000C3,1,FALSE)),"","1") ->  | C168: HALTERES VINYLES 2 KG JAUNE | D168: VINYL DIPPING DUMBBELL HEXAGONAL 2 KGS | F168: Weight: 2 kgs, printed in white on both sides Color: Green (pantone 361C) Sold by Unit Cast iron dumbbell encased with vinyl shell LOGO: Leaderfit, printed in white on both sides | I168: =RC[-8] -> 2994 | J168: =VLOOKUP(RC[-9],'/Users/marcvilfeu/Dropbox/HLDP/Docs importants/[Commande Fournisseurs.xlsm]COMPARATIF'!R4C28:R2500C52,9,FALSE) -> 3760223791211
A169: 2995 | B169: =IF(ISNA(VLOOKUP(RC[-1],Import!R3C3:R2000C3,1,FALSE)),"","1") ->  | C169: HALTERES VINYLES 3 KG VERT | D169: VINYL DIPPING DUMBBELL HEXAGONAL 3 KGS | F169: Weight: 3 kgs, printed in white on both sides Color: Blue (pantone 306 C) Sold by Unit Cast iron dumbbell encased with vinyl shell LOGO: Leaderfit, printed in white on both sides | I169: =RC[-8] -> 2995 | J169: =VLOOKUP(RC[-9],'/Users/marcvilfeu/Dropbox/HLDP/Docs importants/[Commande Fournisseurs.xlsm]COMPARATIF'!R4C28:R2500C52,9,FALSE) -> 3760223792775
A170: 2996 | B170: =IF(ISNA(VLOOKUP(RC[-1],Import!R3C3:R2000C3,1,FALSE)),"","1") ->  | C170: HALTERES VINYLES 4 KG ORANGE | D170: VINYL DIPPING DUMBBELL HEXAGONAL 4 KGS | F170: Weight: 4 kgs, printed in white on both sides Color: Red (pantone 485C) Sold by Unit Cast iron dumbbell encased with vinyl shell LOGO: Leaderfit, printed in white on both sides | I170: =RC[-8] -> 2996 | J170: =VLOOKUP(RC[-9],'/Users/marcvilfeu/Dropbox/HLDP/Docs importants/[Commande Fournisseurs.xlsm]COMPARATIF'!R4C28:R2500C52,9,FALSE) -> 3760223792782
A171: 2997 | B171: =IF(ISNA(VLOOKUP(RC[-1],Import!R3C3:R2000C3,1,FALSE)),"","1") ->  | C171: HALTERES VINYLES 5 KG NOIR | D171: VINYL DIPPING DUMBBELL HEXAGONAL 5 KGS | F171: Weight: 5 kgs, printed in white on both sides Color: Black Sold by Unit Cast iron dumbbell encased with vinyl shell LOGO: Leaderfit, printed in white on both sides | I171: =RC[-8] -> 2997 | J171: =VLOOKUP(RC[-9],'/Users/marcvilfeu/Dropbox/HLDP/Docs importants/[Commande Fournisseurs.xlsm]COMPARATIF'!R4C28:R2500C52,9,FALSE) -> 3760223792799
A172: 2362 | B172: =IF(ISNA(VLOOKUP(RC[-1],Import!R3C3:R2000C3,1,FALSE)),"","1") ->  | C172: HEX BAR | D172: Hex Bar | F172: Net Weight: 20 kgs Main tube: 30*3 mm Dimensions: 150cm LOGO: “LEADERFIT” on both ends of the bar. Aluminum label clipped. | H172: With brown carton and wood. 21 kgs | I172: =RC[-8] -> 2362 | J172: =VLOOKUP(RC[-9],'/Users/marcvilfeu/Dropbox/HLDP/Docs importants/[Commande Fournisseurs.xlsm]COMPARATIF'!R4C28:R2500C52,9,FALSE) -> 3760223791822
A173: 1625 | B173: =IF(ISNA(VLOOKUP(RC[-1],Import!R3C3:R2000C3,1,FALSE)),"","1") ->  | C173: HOME TRAINER | D173: Abdo Trainer | F173: Size: 53(L)x24.5(W)x7(H)cm ? Main tube size: dia.25*1,2 mm LOGO: Leaderfit, printed in white on the head | H173: 1,2 kgs | I173: =RC[-8] -> 1625 | J173: =VLOOKUP(RC[-9],'/Users/marcvilfeu/Dropbox/HLDP/Docs importants/[Commande Fournisseurs.xlsm]COMPARATIF'!R4C28:R2500C52,9,FALSE) -> 3760223792805
A174: 1975 | B174: =IF(ISNA(VLOOKUP(RC[-1],Import!R3C3:R2000C3,1,FALSE)),"","1") ->  | C174: JELLY STRETCH LIGHT | D174: Jelly Expander Light | F174: Material:TPR Heavy(Blue) Medium(Orange) Light(Pink) | I174: =RC[-8] -> 1975 | J174: =VLOOKUP(RC[-9],'/Users/marcvilfeu/Dropbox/HLDP/Docs importants/[Commande Fournisseurs.xlsm]COMPARATIF'!R4C28:R2500C52,9,FALSE) -> 3760223793956
A175: 1976 | B175: =IF(ISNA(VLOOKUP(RC[-1],Import!R3C3:R2000C3,1,FALSE)),"","1") ->  | C175: JELLY STRETCH MEDIUM | D175: Jelly Expander Medium | I175: =RC[-8] -> 1976 | J175: =VLOOKUP(RC[-9],'/Users/marcvilfeu/Dropbox/HLDP/Docs importants/[Commande Fournisseurs.xlsm]COMPARATIF'!R4C28:R2500C52,9,FALSE) -> 3760223793963
A176: 1977 | B176: =IF(ISNA(VLOOKUP(RC[-1],Import!R3C3:R2000C3,1,FALSE)),"","1") ->  | C176: JELLY STRETCH STRONG | D176: Jelly Expander Strong | I176: =RC[-8] -> 1977 | J176: =VLOOKUP(RC[-9],'/Users/marcvilfeu/Dropbox/HLDP/Docs importants/[Commande Fournisseurs.xlsm]COMPARATIF'!R4C28:R2500C52,9,FALSE) -> 3760223793970
A177: 2884 | B177: =IF(ISNA(VLOOKUP(RC[-1],Import!R3C3:R2000C3,1,FALSE)),"","1") ->  | C177: J-HOOKS | D177: J-Hooks | H177: 4 kgs | I177: =RC[-8] -> 2884 | J177: =VLOOKUP(RC[-9],'/Users/marcvilfeu/Dropbox/HLDP/Docs importants/[Commande Fournisseurs.xlsm]COMPARATIF'!R4C28:R2500C52,9,FALSE) -> 3760223790887
A178: 2969 | B178: =IF(ISNA(VLOOKUP(RC[-1],Import!R3C3:R2000C3,1,FALSE)),"","1") ->  | C178: KETTLEBELL 4 KG | D178: Kettlebell 4Kg | F178: The weight of the kettlebell must be written in the middle of the product (see photo on the left) Perfectly balanced – stands alone The circle must be in yellow | I178: =RC[-8] -> 2969 | J178: =VLOOKUP(RC[-9],'/Users/marcvilfeu/Dropbox/HLDP/Docs importants/[Commande Fournisseurs.xlsm]COMPARATIF'!R4C28:R2500C52,9,FALSE) -> 3760223791228
A179: 2970 | B179: =IF(ISNA(VLOOKUP(RC[-1],Import!R3C3:R2000C3,1,FALSE)),"","1") ->  | C179: KETTLEBELL 6KG | D179: Kettlebell 6Kg | I179: =RC[-8] -> 2970 | J179: =VLOOKUP(RC[-9],'/Users/marcvilfeu/Dropbox/HLDP/Docs importants/[Commande Fournisseurs.xlsm]COMPARATIF'!R4C28:R2500C52,9,FALSE) -> 3760223791235
A180: 2971 | B180: =IF(ISNA(VLOOKUP(RC[-1],Import!R3C3:R2000C3,1,FALSE)),"","1") ->  | C180: KETTLEBELL 8 KG | D180: Kettlebell 8Kg | I180: =RC[-8] -> 2971 | J180: =VLOOKUP(RC[-9],'/Users/marcvilfeu/Dropbox/HLDP/Docs importants/[Commande Fournisseurs.xlsm]COMPARATIF'!R4C28:R2500C52,9,FALSE) -> 3760223791242
A181: 2972 | B181: =IF(ISNA(VLOOKUP(RC[-1],Import!R3C3:R2000C3,1,FALSE)),"","1") ->  | C181: KETTLEBELL 10 KG | D181: Kettlebell 10Kg | I181: =RC[-8] -> 2972 | J181: =VLOOKUP(RC[-9],'/Users/marcvilfeu/Dropbox/HLDP/Docs importants/[Commande Fournisseurs.xlsm]COMPARATIF'!R4C28:R2500C52,9,FALSE) -> 3760223791259
A182: 2973 | B182: =IF(ISNA(VLOOKUP(RC[-1],Import!R3C3:R2000C3,1,FALSE)),"","1") ->  | C182: KETTLEBELL 12 KG | D182: Kettlebell 12Kg | I182: =RC[-8] -> 2973 | J182: =VLOOKUP(RC[-9],'/Users/marcvilfeu/Dropbox/HLDP/Docs importants/[Commande Fournisseurs.xlsm]COMPARATIF'!R4C28:R2500C52,9,FALSE) -> 3760223791266
A183: 2974 | B183: =IF(ISNA(VLOOKUP(RC[-1],Import!R3C3:R2000C3,1,FALSE)),"","1") ->  | C183: KETTLEBELL 16 KG | D183: Kettlebell 16Kg | I183: =RC[-8] -> 2974 | J183: =VLOOKUP(RC[-9],'/Users/marcvilfeu/Dropbox/HLDP/Docs importants/[Commande Fournisseurs.xlsm]COMPARATIF'!R4C28:R2500C52,9,FALSE) -> 3760223791273
A184: 2975 | B184: =IF(ISNA(VLOOKUP(RC[-1],Import!R3C3:R2000C3,1,FALSE)),"","1") ->  | C184: KETTLEBELL 20 KG | D184: Kettlebell 20Kg | I184: =RC[-8] -> 2975 | J184: =VLOOKUP(RC[-9],'/Users/marcvilfeu/Dropbox/HLDP/Docs importants/[Commande Fournisseurs.xlsm]COMPARATIF'!R4C28:R2500C52,9,FALSE) -> 3760223790474
A185: 2976 | B185: =IF(ISNA(VLOOKUP(RC[-1],Import!R3C3:R2000C3,1,FALSE)),"","1") ->  | C185: KETTLEBELL 24 KG | D185: Kettlebell 24Kg | I185: =RC[-8] -> 2976 | J185: =VLOOKUP(RC[-9],'/Users/marcvilfeu/Dropbox/HLDP/Docs importants/[Commande Fournisseurs.xlsm]COMPARATIF'!R4C28:R2500C52,9,FALSE) -> 3760223790481
A186: 3529 | B186: =IF(ISNA(VLOOKUP(RC[-1],Import!R3C3:R2000C3,1,FALSE)),"","1") ->  | C186: KETTLEBELL 28 KG | D186: Kettlebell 28Kg | I186: =RC[-8] -> 3529 | J186: =VLOOKUP(RC[-9],'/Users/marcvilfeu/Dropbox/HLDP/Docs importants/[Commande Fournisseurs.xlsm]COMPARATIF'!R4C28:R2500C52,9,FALSE) -> 3760223792812
A187: 3530 | B187: =IF(ISNA(VLOOKUP(RC[-1],Import!R3C3:R2000C3,1,FALSE)),"","1") ->  | C187: KETTLEBELL 32 KG | D187: Kettlebell 32Kg | I187: =RC[-8] -> 3530 | J187: =VLOOKUP(RC[-9],'/Users/marcvilfeu/Dropbox/HLDP/Docs importants/[Commande Fournisseurs.xlsm]COMPARATIF'!R4C28:R2500C52,9,FALSE) -> 3760223792829
A188: 3531 | B188: =IF(ISNA(VLOOKUP(RC[-1],Import!R3C3:R2000C3,1,FALSE)),"","1") ->  | C188: KETTLEBELL 36 KG | D188: Kettlebell 36Kg | I188: =RC[-8] -> 3531 | J188: =VLOOKUP(RC[-9],'/Users/marcvilfeu/Dropbox/HLDP/Docs importants/[Commande Fournisseurs.xlsm]COMPARATIF'!R4C28:R2500C52,9,FALSE) -> 3760223792836
A189: 3532 | B189: =IF(ISNA(VLOOKUP(RC[-1],Import!R3C3:R2000C3,1,FALSE)),"","1") ->  | C189: KETTLEBELL 40 KG | D189: Kettlebell 40Kg | I189: =RC[-8] -> 3532 | J189: =VLOOKUP(RC[-9],'/Users/marcvilfeu/Dropbox/HLDP/Docs importants/[Commande Fournisseurs.xlsm]COMPARATIF'!R4C28:R2500C52,9,FALSE) -> 3760223791839
A190: 3533 | B190: =IF(ISNA(VLOOKUP(RC[-1],Import!R3C3:R2000C3,1,FALSE)),"","1") ->  | C190: KETTLEBELL 44 KG | D190: Kettlebell 44Kg | I190: =RC[-8] -> 3533 | J190: =VLOOKUP(RC[-9],'/Users/marcvilfeu/Dropbox/HLDP/Docs importants/[Commande Fournisseurs.xlsm]COMPARATIF'!R4C28:R2500C52,9,FALSE) -> 3760223792843
A191: 3534 | B191: =IF(ISNA(VLOOKUP(RC[-1],Import!R3C3:R2000C3,1,FALSE)),"","1") ->  | C191: KETTLEBELL 48 KG | D191: Kettlebell 48Kg | I191: =RC[-8] -> 3534 | J191: =VLOOKUP(RC[-9],'/Users/marcvilfeu/Dropbox/HLDP/Docs importants/[Commande Fournisseurs.xlsm]COMPARATIF'!R4C28:R2500C52,9,FALSE) -> 3760223792850
A192: 3584 | B192: =IF(ISNA(VLOOKUP(RC[-1],Import!R3C3:R2000C3,1,FALSE)),"","1") ->  | C192: KETTLEBELL CAST IRON 4 KG | D192: KETTLEBELL CAST IRON 4 KG | F192: The weight of the kettlebell must be written in the middle of the product (see photo on the left) Perfectly balanced – stands alone | I192: =RC[-8] -> 3584 | J192: =VLOOKUP(RC[-9],'/Users/marcvilfeu/Dropbox/HLDP/Docs importants/[Commande Fournisseurs.xlsm]COMPARATIF'!R4C28:R2500C52,9,FALSE) -> 3760223794298
A193: 3585 | B193: =IF(ISNA(VLOOKUP(RC[-1],Import!R3C3:R2000C3,1,FALSE)),"","1") ->  | C193: KETTLEBELL CAST IRON 8 KG | D193: KETTLEBELL CAST IRON 8 KG | I193: =RC[-8] -> 3585 | J193: =VLOOKUP(RC[-9],'/Users/marcvilfeu/Dropbox/HLDP/Docs importants/[Commande Fournisseurs.xlsm]COMPARATIF'!R4C28:R2500C52,9,FALSE) -> 3760223794304
A194: 3586 | B194: =IF(ISNA(VLOOKUP(RC[-1],Import!R3C3:R2000C3,1,FALSE)),"","1") ->  | C194: KETTLEBELL CAST IRON 10 KG | D194: KETTLEBELL CAST IRON 10 KG | I194: =RC[-8] -> 3586 | J194: =VLOOKUP(RC[-9],'/Users/marcvilfeu/Dropbox/HLDP/Docs importants/[Commande Fournisseurs.xlsm]COMPARATIF'!R4C28:R2500C52,9,FALSE) -> 3760223794229
A195: 3587 | B195: =IF(ISNA(VLOOKUP(RC[-1],Import!R3C3:R2000C3,1,FALSE)),"","1") ->  | C195: KETTLEBELL CAST IRON 12 KG | D195: KETTLEBELL CAST IRON 12 KG | I195: =RC[-8] -> 3587 | J195: =VLOOKUP(RC[-9],'/Users/marcvilfeu/Dropbox/HLDP/Docs importants/[Commande Fournisseurs.xlsm]COMPARATIF'!R4C28:R2500C52,9,FALSE) -> 3760223794236
A196: 3588 | B196: =IF(ISNA(VLOOKUP(RC[-1],Import!R3C3:R2000C3,1,FALSE)),"","1") ->  | C196: KETTLEBELL CAST IRON 16 KG | D196: KETTLEBELL CAST IRON 16 KG | I196: =RC[-8] -> 3588 | J196: =VLOOKUP(RC[-9],'/Users/marcvilfeu/Dropbox/HLDP/Docs importants/[Commande Fournisseurs.xlsm]COMPARATIF'!R4C28:R2500C52,9,FALSE) -> 3760223794243
A197: 3589 | B197: =IF(ISNA(VLOOKUP(RC[-1],Import!R3C3:R2000C3,1,FALSE)),"","1") ->  | C197: KETTLEBELL CAST IRON 20 KG | D197: KETTLEBELL CAST IRON 20 KG | I197: =RC[-8] -> 3589 | J197: =VLOOKUP(RC[-9],'/Users/marcvilfeu/Dropbox/HLDP/Docs importants/[Commande Fournisseurs.xlsm]COMPARATIF'!R4C28:R2500C52,9,FALSE) -> 3760223794250
A198: 3590 | B198: =IF(ISNA(VLOOKUP(RC[-1],Import!R3C3:R2000C3,1,FALSE)),"","1") ->  | C198: KETTLEBELL CAST IRON 24 KG | D198: KETTLEBELL CAST IRON 24 KG | I198: =RC[-8] -> 3590 | J198: =VLOOKUP(RC[-9],'/Users/marcvilfeu/Dropbox/HLDP/Docs importants/[Commande Fournisseurs.xlsm]COMPARATIF'!R4C28:R2500C52,9,FALSE) -> 3760223794267
A199: 3591 | B199: =IF(ISNA(VLOOKUP(RC[-1],Import!R3C3:R2000C3,1,FALSE)),"","1") ->  | C199: KETTLEBELL CAST IRON 28 KG | D199: KETTLEBELL CAST IRON 28 KG | I199: =RC[-8] -> 3591 | J199: =VLOOKUP(RC[-9],'/Users/marcvilfeu/Dropbox/HLDP/Docs importants/[Commande Fournisseurs.xlsm]COMPARATIF'!R4C28:R2500C52,9,FALSE) -> 3760223794274
A200: 3592 | B200: =IF(ISNA(VLOOKUP(RC[-1],Import!R3C3:R2000C3,1,FALSE)),"","1") ->  | C200: KETTLEBELL CAST IRON 32 KG | D200: KETTLEBELL CAST IRON 32 KG | I200: =RC[-8] -> 3592 | J200: =VLOOKUP(RC[-9],'/Users/marcvilfeu/Dropbox/HLDP/Docs importants/[Commande Fournisseurs.xlsm]COMPARATIF'!R4C28:R2500C52,9,FALSE) -> 3760223794281
A201: 3705 | B201: =IF(ISNA(VLOOKUP(RC[-1],Import!R3C3:R2000C3,1,FALSE)),"","1") ->  | C201: KETTLEBELL STORAGE | D201: Kettlebell Storage | F201: Can store from 4 to 6 kettlebells | I201: =RC[-8] -> 3705 | J201: =VLOOKUP(RC[-9],'/Users/marcvilfeu/Dropbox/HLDP/Docs importants/[Commande Fournisseurs.xlsm]COMPARATIF'!R4C28:R2500C52,9,FALSE) -> 3760223792867
A202: 2322 | B202: =IF(ISNA(VLOOKUP(RC[-1],Import!R3C3:R2000C3,1,FALSE)),"","1") ->  | C202: KIT DE PARCOURS | I202: =RC[-8] -> 2322 | J202: =VLOOKUP(RC[-9],'/Users/zilu/Desktop/HLDP/Docs Importants/Super important/[Commande Fournisseurs19122016.xlsm]COMPARATIF'!R4C28:R5700C52,9,FALSE) -> 0
A203: 2312 | B203: =IF(ISNA(VLOOKUP(RC[-1],Import!R3C3:R2000C3,1,FALSE)),"","1") ->  | C203: KIT PUMP 20KG (ROSE/JAUNE/VERT) | D203: Pump Set 20 kgs | F203: Composition: 1 rubber coated hollow steel bar Length 1,40m Diameter: 30mm. Tube thickness: 2,5mm Weight: 2,5 kgs Color rubber plate: 2x1,25kgs; 2x2,5kgs; 2x5kgs 2 Collars for regular bar 30mm (ref 1110-24B), with “LEADERFIT” printed in white. Colors: 1,25Kgs: Pink (pantone 806 2X) 2,5Kgs: Yellow (pantone 2X) 5Kgs: Green (pantone 368 2X) | H203: The 2 collars must be put into the carton with the plates. | I203: =RC[-8] -> 2312 | J203: =VLOOKUP(RC[-9],'/Users/marcvilfeu/Dropbox/HLDP/Docs importants/[Commande Fournisseurs.xlsm]COMPARATIF'!R4C28:R2500C52,9,FALSE) -> 3760223791846
A204: 2903 | B204: =IF(ISNA(VLOOKUP(RC[-1],Import!R3C3:R2000C3,1,FALSE)),"","1") ->  | C204: KIT PUMP 8,5KG COULEUR (JAUNE/VERT) | D204: Pump Set 8,5 kgs | F204: Composition: 1 rubber coated hollow steel bar Length 1,40m. Tube thickness: 2,5mm Diameter: 30mm Weight: 2,5 kgs Color rubber plate: 2x1,25kgs; 2x2,5kgs 2 Collars for regular bar 30mm (ref 1110-24B), with “LEADERFIT” printed in white. Colors: 1,25Kgs: Pink (pantone 806 2X) 2,5Kgs: Yellow (pantone 2X) | H204: The 2 collars must be put into the carton with the plates. | I204: =RC[-8] -> 2903 | J204: =VLOOKUP(RC[-9],'/Users/marcvilfeu/Dropbox/HLDP/Docs importants/[Commande Fournisseurs.xlsm]COMPARATIF'!R4C28:R2500C52,9,FALSE) -> 0
A205: 3537 | B205: =IF(ISNA(VLOOKUP(RC[-1],Import!R3C3:R2000C3,1,FALSE)),"","1") ->  | C205: KIT PUMP 20KG NOIR | D205: Pump Set 20 kgs black | F205: Composition: 1 rubber coated hollow steel bar Length 1,40m Diameter: 30mm Weight: 2,5 kgs Black rubber plate: 2x1,25kgs; 2x2,5kgs; 2x5kgs 2 Collars for regular bar 30mm (ref 1110-24B), with “LEADERFIT” printed in white. Colors: All plates must be black | H205: The 2 collars must be put into the carton with the plates. | I205: =RC[-8] -> 3537 | J205: =VLOOKUP(RC[-9],'/Users/marcvilfeu/Dropbox/HLDP/Docs importants/[Commande Fournisseurs.xlsm]COMPARATIF'!R4C28:R2500C52,9,FALSE) -> 3760223791853
A206: 3559 | B206: =IF(ISNA(VLOOKUP(RC[-1],Import!R3C3:R2000C3,1,FALSE)),"","1") ->  | C206: LF SUSPENSION TRAINER JAUNE | D206: SUSPENSION SYSTEM | F206: Length: 120 cm Colors: Yellow and black LOGO: Leaderfit, in color, woven Hooks must be the one on the photo on the left | I206: =RC[-8] -> 3559 | J206: =VLOOKUP(RC[-9],'/Users/marcvilfeu/Dropbox/HLDP/Docs importants/[Commande Fournisseurs.xlsm]COMPARATIF'!R4C28:R2500C52,9,FALSE) -> 3760223790436
A207: 1973 | B207: =IF(ISNA(VLOOKUP(RC[-1],Import!R3C3:R2000C3,1,FALSE)),"","1") ->  | C207: LF SUSPENSION TRAINER ROSE | D207: SUSPENSION SYSTEM PINK & BLACK | F207: Length: 120 cm Colors: Pink and black (all yellow on the photo must be replaced by pink). LOGO: Leaderfit, in color , woven Hooks must be the one on the photo on the left | I207: =RC[-8] -> 1973 | J207: =VLOOKUP(RC[-9],'/Users/marcvilfeu/Dropbox/HLDP/Docs importants/[Commande Fournisseurs.xlsm]COMPARATIF'!R4C28:R2500C52,9,FALSE) -> 3760223793925
A208: 2358 | B208: =IF(ISNA(VLOOKUP(RC[-1],Import!R3C3:R2000C3,1,FALSE)),"","1") ->  | C208: MANCHON MOUSSE | D208: Barbell Pad | F208: Material: Foam Length: 38 cm Diameter: 80 mm LOGO Leaderfit, in white | H208: 0,25 kgs | I208: =RC[-8] -> 2358 | J208: =VLOOKUP(RC[-9],'/Users/marcvilfeu/Dropbox/HLDP/Docs importants/[Commande Fournisseurs.xlsm]COMPARATIF'!R4C28:R2500C52,9,FALSE) -> 3760223791860
A209: 1945 | B209: =IF(ISNA(VLOOKUP(RC[-1],Import!R3C3:R2000C3,1,FALSE)),"","1") ->  | C209: MANNEQUIN DE FRAPPE LF | D209: FREE STANDING PUNCHING BAG | F209: Weight: 20 kgs Total Height: 178 cm Surface: PVC, Inner material: PE, Base material: Plastic. Strenghtened plastic. Top Foam: 45*45*140 cm Base: 68*68*38 cm LOGO: Leaderfit, in white | H209: Gross Weight: 20 kgs | I209: =RC[-8] -> 1945 | J209: =VLOOKUP(RC[-9],'/Users/marcvilfeu/Dropbox/HLDP/Docs importants/[Commande Fournisseurs.xlsm]COMPARATIF'!R4C28:R2500C52,9,FALSE) -> 3760223792911
A210: 1978 | B210: =IF(ISNA(VLOOKUP(RC[-1],Import!R3C3:R2000C3,1,FALSE)),"","1") ->  | C210: MANTA RAY | D210: TPR Bar protect | F210: Logo: Leaderfit, in white Length: 45cm Made to hold olympic bars | I210: =RC[-8] -> 1978 | J210: =VLOOKUP(RC[-9],'/Users/marcvilfeu/Dropbox/HLDP/Docs importants/[Commande Fournisseurs.xlsm]COMPARATIF'!R4C28:R2500C52,9,FALSE) -> 3760223793987
A211: 3671 | B211: =IF(ISNA(VLOOKUP(RC[-1],Import!R3C3:R2000C3,1,FALSE)),"","1") ->  | C211: MAX RACK AX1001 | D211: MAX RACK | F211: Dimensions: 180x145x240cm | H211: 200 kgs | I211: =RC[-8] -> 3671 | J211: =VLOOKUP(RC[-9],'/Users/marcvilfeu/Dropbox/HLDP/Docs importants/[Commande Fournisseurs.xlsm]COMPARATIF'!R4C28:R2500C52,9,FALSE) -> #N/A
A212: 1639 | B212: =IF(ISNA(VLOOKUP(RC[-1],Import!R3C3:R2000C3,1,FALSE)),"","1") ->  | C212: MEDECINE BALL 1KG | D212: Medecine Ball 1Kg | F212: LOGO Leaderfit, in black 1kg: diameter 195mm, pink (pantone 213C) 2kgs: dia. 195mm, yellow (pantone 102C) 3kgs: dia. 220mm, green (pantone 361C) 4kgs: dia. 220mm, light blue (pantone 306C) 5kgs: dia. 240mm, Red (pantone 485C) Rubber eighted centre for good balance | I212: =RC[-8] -> 1639 | J212: =VLOOKUP(RC[-9],'/Users/marcvilfeu/Dropbox/HLDP/Docs importants/[Commande Fournisseurs.xlsm]COMPARATIF'!R4C28:R2500C52,9,FALSE) -> 3760223792935
A213: 1640 | B213: =IF(ISNA(VLOOKUP(RC[-1],Import!R3C3:R2000C3,1,FALSE)),"","1") ->  | C213: MEDECINE BALL 2KG | D213: Medecine Ball 2Kg | I213: =RC[-8] -> 1640 | J213: =VLOOKUP(RC[-9],'/Users/marcvilfeu/Dropbox/HLDP/Docs importants/[Commande Fournisseurs.xlsm]COMPARATIF'!R4C28:R2500C52,9,FALSE) -> 3760223792072
A214: 1641 | B214: =IF(ISNA(VLOOKUP(RC[-1],Import!R3C3:R2000C3,1,FALSE)),"","1") ->  | C214: MEDECINE BALL 3KG | D214: Medecine Ball 3Kg | I214: =RC[-8] -> 1641 | J214: =VLOOKUP(RC[-9],'/Users/marcvilfeu/Dropbox/HLDP/Docs importants/[Commande Fournisseurs.xlsm]COMPARATIF'!R4C28:R2500C52,9,FALSE) -> 3760223792089
A215: 1642 | B215: =IF(ISNA(VLOOKUP(RC[-1],Import!R3C3:R2000C3,1,FALSE)),"","1") ->  | C215: MEDECINE BALL 4KG | D215: Medecine Ball 4Kg | I215: =RC[-8] -> 1642 | J215: =VLOOKUP(RC[-9],'/Users/marcvilfeu/Dropbox/HLDP/Docs importants/[Commande Fournisseurs.xlsm]COMPARATIF'!R4C28:R2500C52,9,FALSE) -> 3760223792096
A216: 1643 | B216: =IF(ISNA(VLOOKUP(RC[-1],Import!R3C3:R2000C3,1,FALSE)),"","1") ->  | C216: MEDECINE BALL 5KG | D216: Medecine Ball 5Kg | I216: =RC[-8] -> 1643 | J216: =VLOOKUP(RC[-9],'/Users/marcvilfeu/Dropbox/HLDP/Docs importants/[Commande Fournisseurs.xlsm]COMPARATIF'!R4C28:R2500C52,9,FALSE) -> 3760223792942
A217: 3547 | B217: =IF(ISNA(VLOOKUP(RC[-1],Import!R3C3:R2000C3,1,FALSE)),"","1") ->  | C217: MONKEY BAR 1080MM | D217: Monkey Bar - 1080Mm | F217: Length: 1080mm Tube diameter: 32 mm Thickness: 5 mm | H217: Gross Weight: 10 kgs Packed by piece. | I217: =RC[-8] -> 3547 | J217: =VLOOKUP(RC[-9],'/Users/marcvilfeu/Dropbox/HLDP/Docs importants/[Commande Fournisseurs.xlsm]COMPARATIF'!R4C28:R2500C52,9,FALSE) -> 3760223790559
A218: 3548 | B218: =IF(ISNA(VLOOKUP(RC[-1],Import!R3C3:R2000C3,1,FALSE)),"","1") ->  | C218: MONKEY BAR 1800MM | D218: Monkey Bar - 1800Mm | F218: Length: 1800mm Tube diameter: 32 mm Thickness: 5 mm | H218: Gross Weight: 14 kgs Packed by piece. | I218: =RC[-8] -> 3548 | J218: =VLOOKUP(RC[-9],'/Users/marcvilfeu/Dropbox/HLDP/Docs importants/[Commande Fournisseurs.xlsm]COMPARATIF'!R4C28:R2500C52,9,FALSE) -> 3760223791341
A219: 3549 | B219: =IF(ISNA(VLOOKUP(RC[-1],Import!R3C3:R2000C3,1,FALSE)),"","1") ->  | C219: MONKEY RACK 1080MM | D219: Monkey Rack - 1080Mm | F219: Length: 1080mm Max Weight: 300 kgs Tube size: 32*5mm | H219: Gross Weight: 18 kgs | I219: =RC[-8] -> 3549 | J219: =VLOOKUP(RC[-9],'/Users/marcvilfeu/Dropbox/HLDP/Docs importants/[Commande Fournisseurs.xlsm]COMPARATIF'!R4C28:R2500C52,9,FALSE) -> 3760223792959
A220: 3550 | B220: =IF(ISNA(VLOOKUP(RC[-1],Import!R3C3:R2000C3,1,FALSE)),"","1") ->  | C220: MONKEY RACK 1800MM | D220: Monkey Rack - 1800Mm | F220: Length: 1800mm Max Weight: 300 kgs Tube size: 32*5mm | H220: Gross Weight: 28,6 kgs | I220: =RC[-8] -> 3550 | J220: =VLOOKUP(RC[-9],'/Users/marcvilfeu/Dropbox/HLDP/Docs importants/[Commande Fournisseurs.xlsm]COMPARATIF'!R4C28:R2500C52,9,FALSE) -> 3760223792966
A221: 3421 | B221: =IF(ISNA(VLOOKUP(RC[-1],Import!R3C3:R2000C3,1,FALSE)),"","1") ->  | C221: MULTI-GRIP CHIN-UP | D221: Multi-Grip Chin-Up | F221: MAIN TUBE SIZE:50*50*2MM ASSEMBLE SIZE: 84*127*50CM Max Weight: 250 kgs Color: All in black | H221: Gross Weight: 22 kgs | I221: =RC[-8] -> 3421 | J221: =VLOOKUP(RC[-9],'/Users/marcvilfeu/Dropbox/HLDP/Docs importants/[Commande Fournisseurs.xlsm]COMPARATIF'!R4C28:R2500C52,9,FALSE) -> 3760223792973
A222: 3423 | B222: =IF(ISNA(VLOOKUP(RC[-1],Import!R3C3:R2000C3,1,FALSE)),"","1") ->  | C222: OVERPASS1800MM | D222: Overpass - 1800Mm | F222: Length: 1800mm Tube diameter 50mm Thickness: 3mm | H222: Gross Weight: 22 kgs Packed by piece. | I222: =RC[-8] -> 3423 | J222: =VLOOKUP(RC[-9],'/Users/marcvilfeu/Dropbox/HLDP/Docs importants/[Commande Fournisseurs.xlsm]COMPARATIF'!R4C28:R2500C52,9,FALSE) -> 3760223792997
A223: 3422 | B223: =IF(ISNA(VLOOKUP(RC[-1],Import!R3C3:R2000C3,1,FALSE)),"","1") ->  | C223: OVERPASS 1080MM | D223: Overpass- 1080Mm | F223: Length: 1080mm Tube diameter 50mm Thickness: 3mm | H223: Gross Weight: 13 kgs Packed by piece. | I223: =RC[-8] -> 3422 | J223: =VLOOKUP(RC[-9],'/Users/marcvilfeu/Dropbox/HLDP/Docs importants/[Commande Fournisseurs.xlsm]COMPARATIF'!R4C28:R2500C52,9,FALSE) -> 3760223792980
A224: 1985 | B224: =IF(ISNA(VLOOKUP(RC[-1],Import!R3C3:R2000C3,1,FALSE)),"","1") ->  | C224: PATTE D'OURS POUR MANNEQUIN DE FRAPPE | F224: Color: Black | I224: =RC[-8] -> 1985 | J224: =VLOOKUP(RC[-9],'/Users/marcvilfeu/Dropbox/HLDP/Docs importants/[Commande Fournisseurs.xlsm]COMPARATIF'!R4C28:R2500C52,9,FALSE) -> 3760223794106
A225: 1677 | B225: =IF(ISNA(VLOOKUP(RC[-1],Import!R3C3:R2000C3,1,FALSE)),"","1") ->  | C225: PARACHUTE DE RESISTANCE | I225: =RC[-8] -> 1677 | J225: =VLOOKUP(RC[-9],'/Users/marcvilfeu/Dropbox/HLDP/Docs importants/[Commande Fournisseurs.xlsm]COMPARATIF'!R4C28:R2500C52,9,FALSE) -> 0
A226: 3552 | B226: =IF(ISNA(VLOOKUP(RC[-1],Import!R3C3:R2000C3,1,FALSE)),"","1") ->  | C226: POWER BAND PEGS | D226: Power band pegs | I226: =RC[-8] -> 3552 | J226: =VLOOKUP(RC[-9],'/Users/marcvilfeu/Dropbox/HLDP/Docs importants/[Commande Fournisseurs.xlsm]COMPARATIF'!R4C28:R2500C52,9,FALSE) -> 3760223793109
A227: 1682 | B227: =IF(ISNA(VLOOKUP(RC[-1],Import!R3C3:R2000C3,1,FALSE)),"","1") ->  | C227: PILATES RING LF NOIR | D227: Pilates Ring Black | F227: Inside Diameter: 34 cm Outside Diameter: 37 cm Hardness of the foam handle: 38° Color: White/Black Material: Glass fiber Handle: ABS + EVA LOGO, “LF’Pilates”, in black, on both outside handles | H227: 1pc/polybag, 10pcs/ctn Gross Weight: 0,45 kg | I227: =RC[-8] -> 1682 | J227: =VLOOKUP(RC[-9],'/Users/marcvilfeu/Dropbox/HLDP/Docs importants/[Commande Fournisseurs.xlsm]COMPARATIF'!R4C28:R2500C52,9,FALSE) -> 3760223790450
A228: 1974 | B228: =IF(ISNA(VLOOKUP(RC[-1],Import!R3C3:R2000C3,1,FALSE)),"","1") ->  | C228: PILATES RING LF BLEU | D228: Pilates Ring Blue | F228: Inside Diameter: 34 cm Outside Diameter: 37 cm Hardness of the foam handle: 38° Color: Blue/white (pantone 300C) Material: Glass fiber Handle: ABS + EVA LOGO, “LF’Pilates”, in black, on both outside handles | H228: 1pc/polybag, 10pcs/ctn Gross Weight: 0,45 kg | I228: =RC[-8] -> 1974 | J228: =VLOOKUP(RC[-9],'/Users/marcvilfeu/Dropbox/HLDP/Docs importants/[Commande Fournisseurs.xlsm]COMPARATIF'!R4C28:R2500C52,9,FALSE) -> 3760223793949
A229: 1684 | B229: =IF(ISNA(VLOOKUP(RC[-1],Import!R3C3:R2000C3,1,FALSE)),"","1") ->  | C229: PINCES METAL STOP DISQUE | D229: COLLARS FOR OLYMPIC BAR | F229: Inside diameter 51mm Sold by pair | I229: =RC[-8] -> 1684 | J229: =VLOOKUP(RC[-9],'/Users/marcvilfeu/Dropbox/HLDP/Docs importants/[Commande Fournisseurs.xlsm]COMPARATIF'!R4C28:R2500C52,9,FALSE) -> 3760223793079
A230: 3689 | B230: =IF(ISNA(VLOOKUP(RC[-1],Import!R3C3:R2000C3,1,FALSE)),"","1") ->  | C230: PLYO PLATFORM | D230: Plyo Platform | H230: Gross Weight: 16 kgs | I230: =RC[-8] -> 3689 | J230: =VLOOKUP(RC[-9],'/Users/marcvilfeu/Dropbox/HLDP/Docs importants/[Commande Fournisseurs.xlsm]COMPARATIF'!R4C28:R2500C52,9,FALSE) -> 3760223791365
A231: 3704 | B231: =IF(ISNA(VLOOKUP(RC[-1],Import!R3C3:R2000C3,1,FALSE)),"","1") ->  | C231: PLATE STORAGE SLEEVE | D231: Plate Storage Sleeve | H231: Gross Weight: 6 kgs | I231: =RC[-8] -> 3704 | J231: =VLOOKUP(RC[-9],'/Users/marcvilfeu/Dropbox/HLDP/Docs importants/[Commande Fournisseurs.xlsm]COMPARATIF'!R4C28:R2500C52,9,FALSE) -> 3760223790894
A232: 3966 | B232: =IF(ISNA(VLOOKUP(RC[-1],Import!R3C3:R2000C3,1,FALSE)),"","1") ->  | C232: PLATEAU D'HALTEROPHILIE | D232: WeightLifting Platform | F232: Size:2.5M*2M*30MM Color:black rubber mat,conner in yellow Logo: Leaderfit, black printed on bamboo(double side) | H232: Gross Weight: 320 kgs | I232: =RC[-8] -> 3966 | J232: =VLOOKUP(RC[-9],'/Users/marcvilfeu/Dropbox/HLDP/Docs importants/[Commande Fournisseurs.xlsm]COMPARATIF'!R4C28:R2500C52,9,FALSE) -> 3760223792102
A233: 1685 | B233: =IF(ISNA(VLOOKUP(RC[-1],Import!R3C3:R2000C3,1,FALSE)),"","1") ->  | C233: PLOTS DE VITESSE PAR 48 | I233: =RC[-8] -> 1685 | J233: =VLOOKUP(RC[-9],'/Users/marcvilfeu/Dropbox/HLDP/Docs importants/[Commande Fournisseurs.xlsm]COMPARATIF'!R4C28:R2500C52,9,FALSE) -> 0
A234: 4016 | B234: =IF(ISNA(VLOOKUP(RC[-1],Import!R3C3:R2000C3,1,FALSE)),"","1") ->  | C234: PLYOBOX BOIS 40/50/60 NOIR | D234: Wooden plyobox | F234: Plyobox 3 in 1 Color: Black Sand With Sand surface Logo: printed in yellow (pantone 102C) 40/50/60cm | I234: =RC[-8] -> 4016 | J234: =VLOOKUP(RC[-9],'/Users/marcvilfeu/Dropbox/HLDP/Docs importants/[Commande Fournisseurs.xlsm]COMPARATIF'!R4C28:R2500C52,9,FALSE) -> 3760223793604
A235: 3690 | B235: =IF(ISNA(VLOOKUP(RC[-1],Import!R3C3:R2000C3,1,FALSE)),"","1") ->  | C235: PLYOMETRIC BOX BOARD | D235: Plyometric Box Board | F235: Length: 1080 mm | G235: 41cm | H235: 1,9 kgs | I235: =RC[-8] -> 3690 | J235: =VLOOKUP(RC[-9],'/Users/marcvilfeu/Dropbox/HLDP/Docs importants/[Commande Fournisseurs.xlsm]COMPARATIF'!R4C28:R2500C52,9,FALSE) -> 3760223793093
A236: 3691 | B236: =IF(ISNA(VLOOKUP(RC[-1],Import!R3C3:R2000C3,1,FALSE)),"","1") ->  | C236: POWER BAG 5KG | D236: Power Bag 5Kg | F236: LOGO Leaderfit, in white, in the middle of the bag (see photo) 5kg: orange(pantone 2018c) 10kgs: yellow (pantone 102C) 15kgs: green (pantone 361C) 20kgs: light blue (pantone 306C) 25kgs: Red (pantone 485C) Weight printed in white in both ends | H236: Carton must be strengthened | I236: =RC[-8] -> 3691 | J236: =VLOOKUP(RC[-9],'/Users/marcvilfeu/Dropbox/HLDP/Docs importants/[Commande Fournisseurs.xlsm]COMPARATIF'!R4C28:R2500C52,9,FALSE) -> 3760223790580
A237: 3692 | B237: =IF(ISNA(VLOOKUP(RC[-1],Import!R3C3:R2000C3,1,FALSE)),"","1") ->  | C237: POWER BAG 10KG | D237: Power Bag 10Kg | I237: =RC[-8] -> 3692 | J237: =VLOOKUP(RC[-9],'/Users/marcvilfeu/Dropbox/HLDP/Docs importants/[Commande Fournisseurs.xlsm]COMPARATIF'!R4C28:R2500C52,9,FALSE) -> 3760223790597
A238: 3693 | B238: =IF(ISNA(VLOOKUP(RC[-1],Import!R3C3:R2000C3,1,FALSE)),"","1") ->  | C238: POWER BAG 15KG | D238: Power Bag 15Kg | I238: =RC[-8] -> 3693 | J238: =VLOOKUP(RC[-9],'/Users/marcvilfeu/Dropbox/HLDP/Docs importants/[Commande Fournisseurs.xlsm]COMPARATIF'!R4C28:R2500C52,9,FALSE) -> 3760223790603
A239: 3694 | B239: =IF(ISNA(VLOOKUP(RC[-1],Import!R3C3:R2000C3,1,FALSE)),"","1") ->  | C239: POWER BAG 20KG | D239: Power Bag 20Kg | I239: =RC[-8] -> 3694 | J239: =VLOOKUP(RC[-9],'/Users/marcvilfeu/Dropbox/HLDP/Docs importants/[Commande Fournisseurs.xlsm]COMPARATIF'!R4C28:R2500C52,9,FALSE) -> 3760223790610
A240: 3695 | B240: =IF(ISNA(VLOOKUP(RC[-1],Import!R3C3:R2000C3,1,FALSE)),"","1") ->  | C240: POWER BAG 25KG | D240: Power Bag 25Kg | I240: =RC[-8] -> 3695 | J240: =VLOOKUP(RC[-9],'/Users/marcvilfeu/Dropbox/HLDP/Docs importants/[Commande Fournisseurs.xlsm]COMPARATIF'!R4C28:R2500C52,9,FALSE) -> 3760223790627
A241: 3697 | B241: =IF(ISNA(VLOOKUP(RC[-1],Import!R3C3:R2000C3,1,FALSE)),"","1") ->  | C241: POWER BAND EXTRA LIGHT | D241: Power Band Extra Light | F241: LOGO Leaderfit, in white Extra-light: Red, 2080*13*4,5 mm Light: Black, 2080*21*4,5 mm Medium: Purple, 2080*32*4,5 mm Strong: Green, 2080*45*4,5 mm Extra-strong: Blue, 2080*64*4,5 mm Material: Latex | I241: =RC[-8] -> 3697 | J241: =VLOOKUP(RC[-9],'/Users/marcvilfeu/Dropbox/HLDP/Docs importants/[Commande Fournisseurs.xlsm]COMPARATIF'!R4C28:R2500C52,9,FALSE) -> 3760223790986
A242: 3696 | B242: =IF(ISNA(VLOOKUP(RC[-1],Import!R3C3:R2000C3,1,FALSE)),"","1") ->  | C242: POWER BAND LIGHT | D242: Power Band Light | I242: =RC[-8] -> 3696 | J242: =VLOOKUP(RC[-9],'/Users/marcvilfeu/Dropbox/HLDP/Docs importants/[Commande Fournisseurs.xlsm]COMPARATIF'!R4C28:R2500C52,9,FALSE) -> 3760223790993
A243: 3699 | B243: =IF(ISNA(VLOOKUP(RC[-1],Import!R3C3:R2000C3,1,FALSE)),"","1") ->  | C243: POWER BAND MEDIUM | D243: Power Band Medium | I243: =RC[-8] -> 3699 | J243: =VLOOKUP(RC[-9],'/Users/marcvilfeu/Dropbox/HLDP/Docs importants/[Commande Fournisseurs.xlsm]COMPARATIF'!R4C28:R2500C52,9,FALSE) -> 3760223791020
A244: 3700 | B244: =IF(ISNA(VLOOKUP(RC[-1],Import!R3C3:R2000C3,1,FALSE)),"","1") ->  | C244: POWER BAND STRONG | D244: Power Band Strong | I244: =RC[-8] -> 3700 | J244: =VLOOKUP(RC[-9],'/Users/marcvilfeu/Dropbox/HLDP/Docs importants/[Commande Fournisseurs.xlsm]COMPARATIF'!R4C28:R2500C52,9,FALSE) -> 3760223791006
A245: 3698 | B245: =IF(ISNA(VLOOKUP(RC[-1],Import!R3C3:R2000C3,1,FALSE)),"","1") ->  | C245: POWER BAND EXTRA STRONG | D245: Power Band Extra Strong | I245: =RC[-8] -> 3698 | J245: =VLOOKUP(RC[-9],'/Users/marcvilfeu/Dropbox/HLDP/Docs importants/[Commande Fournisseurs.xlsm]COMPARATIF'!R4C28:R2500C52,9,FALSE) -> 3760223791013
A246: 1696 | B246: =IF(ISNA(VLOOKUP(RC[-1],Import!R3C3:R2000C3,1,FALSE)),"","1") ->  | C246: PRESS BALL | D246: Press Ball | F246: Diameter: 63 mm Color: Blue Hardness: Soft | I246: =RC[-8] -> 1696 | J246: =VLOOKUP(RC[-9],'/Users/marcvilfeu/Dropbox/HLDP/Docs importants/[Commande Fournisseurs.xlsm]COMPARATIF'!R4C28:R2500C52,9,FALSE) -> 3760223790795
A247: 3703 | B247: =IF(ISNA(VLOOKUP(RC[-1],Import!R3C3:R2000C3,1,FALSE)),"","1") ->  | C247: PUNCHING BAG RACK | D247: Punching bag rack | H247: Gross weight: 8 kgs | I247: =RC[-8] -> 3703 | J247: =VLOOKUP(RC[-9],'/Users/marcvilfeu/Dropbox/HLDP/Docs importants/[Commande Fournisseurs.xlsm]COMPARATIF'!R4C28:R2500C52,9,FALSE) -> 3760223791372
A248: 2364 | B248: =IF(ISNA(VLOOKUP(RC[-1],Import!R3C3:R2000C3,1,FALSE)),"","1") ->  | C248: PULLBOY BLEU | I248: =RC[-8] -> 2364 | J248: =VLOOKUP(RC[-9],'/Users/marcvilfeu/Dropbox/HLDP/Docs importants/[Commande Fournisseurs.xlsm]COMPARATIF'!R4C28:R2500C52,9,FALSE) -> 0
A249: 2584 | B249: =IF(ISNA(VLOOKUP(RC[-1],Import!R3C3:R2000C3,1,FALSE)),"","1") ->  | C249: PUSH UP BARS S | D249: Push up bar S | F249: Logo: Leaderfit, in white on the handle | H249: Packed by pair | I249: =RC[-8] -> 2584 | J249: =VLOOKUP(RC[-9],'/Users/marcvilfeu/Dropbox/HLDP/Docs importants/[Commande Fournisseurs.xlsm]COMPARATIF'!R4C28:R2500C52,9,FALSE) -> 3760223793116
A250: 2585 | B250: =IF(ISNA(VLOOKUP(RC[-1],Import!R3C3:R2000C3,1,FALSE)),"","1") ->  | C250: PUSH UP BARS ROTATIVES | D250: Rotational Push up bar | F250: Logo: "Leaderfit", in black on the handle Top of handle must be Yellow (pantone 102C), other parts in black | H250: Packed by pair | I250: =RC[-8] -> 2585 | J250: =VLOOKUP(RC[-9],'/Users/marcvilfeu/Dropbox/HLDP/Docs importants/[Commande Fournisseurs.xlsm]COMPARATIF'!R4C28:R2500C52,9,FALSE) -> 3760223790955
A251: 1697 | B251: =IF(ISNA(VLOOKUP(RC[-1],Import!R3C3:R2000C3,1,FALSE)),"","1") ->  | C251: RACK 10 KITS PUMP | D251: RACK FOR 10 PUMP SET | F251: Capacity: 10 Pump set 20kgs Dimensions: 90x75cm Length of the bars: | H251: Gross Weight: 20 kgs | I251: =RC[-8] -> 1697 | J251: =VLOOKUP(RC[-9],'/Users/marcvilfeu/Dropbox/HLDP/Docs importants/[Commande Fournisseurs.xlsm]COMPARATIF'!R4C28:R2500C52,9,FALSE) -> 3760223793123
A252: 1699 | B252: =IF(ISNA(VLOOKUP(RC[-1],Import!R3C3:R2000C3,1,FALSE)),"","1") ->  | C252: RACK 20 KITS PUMP GRIS | D252: Rack for 20 Pump Set | F252: Capacity: 20 Pump set 20kgs Dimensions: 140 × 48 × 108cm | H252: Gross Weight: 48 kgs | I252: =RC[-8] -> 1699 | J252: =VLOOKUP(RC[-9],'/Users/marcvilfeu/Dropbox/HLDP/Docs importants/[Commande Fournisseurs.xlsm]COMPARATIF'!R4C28:R2500C52,9,FALSE) -> 3760223791877
A253: 1992 | B253: =IF(ISNA(VLOOKUP(RC[-1],Import!R3C3:R2000C3,1,FALSE)),"","1") ->  | C253: RACK 20 KITS PUMP ROULANT | D253: Barbell Rack | F253: Dimensions: 157*65*156cm | I253: =RC[-8] -> 1992 | J253: =VLOOKUP(RC[-9],'/Users/marcvilfeu/Dropbox/HLDP/Docs importants/[Commande Fournisseurs.xlsm]COMPARATIF'!R4C28:R2500C52,9,FALSE) -> 3760223794137
A254: 2345 | B254: =IF(ISNA(VLOOKUP(RC[-1],Import!R3C3:R2000C3,1,FALSE)),"","1") ->  | C254: RACK 5 MEDECINE BALL | D254: Rack 5 Medecine Ball | F254: Color: Black Sand Dimensions: 64*56*146cm Main tube dimensions: 30*60*1,5 mm | H254: 7 kgs | I254: =RC[-8] -> 2345 | J254: =VLOOKUP(RC[-9],'/Users/marcvilfeu/Dropbox/HLDP/Docs importants/[Commande Fournisseurs.xlsm]COMPARATIF'!R4C28:R2500C52,9,FALSE) -> 3760223792164
A255: 1988 | B255: =IF(ISNA(VLOOKUP(RC[-1],Import!R3C3:R2000C3,1,FALSE)),"","1") ->  | C255: RACK 20 MEDECINE BALL & WALL BALL | D255: RACK 20 MEDECINE BALL & WALL BALL | F255: Color: Grey MAIN TUBE SIZE:60*30*2MM With 5 spaces per side | H255: PACKING:1SET/2 CARTONS | I255: =RC[-8] -> 1988 | J255: =VLOOKUP(RC[-9],'/Users/marcvilfeu/Dropbox/HLDP/Docs importants/[Commande Fournisseurs.xlsm]COMPARATIF'!R4C28:R2500C52,9,FALSE) -> 3760223794045
A256: 1704 | B256: =IF(ISNA(VLOOKUP(RC[-1],Import!R3C3:R2000C3,1,FALSE)),"","1") ->  | C256: RACK GYMBALL BALLON | D256: GYMBALL RACK | F256: Can store up to 9 gym balls Dimensions: 185x130cm Diameter of the rings: cm Must be adjustable | H256: 11 kgs | I256: =RC[-8] -> 1704 | J256: =VLOOKUP(RC[-9],'/Users/marcvilfeu/Dropbox/HLDP/Docs importants/[Commande Fournisseurs.xlsm]COMPARATIF'!R4C28:R2500C52,9,FALSE) -> 3760223790467
A257: 1718 | B257: =IF(ISNA(VLOOKUP(RC[-1],Import!R3C3:R2000C3,1,FALSE)),"","1") ->  | C257: RACK ACCESSOIRES | D257: RACK FOR ACCESSORIES | F257: Color: black Dimensions: 124*56*24,5 cm Dimensions : 488x438x120 cm Sold without the accessories | H257: 16 kgs | I257: =RC[-8] -> 1718 | J257: =VLOOKUP(RC[-9],'/Users/marcvilfeu/Dropbox/HLDP/Docs importants/[Commande Fournisseurs.xlsm]COMPARATIF'!R4C28:R2500C52,9,FALSE) -> 3760223791884
A258: 1718 | B258: =IF(ISNA(VLOOKUP(RC[-1],Import!R3C3:R2000C3,1,FALSE)),"","1") ->  | C258: RACK ACCESSOIRES | D258: RACK FOR ACCESSORIES | F258: Color: grey Sold without the accessories Assembly size:47*43*101cm | H258: 16 kgs | I258: =RC[-8] -> 1718 | J258: =VLOOKUP(RC[-9],'/Users/marcvilfeu/Dropbox/HLDP/Docs importants/[Commande Fournisseurs.xlsm]COMPARATIF'!R4C28:R2500C52,9,FALSE) -> 3760223791884
A259: 3555 | B259: =IF(ISNA(VLOOKUP(RC[-1],Import!R3C3:R2000C3,1,FALSE)),"","1") ->  | C259: RACK BARRES MURAL | D259: WALL BAR RACK | F259: Color: black Dimensions : 40*110 cm Sold by pair Capacity: 6 bars | H259: 7 kgs | I259: =RC[-8] -> 3555 | J259: =VLOOKUP(RC[-9],'/Users/marcvilfeu/Dropbox/HLDP/Docs importants/[Commande Fournisseurs.xlsm]COMPARATIF'!R4C28:R2500C52,9,FALSE) -> 3760223793154
A260: 3398 | B260: =IF(ISNA(VLOOKUP(RC[-1],Import!R3C3:R2000C3,1,FALSE)),"","1") ->  | C260: RACK BARRES VERTICAL | D260: RACK FOR BARBELL | F260: Color: black Dimensions : 1200x690x305mm Inside diameter of the holes: 52 mm | H260: 14,8 kgs | I260: =RC[-8] -> 3398 | J260: =VLOOKUP(RC[-9],'/Users/marcvilfeu/Dropbox/HLDP/Docs importants/[Commande Fournisseurs.xlsm]COMPARATIF'!R4C28:R2500C52,9,FALSE) -> 3760223790498
A261: 1970 | B261: =IF(ISNA(VLOOKUP(RC[-1],Import!R3C3:R2000C3,1,FALSE)),"","1") ->  | C261: RACK DISQUE BUMPER VERTICAL | D261: Vertical Rack for bumper plates | F261: Color: Black Tube size:45*2mm Height of the tube: 90cm Dimensions of the rack: 45cm x 45cm Can hold up to 300 kgs With wheels | H261: 16,5 kgs | I261: =RC[-8] -> 1970 | J261: =VLOOKUP(RC[-9],'/Users/marcvilfeu/Dropbox/HLDP/Docs importants/[Commande Fournisseurs.xlsm]COMPARATIF'!R4C28:R2500C52,9,FALSE) -> 3760223793796
A262: 1705 | B262: =IF(ISNA(VLOOKUP(RC[-1],Import!R3C3:R2000C3,1,FALSE)),"","1") ->  | C262: RACK DISQUES | D262: RACK FOR PLATE | F262: MAIN TUBE SIZE:80*40*1.5MM Color: Grey | H262: 16,5 kgs | I262: =RC[-8] -> 1705 | J262: =VLOOKUP(RC[-9],'/Users/marcvilfeu/Dropbox/HLDP/Docs importants/[Commande Fournisseurs.xlsm]COMPARATIF'!R4C28:R2500C52,9,FALSE) -> 3760223793161
A263: 1717 | B263: =IF(ISNA(VLOOKUP(RC[-1],Import!R3C3:R2000C3,1,FALSE)),"","1") ->  | C263: RACK DISQUES & BARRES | D263: RACK FOR BARBELL AND PLATES | F263: Color: black Dimensions : 70,8 x 48 x 96 cm Diameter of the small bars: 50mm Length of the bars: cm 6 storage posts and 6 bars holders Bars & plates aren’t included | H263: 27 kgs | I263: =RC[-8] -> 1717 | J263: =VLOOKUP(RC[-9],'/Users/marcvilfeu/Dropbox/HLDP/Docs importants/[Commande Fournisseurs.xlsm]COMPARATIF'!R4C28:R2500C52,9,FALSE) -> 3760223793178
A264: 1709 | B264: =IF(ISNA(VLOOKUP(RC[-1],Import!R3C3:R2000C3,1,FALSE)),"","1") ->  | C264: RACK DOMES TRAINER | D264: RACK FOR DOME TRAINERS | F264: Capacity: Can store up to 8 dome trainers Dimensions: 150x100x40cm | H264: Gross Weight: 30 kgs | I264: =RC[-8] -> 1709 | J264: =VLOOKUP(RC[-9],'/Users/marcvilfeu/Dropbox/HLDP/Docs importants/[Commande Fournisseurs.xlsm]COMPARATIF'!R4C28:R2500C52,9,FALSE) -> 3760223793185
A265: 1710 | B265: =IF(ISNA(VLOOKUP(RC[-1],Import!R3C3:R2000C3,1,FALSE)),"","1") ->  | C265: RACK FOAM ROLLER | D265: FOAM ROLLER RACK | F265: Can store up to 5 foam rollers Dimensions: 97x19,5x6 cm Material: EVA foam | H265: 0,2 kgs | I265: =RC[-8] -> 1710 | J265: =VLOOKUP(RC[-9],'/Users/marcvilfeu/Dropbox/HLDP/Docs importants/[Commande Fournisseurs.xlsm]COMPARATIF'!R4C28:R2500C52,9,FALSE) -> 3760223793192
A266: 2239 | B266: =IF(ISNA(VLOOKUP(RC[-1],Import!R3C3:R2000C3,1,FALSE)),"","1") ->  | C266: RACK HALTERES VINYLES FITNESS ROULANT | D266: RACK FOR DUMBBELLS W/WHEELS | F266: Dimensions: 118x96x62cm Space between each bar: from the left to the right on the photo. Space must be the same on bottom and on the top: Lock bar with hole on the top. Possibility to store the bar on the left side. Height of the bars: cm Support plate for dumbbells Diameter of the wheels: mm | I266: =RC[-8] -> 2239 | J266: =VLOOKUP(RC[-9],'/Users/marcvilfeu/Dropbox/HLDP/Docs importants/[Commande Fournisseurs.xlsm]COMPARATIF'!R4C28:R2500C52,9,FALSE) -> 3760223793208
A267: 3777 | B267: =IF(ISNA(VLOOKUP(RC[-1],Import!R3C3:R2000C3,1,FALSE)),"","1") ->  | C267: RACK HALTERES 10 À 15 PAIRES | D267: Hexagonal Dumbbell Rack | F267: Color: Black Sand Main tube thickness: 2 mm | H267: 95 kgs | I267: =RC[-8] -> 3777 | J267: =VLOOKUP(RC[-9],'/Users/marcvilfeu/Dropbox/HLDP/Docs importants/[Commande Fournisseurs.xlsm]COMPARATIF'!R4C28:R2500C52,9,FALSE) -> 3760223791891
A268: 1713 | B268: =IF(ISNA(VLOOKUP(RC[-1],Import!R3C3:R2000C3,1,FALSE)),"","1") ->  | C268: RACK KETTLEBELL SMALL | D268: Rack for Kettlebell | F268: Dimensions: 80x60x75cm Main tube size: 60*60*1,5 mm Color: Black | H268: 25,5 kgs | I268: =RC[-8] -> 1713 | J268: =VLOOKUP(RC[-9],'/Users/marcvilfeu/Dropbox/HLDP/Docs importants/[Commande Fournisseurs.xlsm]COMPARATIF'!R4C28:R2500C52,9,FALSE) -> 3760223791280
A269: 1993 | B269: =IF(ISNA(VLOOKUP(RC[-1],Import!R3C3:R2000C3,1,FALSE)),"","1") ->  | C269: RACK KETTLEBELL | D269: Rack for Kettlebell | F269: Main tube:30*60*1.5mm | I269: =RC[-8] -> 1993 | J269: =VLOOKUP(RC[-9],'/Users/marcvilfeu/Dropbox/HLDP/Docs importants/[Commande Fournisseurs.xlsm]COMPARATIF'!R4C28:R2500C52,9,FALSE) -> 3760223794144
A270: 1716 | B270: =IF(ISNA(VLOOKUP(RC[-1],Import!R3C3:R2000C3,1,FALSE)),"","1") ->  | C270: RACK TAPIS MURAL | D270: WALL MAT RACK | I270: =RC[-8] -> 1716 | J270: =VLOOKUP(RC[-9],'/Users/marcvilfeu/Dropbox/HLDP/Docs importants/[Commande Fournisseurs.xlsm]COMPARATIF'!R4C28:R2500C52,9,FALSE) -> 3760223793215
A271: 2347 | B271: =IF(ISNA(VLOOKUP(RC[-1],Import!R3C3:R2000C3,1,FALSE)),"","1") ->  | C271: RACK POWER BAG | D271: Power Bag Rack | F271: Dimensions: 86.5x59x145.5cm Main tube size: 30*60*1,5 mm | H271: packed with two cartons，73x65x13.5cm，149x24.5x10cm，N/G.W:7.4/13KG 8.6/14.4KG Gross weight: 16 kgs | I271: =RC[-8] -> 2347 | J271: =VLOOKUP(RC[-9],'/Users/marcvilfeu/Dropbox/HLDP/Docs importants/[Commande Fournisseurs.xlsm]COMPARATIF'!R4C28:R2500C52,9,FALSE) -> 3760223790504
A272: 4023 | B272: =IF(ISNA(VLOOKUP(RC[-1],Import!R3C3:R2000C3,1,FALSE)),"","1") ->  | C272: RANGEMENT MURAL POUR CORDE | D272: ROPE STORAGE | F272: Dimensions: 23*5*28cm | H272: 0,2 kgs | I272: =RC[-8] -> 4023 | J272: =VLOOKUP(RC[-9],'/Users/marcvilfeu/Dropbox/HLDP/Docs importants/[Commande Fournisseurs.xlsm]COMPARATIF'!R4C28:R2500C52,9,FALSE) -> #N/A
A273: 1719 | B273: =IF(ISNA(VLOOKUP(RC[-1],Import!R3C3:R2000C3,1,FALSE)),"","1") ->  | C273: RACK TAPIS ROULANT | D273: EXERCISE MAT RACK W/WHEELS | F273: Dimensions: 185x60x35cm Adjustable height | G273: Gross Weight: 19 kgs | H273: Gross Weight: 19 kgs | I273: =RC[-8] -> 1719 | J273: =VLOOKUP(RC[-9],'/Users/marcvilfeu/Dropbox/HLDP/Docs importants/[Commande Fournisseurs.xlsm]COMPARATIF'!R4C28:R2500C52,9,FALSE) -> 3760223793222
A274: 3480 | B274: =IF(ISNA(VLOOKUP(RC[-1],Import!R3C3:R2000C3,1,FALSE)),"","1") ->  | C274: ROTATIONAL CORE | D274: Rotational Core | F274: Tube Inside diameter 51mm | H274: Gross weight: 3,53 kgs | I274: =RC[-8] -> 3480 | J274: =VLOOKUP(RC[-9],'/Users/marcvilfeu/Dropbox/HLDP/Docs importants/[Commande Fournisseurs.xlsm]COMPARATIF'!R4C28:R2500C52,9,FALSE) -> 3760223793246
A275: 1726 | B275: =IF(ISNA(VLOOKUP(RC[-1],Import!R3C3:R2000C3,1,FALSE)),"","1") ->  | C275: BANDE LATEX ROULEAU LIGHT 25M | D275: Elastic Band Roller Light | F275: Dimensions: Light: 25mx15cmx0.3mm, pink (pantone:213C) Medium: 25mx15cmx0.4mm, yellow (pantone:102C) Strong: 25mx15cmx0.5mm, green (pantone:361C) | H275: 1,2 kgs | I275: =RC[-8] -> 1726 | J275: =VLOOKUP(RC[-9],'/Users/marcvilfeu/Dropbox/HLDP/Docs importants/[Commande Fournisseurs.xlsm]COMPARATIF'!R4C28:R2500C52,9,FALSE) -> 3760223791297
A276: 1727 | B276: =IF(ISNA(VLOOKUP(RC[-1],Import!R3C3:R2000C3,1,FALSE)),"","1") ->  | C276: BANDE LATEX ROULEAU MEDIUM 25M | D276: Elastic Band Roller Medium | H276: 1,3 kgs | I276: =RC[-8] -> 1727 | J276: =VLOOKUP(RC[-9],'/Users/marcvilfeu/Dropbox/HLDP/Docs importants/[Commande Fournisseurs.xlsm]COMPARATIF'!R4C28:R2500C52,9,FALSE) -> 3760223791303
A277: 3491 | B277: =IF(ISNA(VLOOKUP(RC[-1],Import!R3C3:R2000C3,1,FALSE)),"","1") ->  | C277: BANDE LATEX ROULEAU STRONG 25M | D277: Elastic Band Roller Strong | H277: 1,7 kgs | I277: =RC[-8] -> 3491 | J277: =VLOOKUP(RC[-9],'/Users/marcvilfeu/Dropbox/HLDP/Docs importants/[Commande Fournisseurs.xlsm]COMPARATIF'!R4C28:R2500C52,9,FALSE) -> 3760223791921
A278: 1971 | B278: =IF(ISNA(VLOOKUP(RC[-1],Import!R3C3:R2000C3,1,FALSE)),"","1") ->  | C278: ROULEAU DE MASSAGE 3 EN 1 | D278: 3 in 1 Foam Roller | F278: One set includes: -Deep Tissue Foam Roller, 1pc -Massage Foam Roller, 1pc -Massage Sticker, 1pc Color: Orange and grey, as on the photo | I278: =RC[-8] -> 1971 | J278: =VLOOKUP(RC[-9],'/Users/marcvilfeu/Dropbox/HLDP/Docs importants/[Commande Fournisseurs.xlsm]COMPARATIF'!R4C28:R2500C52,9,FALSE) -> 3760223793802
A279: 3712 | B279: =IF(ISNA(VLOOKUP(RC[-1],Import!R3C3:R2000C3,1,FALSE)),"","1") ->  | C279: ROULEAU DE MASSAGE | D279: Rumble Roller | F279: EVA Foam PVC Tube Color: Black Dimensions : 33x14cm | H279: Gross weight: 0,75 kgs | I279: =RC[-8] -> 3712 | J279: =VLOOKUP(RC[-9],'/Users/marcvilfeu/Dropbox/HLDP/Docs importants/[Commande Fournisseurs.xlsm]COMPARATIF'!R4C28:R2500C52,9,FALSE) -> 3760223791938
A280: 3724 | B280: =IF(ISNA(VLOOKUP(RC[-1],Import!R3C3:R2000C3,1,FALSE)),"","1") ->  | C280: ROULEAU DE MASSAGE HARD | D280: Rumble Roller Hard | F280: EVA Foam PVC Tube Color: Black Dimensions : 12.5cm diameter, 33cm length. | H280: Gross weight: 0,75 kgs | I280: =RC[-8] -> 3724 | J280: =VLOOKUP(RC[-9],'/Users/marcvilfeu/Dropbox/HLDP/Docs importants/[Commande Fournisseurs.xlsm]COMPARATIF'!R4C28:R2500C52,9,FALSE) -> 3760223793734
A281: 1767 | B281: =IF(ISNA(VLOOKUP(RC[-1],Import!R3C3:R2000C3,1,FALSE)),"","1") ->  | C281: SET DE MASSAGE | D281: MASSAGE SET | F281: Massage Stick Size: 6 x 44,5 cm (12 rollers), material: TPR, POM Color: Purple Mini massage ball Size: 72mm, material: Rubber Color: Red-soft, yellow for hard 2 balls a set with mesh bag Mini massage ball Size: 7 x 14 cm, material: PVC Color: Red | H281: 3 items in a white box Gross Weight: 1,2 kg | I281: =RC[-8] -> 1767 | J281: =VLOOKUP(RC[-9],'/Users/marcvilfeu/Dropbox/HLDP/Docs importants/[Commande Fournisseurs.xlsm]COMPARATIF'!R4C28:R2500C52,9,FALSE) -> 3760223793321
A282: 3735 | B282: =IF(ISNA(VLOOKUP(RC[-1],Import!R3C3:R2000C3,1,FALSE)),"","1") ->  | C282: SHAPE HANDLE | D282: Shap Handle | F282: Welded metal Color: Black | H282: Gross weight: 1,25 kgs | I282: =RC[-8] -> 3735 | J282: =VLOOKUP(RC[-9],'/Users/marcvilfeu/Dropbox/HLDP/Docs importants/[Commande Fournisseurs.xlsm]COMPARATIF'!R4C28:R2500C52,9,FALSE) -> 3760223793338
A283: 3738 | B283: =IF(ISNA(VLOOKUP(RC[-1],Import!R3C3:R2000C3,1,FALSE)),"","1") ->  | C283: SLAMBALL 4KG | D283: Slamball 4Kg | F283: Weight printed in white. LOGO Leaderfit, in yellow Different weight can be asked: 4, 6, 8, 10, 15 kgs Does not bounce when thrown against wall or onto floor | I283: =RC[-8] -> 3738 | J283: =VLOOKUP(RC[-9],'/Users/marcvilfeu/Dropbox/HLDP/Docs importants/[Commande Fournisseurs.xlsm]COMPARATIF'!R4C28:R2500C52,9,FALSE) -> 3760223792171
A284: 3739 | B284: =IF(ISNA(VLOOKUP(RC[-1],Import!R3C3:R2000C3,1,FALSE)),"","1") ->  | C284: SLAMBALL 6KG | D284: Slamball 6Kg | I284: =RC[-8] -> 3739 | J284: =VLOOKUP(RC[-9],'/Users/marcvilfeu/Dropbox/HLDP/Docs importants/[Commande Fournisseurs.xlsm]COMPARATIF'!R4C28:R2500C52,9,FALSE) -> 3760223792188
A285: 3740 | B285: =IF(ISNA(VLOOKUP(RC[-1],Import!R3C3:R2000C3,1,FALSE)),"","1") ->  | C285: SLAMBALL 8KG | D285: Slamball 8Kg | I285: =RC[-8] -> 3740 | J285: =VLOOKUP(RC[-9],'/Users/marcvilfeu/Dropbox/HLDP/Docs importants/[Commande Fournisseurs.xlsm]COMPARATIF'!R4C28:R2500C52,9,FALSE) -> 3760223792195
A286: 3741 | B286: =IF(ISNA(VLOOKUP(RC[-1],Import!R3C3:R2000C3,1,FALSE)),"","1") ->  | C286: SLAMBALL 10KG | D286: Slamball 10Kg | I286: =RC[-8] -> 3741 | J286: =VLOOKUP(RC[-9],'/Users/marcvilfeu/Dropbox/HLDP/Docs importants/[Commande Fournisseurs.xlsm]COMPARATIF'!R4C28:R2500C52,9,FALSE) -> 3760223790429
A287: 3742 | B287: =IF(ISNA(VLOOKUP(RC[-1],Import!R3C3:R2000C3,1,FALSE)),"","1") ->  | C287: SLAMBALL 15KG | D287: Slamball 15Kg | I287: =RC[-8] -> 3742 | J287: =VLOOKUP(RC[-9],'/Users/marcvilfeu/Dropbox/HLDP/Docs importants/[Commande Fournisseurs.xlsm]COMPARATIF'!R4C28:R2500C52,9,FALSE) -> 3760223793345
A288: 4013 | B288: =IF(ISNA(VLOOKUP(RC[-1],Import!R3C3:R2000C3,1,FALSE)),"","1") ->  | C288: SLIDER DISCS | D288: Slider discs | F288: LOGO Leaderfit Equipement, in pink Oval Shape With handles on the top | I288: =RC[-8] -> 4013 | J288: =VLOOKUP(RC[-9],'/Users/marcvilfeu/Dropbox/HLDP/Docs importants/[Commande Fournisseurs.xlsm]COMPARATIF'!R4C28:R2500C52,9,FALSE) -> 3760223792065
A289: 3418 | B289: =IF(ISNA(VLOOKUP(RC[-1],Import!R3C3:R2000C3,1,FALSE)),"","1") ->  | C289: SLIDING PULL UP SYSTEM | D289: Sliding Pull Up System | H289: Gross Weight: 24,6 kgs | I289: =RC[-8] -> 3418 | J289: =VLOOKUP(RC[-9],'/Users/marcvilfeu/Dropbox/HLDP/Docs importants/[Commande Fournisseurs.xlsm]COMPARATIF'!R4C28:R2500C52,9,FALSE) -> 3760223793352
A290: 3743 | B290: =IF(ISNA(VLOOKUP(RC[-1],Import!R3C3:R2000C3,1,FALSE)),"","1") ->  | C290: SLING BRIDGE | D290: Sling Bridge | H290: Gross Weight: 12 kgs | I290: =RC[-8] -> 3743 | J290: =VLOOKUP(RC[-9],'/Users/marcvilfeu/Dropbox/HLDP/Docs importants/[Commande Fournisseurs.xlsm]COMPARATIF'!R4C28:R2500C52,9,FALSE) -> 3760223793369
A291: 3729 | B291: =IF(ISNA(VLOOKUP(RC[-1],Import!R3C3:R2000C3,1,FALSE)),"","1") ->  | C291: SOFT PLYOBOX SET | D291: Soft Plyobox Set | F291: Sizes: 30/45/60 cm LOGO Leaderfit on two opposite sides, in white. One side: Size in Pound (12”/18”/24”) On the otherside: Size in cm (30cm/45cm/60cm) Top of the plyoboxes: in Black | H291: Gross Weight: 35 kgs | I291: =RC[-8] -> 3729 | J291: =VLOOKUP(RC[-9],'/Users/marcvilfeu/Dropbox/HLDP/Docs importants/[Commande Fournisseurs.xlsm]COMPARATIF'!R4C28:R2500C52,9,FALSE) -> 3760223791310
A292: 1972 | B292: =IF(ISNA(VLOOKUP(RC[-1],Import!R3C3:R2000C3,1,FALSE)),"","1") ->  | C292: SOFT PLYOBOX SET 3 EN 1 | D292: Soft Plyobox Set 3 in 1 | F292: With red triangle in yellow With Leaderfit logo on each side, in yellow SIZE:76*61*51CM Each size is printed in white on each side. Weight: 20kg | I292: =RC[-8] -> 1972 | J292: =VLOOKUP(RC[-9],'/Users/marcvilfeu/Dropbox/HLDP/Docs importants/[Commande Fournisseurs.xlsm]COMPARATIF'!R4C28:R2500C52,9,FALSE) -> 3760223793918
A293: 3630 | B293: =IF(ISNA(VLOOKUP(RC[-1],Import!R3C3:R2000C3,1,FALSE)),"","1") ->  | C293: DALLE EN ROULEAU | I293: =RC[-8] -> 3630 | J293: =VLOOKUP(RC[-9],'/Users/marcvilfeu/Dropbox/HLDP/Docs importants/[Commande Fournisseurs.xlsm]COMPARATIF'!R4C28:R2500C52,9,FALSE) -> 3760223792492
A294: 3779 | B294: =IF(ISNA(VLOOKUP(RC[-1],Import!R3C3:R2000C3,1,FALSE)),"","1") ->  | C294: SPOTTER ARMS | D294: Spotter Arms | F294: Welded metal Color: Grey Sold by pair | H294: Gross Weight: 13 kgs | I294: =RC[-8] -> 3779 | J294: =VLOOKUP(RC[-9],'/Users/marcvilfeu/Dropbox/HLDP/Docs importants/[Commande Fournisseurs.xlsm]COMPARATIF'!R4C28:R2500C52,9,FALSE) -> 3760223790924
A295: 1931 | B295: =IF(ISNA(VLOOKUP(RC[-1],Import!R3C3:R2000C3,1,FALSE)),"","1") ->  | C295: SR - RANGEMENT ACCESSOIRES | D295: Accessory Shelf | I295: =RC[-8] -> 1931 | J295: =VLOOKUP(RC[-9],'/Users/marcvilfeu/Dropbox/HLDP/Docs importants/[Commande Fournisseurs.xlsm]COMPARATIF'!R4C28:R2500C52,9,FALSE) -> 3760223793819
A296: 1932 | B296: =IF(ISNA(VLOOKUP(RC[-1],Import!R3C3:R2000C3,1,FALSE)),"","1") ->  | C296: SR - RANGEMENT DISQUE BUMPER | D296: Bumper plate Shelf | I296: =RC[-8] -> 1932 | J296: =VLOOKUP(RC[-9],'/Users/marcvilfeu/Dropbox/HLDP/Docs importants/[Commande Fournisseurs.xlsm]COMPARATIF'!R4C28:R2500C52,9,FALSE) -> 3760223793826
A297: 1933 | B297: =IF(ISNA(VLOOKUP(RC[-1],Import!R3C3:R2000C3,1,FALSE)),"","1") ->  | C297: SR - RANGEMENT HALTÈRE | D297: Dumbbell Shelf | I297: =RC[-8] -> 1933 | J297: =VLOOKUP(RC[-9],'/Users/marcvilfeu/Dropbox/HLDP/Docs importants/[Commande Fournisseurs.xlsm]COMPARATIF'!R4C28:R2500C52,9,FALSE) -> 3760223793833
A298: 1934 | B298: =IF(ISNA(VLOOKUP(RC[-1],Import!R3C3:R2000C3,1,FALSE)),"","1") ->  | C298: SR - RANGEMENT KETTLEBELL | D298: Kettlebell Shelf | I298: =RC[-8] -> 1934 | J298: =VLOOKUP(RC[-9],'/Users/marcvilfeu/Dropbox/HLDP/Docs importants/[Commande Fournisseurs.xlsm]COMPARATIF'!R4C28:R2500C52,9,FALSE) -> 3760223793840
A299: 1935 | B299: =IF(ISNA(VLOOKUP(RC[-1],Import!R3C3:R2000C3,1,FALSE)),"","1") ->  | C299: SR - RANGEMENT MEDECINE BALL | D299: Medecine Ball Shelf | I299: =RC[-8] -> 1935 | J299: =VLOOKUP(RC[-9],'/Users/marcvilfeu/Dropbox/HLDP/Docs importants/[Commande Fournisseurs.xlsm]COMPARATIF'!R4C28:R2500C52,9,FALSE) -> 3760223793857
A300: 1936 | B300: =IF(ISNA(VLOOKUP(RC[-1],Import!R3C3:R2000C3,1,FALSE)),"","1") ->  | C300: SR - RANGEMENT BARRE OLYMPIQUE | D300: Olympic Bar Storage | I300: =RC[-8] -> 1936 | J300: =VLOOKUP(RC[-9],'/Users/marcvilfeu/Dropbox/HLDP/Docs importants/[Commande Fournisseurs.xlsm]COMPARATIF'!R4C28:R2500C52,9,FALSE) -> 3760223793864
A301: 1937 | B301: =IF(ISNA(VLOOKUP(RC[-1],Import!R3C3:R2000C3,1,FALSE)),"","1") ->  | C301: SR - RANGEMENT DISQUE | D301: Plate Sleeve | I301: =RC[-8] -> 1937 | J301: =VLOOKUP(RC[-9],'/Users/marcvilfeu/Dropbox/HLDP/Docs importants/[Commande Fournisseurs.xlsm]COMPARATIF'!R4C28:R2500C52,9,FALSE) -> 3760223793871
A302: 1938 | B302: =IF(ISNA(VLOOKUP(RC[-1],Import!R3C3:R2000C3,1,FALSE)),"","1") ->  | C302: SR - POTEAU RACK CROSS TRAINING 1,5M | D302: Upright Tube Storage Rack 1,5M | I302: =RC[-8] -> 1938 | J302: =VLOOKUP(RC[-9],'/Users/marcvilfeu/Dropbox/HLDP/Docs importants/[Commande Fournisseurs.xlsm]COMPARATIF'!R4C28:R2500C52,9,FALSE) -> 3760223793888
A303: 1939 | B303: =IF(ISNA(VLOOKUP(RC[-1],Import!R3C3:R2000C3,1,FALSE)),"","1") ->  | C303: SR - POTEAU RACK CROSS TRAINING 1M | D303: Upright Tube Storage Rack 1M | I303: =RC[-8] -> 1939 | J303: =VLOOKUP(RC[-9],'/Users/marcvilfeu/Dropbox/HLDP/Docs importants/[Commande Fournisseurs.xlsm]COMPARATIF'!R4C28:R2500C52,9,FALSE) -> 3760223793895
A304: 1940 | B304: =IF(ISNA(VLOOKUP(RC[-1],Import!R3C3:R2000C3,1,FALSE)),"","1") ->  | C304: SR - RANGEMENT WALL BALL | D304: Wall Ball Shelf | I304: =RC[-8] -> 1940 | J304: =VLOOKUP(RC[-9],'/Users/marcvilfeu/Dropbox/HLDP/Docs importants/[Commande Fournisseurs.xlsm]COMPARATIF'!R4C28:R2500C52,9,FALSE) -> 3760223793901
A305: 1982 | B305: =IF(ISNA(VLOOKUP(RC[-1],Import!R3C3:R2000C3,1,FALSE)),"","1") ->  | C305: STEP MINI | D305: AEROBIC STEP | F305: SIZE:70*28*22CM STEP COLOR: BLACK FEET COLOR: Grey Logo: Leaderfit, in color on the top | H305: 4,5 kgs | I305: =RC[-8] -> 1982 | J305: =VLOOKUP(RC[-9],'/Users/marcvilfeu/Dropbox/HLDP/Docs importants/[Commande Fournisseurs.xlsm]COMPARATIF'!R4C28:R2500C52,9,FALSE) -> 3760223794021
A306: 2687 | B306: =IF(ISNA(VLOOKUP(RC[-1],Import!R3C3:R2000C3,1,FALSE)),"","1") ->  | C306: STEP SANS PLOTS | D306: AEROBIC STEP W/O PLOTS | F306: Dimensions: 109 x 41 x 10 cm Color: Grey | H306: 4,5 kgs | I306: =RC[-8] -> 2687 | J306: =VLOOKUP(RC[-9],'/Users/marcvilfeu/Dropbox/HLDP/Docs importants/[Commande Fournisseurs.xlsm]COMPARATIF'!R4C28:R2500C52,9,FALSE) -> 3760223791327
A307: 2310 | B307: =IF(ISNA(VLOOKUP(RC[-1],Import!R3C3:R2000C3,1,FALSE)),"","1") ->  | C307: STEP CLUB | D307: AEROBIC STEP W/ PLOTS | F307: imensions: 109 x 41 x 11/16/21 cm The step is composed of a step base and 8 plots. Max user weight: 100 kgs Color: Grey | H307: 9,5 kgs | I307: =RC[-8] -> 2310 | J307: =VLOOKUP(RC[-9],'/Users/marcvilfeu/Dropbox/HLDP/Docs importants/[Commande Fournisseurs.xlsm]COMPARATIF'!R4C28:R2500C52,9,FALSE) -> 3760223793444
A308: 1738 | B308: =IF(ISNA(VLOOKUP(RC[-1],Import!R3C3:R2000C3,1,FALSE)),"","1") ->  | C308: STEP LEADERFIT' | D308: AEROBIC STEP W/ PLOTS | F308: Dimensions: 98 x 38 x 15 cm Two pairs of risers included Adjustable height of : 15/20/25 cm Rubberized deck Max user weight: 100 kgs LOGO: Leaderfit, in pink | H308: 7,5 kgs | I308: =RC[-8] -> 1738 | J308: =VLOOKUP(RC[-9],'/Users/marcvilfeu/Dropbox/HLDP/Docs importants/[Commande Fournisseurs.xlsm]COMPARATIF'!R4C28:R2500C52,9,FALSE) -> 3760223793451
A309: 3399 | B309: =IF(ISNA(VLOOKUP(RC[-1],Import!R3C3:R2000C3,1,FALSE)),"","1") ->  | C309: SUPINE BOARD | D309: Supine Board | H309: Gross Weight: 15 kgs | I309: =RC[-8] -> 3399 | J309: =VLOOKUP(RC[-9],'/Users/marcvilfeu/Dropbox/HLDP/Docs importants/[Commande Fournisseurs.xlsm]COMPARATIF'!R4C28:R2500C52,9,FALSE) -> 3760223793468
A310: 1941 | B310: =IF(ISNA(VLOOKUP(RC[-1],Import!R3C3:R2000C3,1,FALSE)),"","1") ->  | C310: STEEL JERK BLOCK | D310: Steel Jerk Block | F310: Color: Black Logo: Leaderfit, yellow print in top rubber Weight: 58kg/pc Dimensions (cm) L 91x l 61 x H 89 / 109. | I310: =RC[-8] -> 1941 | J310: =VLOOKUP(RC[-9],'/Users/marcvilfeu/Dropbox/HLDP/Docs importants/[Commande Fournisseurs.xlsm]COMPARATIF'!R4C28:R2500C52,9,FALSE) -> 3760223793932
A311: 1984 | B311: =IF(ISNA(VLOOKUP(RC[-1],Import!R3C3:R2000C3,1,FALSE)),"","1") ->  | C311: TAPIS ANTI-FATIGUE | D311: TAPIS ANTI-FATIGUE | F311: With Yoga Pattern Size 60*175*1.9cm Color: Green Weight: 3,5kgs | I311: =RC[-8] -> 1984 | J311: =VLOOKUP(RC[-9],'/Users/marcvilfeu/Dropbox/HLDP/Docs importants/[Commande Fournisseurs.xlsm]COMPARATIF'!R4C28:R2500C52,9,FALSE) -> 3760223794083
A312: 1981 | B312: =IF(ISNA(VLOOKUP(RC[-1],Import!R3C3:R2000C3,1,FALSE)),"","1") ->  | C312: TAPIS D'ACUPRESSION | D312: Calmat | F312: SIZE:68*42*2CM Color: Purple | H312: PACKING:1PC/POLYBAG,20KG/CARTON | I312: =RC[-8] -> 1981 | J312: =VLOOKUP(RC[-9],'/Users/marcvilfeu/Dropbox/HLDP/Docs importants/[Commande Fournisseurs.xlsm]COMPARATIF'!R4C28:R2500C52,9,FALSE) -> 3760223794175
A313: 3560 | B313: =IF(ISNA(VLOOKUP(RC[-1],Import!R3C3:R2000C3,1,FALSE)),"","1") ->  | C313: TAPIS 100X9,5CM GRIS/NOIR | D313: PVC EXERCISE MAT 1M GREY/BLACK | F313: Dimensions: 9.5mm x 50cm x 100cm Color: Cool Gray 8C (one side) / Black (other side) With 2 eyelets on the mat Space between the middle of eyelets: 50cm Density: 0.11-0.14g/cm3 | H313: 1 kgs | I313: =RC[-8] -> 3560 | J313: =VLOOKUP(RC[-9],'/Users/marcvilfeu/Dropbox/HLDP/Docs importants/[Commande Fournisseurs.xlsm]COMPARATIF'!R4C28:R2500C52,9,FALSE) -> 3760223793475
A314: 1744 | B314: =IF(ISNA(VLOOKUP(RC[-1],Import!R3C3:R2000C3,1,FALSE)),"","1") ->  | C314: TAPIS 140X1,5 BLEU | D314: EXERCISE MAT 140x60x1.5cm BLUE | F314: Dimensions: 140 x 60x 1,5 cm Color: Blue With 2 eyelets on the mat Material: TPE Distance between middle of each eyelets: 50cm Density: 0.11-0.14g/cm3 | H314: 2 kgs | I314: =RC[-8] -> 1744 | J314: =VLOOKUP(RC[-9],'/Users/marcvilfeu/Dropbox/HLDP/Docs importants/[Commande Fournisseurs.xlsm]COMPARATIF'!R4C28:R2500C52,9,FALSE) -> 3760223793482
A315: 1745 | B315: =IF(ISNA(VLOOKUP(RC[-1],Import!R3C3:R2000C3,1,FALSE)),"","1") ->  | C315: TAPIS 140X1,5 NOIR | D315: EXERCISE MAT 140x60x1.5cm BLACK | F315: Dimensions: 140 x 60x 1,5 cm Color: Black With 2 eyelets on the mat Material: TPE Distance between middle of each eyelets: 50cm | H315: 2 kgs | I315: =RC[-8] -> 1745 | J315: =VLOOKUP(RC[-9],'/Users/marcvilfeu/Dropbox/HLDP/Docs importants/[Commande Fournisseurs.xlsm]COMPARATIF'!R4C28:R2500C52,9,FALSE) -> 3760223793499
A316: 1748 | B316: =IF(ISNA(VLOOKUP(RC[-1],Import!R3C3:R2000C3,1,FALSE)),"","1") ->  | C316: TAPIS 180X1,5 BLEU | D316: UNDULANT EXERCISE MAT 180x60x1.5cm BLUE | F316: Dimensions: 180 x 60x 1,5 cm Color: Blue With 2 eyelets on the mat Material: NBR Distance between middle of each eyelets: 50cm Density: 80kg/m3 Straps must be put into the mat. The mat must not be strapped directly by supplier. | H316: Gross Weight: 2 kg | I316: =RC[-8] -> 1748 | J316: =VLOOKUP(RC[-9],'/Users/marcvilfeu/Dropbox/HLDP/Docs importants/[Commande Fournisseurs.xlsm]COMPARATIF'!R4C28:R2500C52,9,FALSE) -> 3760223793505
A317: 1749 | B317: =IF(ISNA(VLOOKUP(RC[-1],Import!R3C3:R2000C3,1,FALSE)),"","1") ->  | C317: TAPIS 180X1,5 NOIR | D317: UNDULANT EXERCISE MAT 180x60x1.5cm BLACK | F317: Dimensions: 180 x 60x 1,5 cm Color: Black With 2 eyelets on the mat Material: NBR Distance between middle of each eyelets: 50cm Density: 80kg/m3 Straps must be put into the mat. The mat must not be strapped directly by supplier. | H317: Gross Weight: 2 kg | I317: =RC[-8] -> 1749 | J317: =VLOOKUP(RC[-9],'/Users/marcvilfeu/Dropbox/HLDP/Docs importants/[Commande Fournisseurs.xlsm]COMPARATIF'!R4C28:R2500C52,9,FALSE) -> 3760223793512
A318: 1757 | B318: =IF(ISNA(VLOOKUP(RC[-1],Import!R3C3:R2000C3,1,FALSE)),"","1") ->  | C318: TAPIS 180X1,5 VERT | D318: UNDULANT EXERCISE MAT 180x60x1.5cm GREEN | F318: Dimensions: 180 x 60x 1,5 cm Color: Green With 2 eyelets on the mat Material: NBR Distance between middle of each eyelets: 50cm Density: 80kg/m3 | H318: Gross Weight: 2 kg | I318: =RC[-8] -> 1757 | J318: =VLOOKUP(RC[-9],'/Users/marcvilfeu/Dropbox/HLDP/Docs importants/[Commande Fournisseurs.xlsm]COMPARATIF'!R4C28:R2500C52,9,FALSE) -> 3760223793536
A319: 1756 | B319: =IF(ISNA(VLOOKUP(RC[-1],Import!R3C3:R2000C3,1,FALSE)),"","1") ->  | C319: TAPIS 180X1,5 ROSE | D319: UNDULANT EXERCISE MAT 180x60x1.5cm PINK | F319: Dimensions: 180 x 60x 1,5 cm Color: Pink With 2 eyelets on the mat Material: NBR Distance between middle of each eyelets: 50cm Density: 80kg/m3 | H319: Gross Weight: 2 kg | I319: =RC[-8] -> 1756 | J319: =VLOOKUP(RC[-9],'/Users/marcvilfeu/Dropbox/HLDP/Docs importants/[Commande Fournisseurs.xlsm]COMPARATIF'!R4C28:R2500C52,9,FALSE) -> 3760223793529
A320: 3563 | B320: =IF(ISNA(VLOOKUP(RC[-1],Import!R3C3:R2000C3,1,FALSE)),"","1") ->  | C320: TIMER PRO | D320: Timer | F320: Size:74*16*4cm With Remote Control Can display seconds With logo Leaderfit, in white | I320: =RC[-8] -> 3563 | J320: =VLOOKUP(RC[-9],'/Users/marcvilfeu/Dropbox/HLDP/Docs importants/[Commande Fournisseurs.xlsm]COMPARATIF'!R4C28:R2500C52,9,FALSE) -> 3760223790634
A321: 2327 | B321: =IF(ISNA(VLOOKUP(RC[-1],Import!R3C3:R2000C3,1,FALSE)),"","1") ->  | C321: TRAINEAU À LESTÉES | D321: SLED + HARNESS | F321: SLED Color: Silver Harness Color: black Assembly size: 92*79*114cm main tube 50*50*2mm weight is 21kg | H321: Gross Weight: 23kgs | I321: =RC[-8] -> 2327 | J321: =VLOOKUP(RC[-9],'/Users/marcvilfeu/Dropbox/HLDP/Docs importants/[Commande Fournisseurs.xlsm]COMPARATIF'!R4C28:R2500C52,9,FALSE) -> 3760223793543
A322: 1944 | B322: =IF(ISNA(VLOOKUP(RC[-1],Import!R3C3:R2000C3,1,FALSE)),"","1") ->  | C322: TRAMPOLINE | D322: Trampoline | F322: The 6 feet must screw to the frame perfectly Tube thickness: 1,5 mm Spring Diameter: 3,2 mm Width of strap: 3,8 cm Double straps, 12 seams LOGO: Leaderfit, in white You must be careful on the welded point, we don't want to find any. | H322: Gross Weight: 8 kgs | I322: =RC[-8] -> 1944 | J322: =VLOOKUP(RC[-9],'/Users/marcvilfeu/Dropbox/HLDP/Docs importants/[Commande Fournisseurs.xlsm]COMPARATIF'!R4C28:R2500C52,9,FALSE) -> 3760223793550
A323: 3562 | B323: =IF(ISNA(VLOOKUP(RC[-1],Import!R3C3:R2000C3,1,FALSE)),"","1") ->  | C323: TRAMPOLINE CAGE | D323: TRAMPOLINE CROSSFIT FOR STATION | H323: Gross Weight: 22 kgs | I323: =RC[-8] -> 3562 | J323: =VLOOKUP(RC[-9],'/Users/marcvilfeu/Dropbox/HLDP/Docs importants/[Commande Fournisseurs.xlsm]COMPARATIF'!R4C28:R2500C52,9,FALSE) -> 3760223790900
A324: 3424 | B324: =IF(ISNA(VLOOKUP(RC[-1],Import!R3C3:R2000C3,1,FALSE)),"","1") ->  | C324: TRIANGULAR CROSSES 1800MM | D324: Triangular Crosses - 1800Mm | F324: Length: 1800 mm | H324: Gross Weight: 42 kgs | I324: =RC[-8] -> 3424 | J324: =VLOOKUP(RC[-9],'/Users/marcvilfeu/Dropbox/HLDP/Docs importants/[Commande Fournisseurs.xlsm]COMPARATIF'!R4C28:R2500C52,9,FALSE) -> 3760223793567
A325: 3759 | B325: =IF(ISNA(VLOOKUP(RC[-1],Import!R3C3:R2000C3,1,FALSE)),"","1") ->  | C325: UPRIGHT TUBE 2742MM | D325: Upright Tube - 2742MM | F325: Length: 2742mm Welded Metal Color: Black | H325: Gross Weight: 25 kgs | I325: =RC[-8] -> 3759 | J325: =VLOOKUP(RC[-9],'/Users/marcvilfeu/Dropbox/HLDP/Docs importants/[Commande Fournisseurs.xlsm]COMPARATIF'!R4C28:R2500C52,9,FALSE) -> 3760223790573
A326: 3760 | B326: =IF(ISNA(VLOOKUP(RC[-1],Import!R3C3:R2000C3,1,FALSE)),"","1") ->  | C326: UPRIGHT TUBE 3685MM | D326: Upright Tube - 3685Mm | F326: Length: 3685mm Welded Metal Color: Black | H326: Gross Weight: 29 kgs | I326: =RC[-8] -> 3760 | J326: =VLOOKUP(RC[-9],'/Users/marcvilfeu/Dropbox/HLDP/Docs importants/[Commande Fournisseurs.xlsm]COMPARATIF'!R4C28:R2500C52,9,FALSE) -> 3760223791358
A327: 2342 | B327: =IF(ISNA(VLOOKUP(RC[-1],Import!R3C3:R2000C3,1,FALSE)),"","1") ->  | C327: SOFT MEDECINE BALL 3KG | I327: =RC[-8] -> 2342 | J327: =VLOOKUP(RC[-9],'/Users/marcvilfeu/Dropbox/HLDP/Docs importants/[Commande Fournisseurs.xlsm]COMPARATIF'!R4C28:R2500C52,9,FALSE) -> 0
A328: 2343 | B328: =IF(ISNA(VLOOKUP(RC[-1],Import!R3C3:R2000C3,1,FALSE)),"","1") ->  | C328: SOFT MEDECINE BALL 6KG | I328: =RC[-8] -> 2343 | J328: =VLOOKUP(RC[-9],'/Users/marcvilfeu/Dropbox/HLDP/Docs importants/[Commande Fournisseurs.xlsm]COMPARATIF'!R4C28:R2500C52,9,FALSE) -> 0
A329: 2344 | B329: =IF(ISNA(VLOOKUP(RC[-1],Import!R3C3:R2000C3,1,FALSE)),"","1") ->  | C329: SOFT MEDECINE BALL 9KG | I329: =RC[-8] -> 2344 | J329: =VLOOKUP(RC[-9],'/Users/marcvilfeu/Dropbox/HLDP/Docs importants/[Commande Fournisseurs.xlsm]COMPARATIF'!R4C28:R2500C52,9,FALSE) -> 0
A330: 3706 | B330: =IF(ISNA(VLOOKUP(RC[-1],Import!R3C3:R2000C3,1,FALSE)),"","1") ->  | C330: BALL STORAGE | D330: Wall Ball Storage | F330: Can store up to 3 Wall Balls | H330: Gross Weight: 12 kgs | I330: =RC[-8] -> 3706 | J330: =VLOOKUP(RC[-9],'/Users/marcvilfeu/Dropbox/HLDP/Docs importants/[Commande Fournisseurs.xlsm]COMPARATIF'!R4C28:R2500C52,9,FALSE) -> 3760223793574
A331: 3478 | B331: =IF(ISNA(VLOOKUP(RC[-1],Import!R3C3:R2000C3,1,FALSE)),"","1") ->  | C331: WALL BALL TARGET | D331: Wall Ball Target | F331: Material: Metal | H331: Gross Weight: 15 kgs | I331: =RC[-8] -> 3478 | J331: =VLOOKUP(RC[-9],'/Users/marcvilfeu/Dropbox/HLDP/Docs importants/[Commande Fournisseurs.xlsm]COMPARATIF'!R4C28:R2500C52,9,FALSE) -> 3760223790856
A332: 1967 | B332: =IF(ISNA(VLOOKUP(RC[-1],Import!R3C3:R2000C3,1,FALSE)),"","1") ->  | C332: ROUE YOGA | D332: Yoga Wheel | F332: Logo: LF Pilates, on the white part External diameter: 33.5 (with foam)cm Internal diameter: 30cm Foam thickness: 0,6 cm Color: Inside: White Outside: Green Material: PVC covered by Rubber | I332: =RC[-8] -> 1967 | J332: =VLOOKUP(RC[-9],'/Users/marcvilfeu/Dropbox/HLDP/Docs importants/[Commande Fournisseurs.xlsm]COMPARATIF'!R4C28:R2500C52,9,FALSE) -> 3760223794168
B333: =IF(ISNA(VLOOKUP(RC[-1],Import!R3C3:R2000C3,1,FALSE)),"","1") -> 
B334: =IF(ISNA(VLOOKUP(RC[-1],Import!R3C3:R2000C3,1,FALSE)),"","1") -> 

Sheet: Liste
A1: Ref HLDP | B1: Ref LF | C1: Produits
A2: STW101 | B2: 1491 | C2: 1 - Corde De Tirage
A3: STW102 | B3: 1518 | C3: 2 - Triangle De Tirage Avec Poignees
A4: STW103 | B4: 1686 | C4: 3 - Poignee De Tirage
A5: STW104 | B5: 1459 | C5: 4 - Barre Rowing De Tirage Dorsal
A6: STW105 | B6: 1457 | C6: 5 - Barre Rowing Biceps Triceps
A7: STW106 | B7: 1520 | C7: 6 - Double Poignees De Tirage Biceps-Triceps
A8: STW107 | B8: 1519 | C8: 7 - Barre De Triceps En V
A9: STW108 | B9: 1521 | C9: 8 - Double Poignee Rowing De Tirage Dorsal
A10: STW109 | B10: 1517 | C10: 9 - Triangle De Tirage
A11: STW110 | B11: 1456 | C11: 10 - Barre Droite De Tirage Dorsal
A12: CRW113 | B12: 1725 | C12: Ab Wheel
A13: CRA114 | B13: 2025 | C13: Ab Wheel Pro
A14: CRI118 | B14: 2980 | C14: Ab-Mat
A15: RFW261 | B15: 1430 | C15: Anneau Ballons Fitness
A16: CRI122 | B16: 2341 | C16: Anneaux De Suspension
A17: CRI258 | B17: 4008 | C17: Anneaux De Suspension Bois
A18: STI576 | B18: 2363 | C18: Bagues Stop Disques
A19: CRI289 | B19: 2365 | C19: Bagues Stop Disques 2
A20: RFA275 | B20: 1437 | C20: Balle À Réaction 7cm
A21: RFA280 | B21: 1438 | C21: Balles Hérissons 8Cm
A22: RFW287 | B22: 1439 | C22: Balles Lestees 0,5Kg Bleu
A23: RFW287A | B23: 1442 | C23: Balles Lestees 0,5Kg Grises
A24: RFW291 | B24: 1441 | C24: Balles Lestees 1Kg Bleu
A25: RFW291A | B25: 1444 | C25: Balles Lestees 1Kg Grises
A26: RFW289 | B26: 1440 | C26: Balles Lestees 1,5Kg Bleu
A27: RFW289A | B27: 1443 | C27: Balles Lestees 1,5Kg Grises
A28: RFA298 | B28: 3212 | C28: Ballon Fitness 55Cm
A29: RFA298A | B29: 2666 | C29: Ballon Fitness 55Cm gris
A30: RFA301 | B30: 1571 | C30: Ballon Fitness 65Cm
A31: RFA301A | B31: 1572 | C31: Ballon Fitness 65Cm gris
A32: RFA303 | B32: 1574 | C32: Ballon Fitness 75Cm
A33: RFA316B | B33: 1445 | C33: Ballon Paille 26Cm Bleu
A34: RFA316R | B34: 1446 | C34: Ballon Paille 26Cm Rose
A35: RFA316V | B35: 1447 | C35: Ballon Paille 26Cm Violet
A36: RFT428 | B36: 1548 | C36: Bandes latex
A37: RFW326 | B37: 2902 | C37: Bande Lestée Cheville 0,5Kg
A38: RFW327 | B38: 1450 | C38: Bande Lestée Cheville 1Kg
A39: RFW328 | B39: 1451 | C39: Bande Lestée Poignet 0,5Kg
A40: CRW126 | B40: 3408 | C40: Barre Crossfit Olympique Homme
A41: CRW127 | B41: 3407 | C41: Barre Crossfit Olympique Femme
A42: STW581 | B42: 1452 | C42: Barre Curl Ez 120Cm
A43: STI585 | B43: 1458 | C43: Barre Lyre Triceps
A44: STW589 | B44: 2986 | C44: Barre Olympique Droite 1,50M
A45: STW590 | B45: 1453 | C45: Barre Olympique Droite 2,20M
C46: Barre olympique d'initiation
A47: RFW344 | B47: 1460 | C47: Base A Picots
A48: RFA581 | B48: 1461 | C48: Baton de bois 120cm
A49: RFA582 | B49: 1468 | C49: Baton de bois 140cm
A50: RFA348 | B50: 1462 | C50: Bloc Proprioception
A51: RFA595 | B51: 1479 | C51: Bouchon pour Ballon Paille
A52: RFA595 | B52: 1479 | C52: Brique Yoga
A53: RFT361 | B53: 2369 | C53: Ceinture Aquatique
A54: CRI131 | B54: 3414 | C54: Chin-Up Rack
A55: RFA806 | B55: 1492 | C55: Corde À Sauter orange
A56: RFA806V | B56: 1493 | C56: Corde À Sauter vert
A57: RFA806P | B57: 1494 | C57: Corde À Sauter violet
A58: RFT425 | B58: 3998 | C58: Corde à Sauter Crossfit noir
A59: CRI136 | B59: 3479 | C59: Corde D'Oscillation Ø38Mm
A60: CRI135 | B60: 1496 | C60: Corde D'Oscillation Ø50Mm
A61: CRI491 | B61: 3479 | C61: Corde D'Oscillation Ø38Mm avec cover
A62: CRI492 | B62: 1496 | C62: Corde D'Oscillation Ø50Mm avec cover
A63: CRW140 | B63: 2332 | C63: Core Plate
A64: STC594 | B64: 3629 | C64: Dalle Caoutchouc 1X1M X 15Mm
A65: STC595 | B65: 3482 | C65: Dalle Caoutchouc 50X50Cmx20Mm
A66: CRI143 | B66: 3489 | C66: Disques Bumper Crossfit 5Kg
A67: CRI144 | B67: 3485 | C67: Disques Bumper Crossfit 10Kg
A68: CRI145 | B68: 3486 | C68: Disques Bumper Crossfit 15Kg
A69: CRI146 | B69: 3487 | C69: Disques Bumper Crossfit 20Kg
A70: CRI147 | B70: 3488 | C70: Disques Bumper Crossfit 25Kg
A71: STW599 | B71: 1508 | C71: Disques Noirs Rond A Poignees 1,25Kg
A72: STW600 | B72: 1511 | C72: Disques Noirs Rond A Poignees 2,5Kgs
A73: STW601 | B73: 1513 | C73: Disques Noirs Rond A Poignees 5Kgs
A74: STW602 | B74: 1509 | C74: Disques Noirs Rond A Poignees 10Kgs
A75: STW603 | B75: 1510 | C75: Disques Noirs Rond A Poignees 15Kgs
A76: STW604 | B76: 1512 | C76: Disques Noirs Rond A Poignees 20Kgs
A77: RFW379 | B77: 2313 | C77: Disque Pump 1,25Kg
A78: RFW380 | B78: 2314 | C78: Disque Pump 2,5Kgs
A79: RFW381 | B79: 2315 | C79: Disque Pump 5Kgs
A80: RFW381 | B80: 2315 | C80: Disque Pump 10Kgs
A81: RFW385 | B81: 1515 | C81: Dome Trainer
A82: PTA674 | B82: 1543 | C82: Echelle De Vitesse 4M
A83: RFA805 | B83: 1544 | C83: Elastic Band 10KGS
A84: RFA598 | B84: 1545 | C84: Elastic Band 15KGS
A85: RFA599 | B85: 1546 | C85: Elastic Band 20KGS
A86: RFA871 | B86: 1547 | C86: Elastique De Résistance Poignet/Cheville
A87: RFA870 | B87: 2317 | C87: Elastique De Résistance Saut
A88: RFA813 | B88: 2021 | C88: Equalizer
A89: RFA394 | B89: 2351 | C89: Fitness Tube Latex Light
A90: RFA395 | B90: 2353 | C90: Fitness Tube Latex Medium
A91: RFA396 | B91: 1556 | C91: Fitness Tube Latex Strong
A92: RFA604 | B92: 2296 | C92: Flex Bar dévissable
A93: RFW404 | B93: 1559 | C93: Foam Roller Epe
A94: RFW560 | B94: 1560 | C94: Foam Roller Bleu Avec surface alvéolée
A95: PTW679 | B95: 2331 | C95: Gilet Lestés 10Kgs
A96: PTA699 | B96: 4041 | C96: Gilet Lestés néoprène 5kgs
A97: PTA700 | B97: 4043 | C97: Gilet Lestés néoprène 10kgs
A98: RFA409 | B98: 4013 | C98: Glide
A99: PTA683 | B99: 1576 | C99: Haie 15Cm
A100: PTA684 | B100: 1577 | C100: Haie 30Cm
A101: PTA685 | B101: 1578 | C101: Haie 50Cm
A102: STW609 | B102: 2057 | C102: Halteres Caoutchouc Hexagonales 1Kg
A103: STW610 | B103: 2058 | C103: Halteres Caoutchouc Hexagonales 2Kg
A104: STW611 | B104: 2059 | C104: Halteres Caoutchouc Hexagonales 4Kg
A105: STW612 | B105: 2062 | C105: Halteres Caoutchouc Hexagonales 6Kg
A106: STW613 | B106: 2064 | C106: Halteres Caoutchouc Hexagonales 8Kg
A107: STW614 | B107: 2066 | C107: Halteres Caoutchouc Hexagonales 10Kg
A108: STW615 | B108: 1589 | C108: Halteres Caoutchouc Hexagonales 12,5Kg
A109: STW616 | B109: 1590 | C109: Halteres Caoutchouc Hexagonales 15Kg
A110: STW617 | B110: 1591 | C110: Halteres Caoutchouc Hexagonales 17,5Kg
A111: STW618 | B111: 1592 | C111: Halteres Caoutchouc Hexagonales 20Kg
A112: STW619 | B112: 1593 | C112: Halteres Caoutchouc Hexagonales 22,5Kg
A113: STW620 | B113: 1594 | C113: Halteres Caoutchouc Hexagonales 25Kg
A114: STW621 | B114: 1595 | C114: Halteres Caoutchouc Hexagonales 27,5Kg
A115: STW622 | B115: 1596 | C115: Halteres Caoutchouc Hexagonales 30Kg
A116: STW623 | B116: 1597 | C116: Halteres Caoutchouc Hexagonales 32,5Kg
A117: STW624 | B117: 1598 | C117: Halteres Caoutchouc Hexagonales 35Kg
A118: STW625 | B118: 2484 | C118: Halteres Caoutchouc Hexagonales 37,5Kg
A119: STW626 | B119: 2068 | C119: Halteres Caoutchouc Hexagonales 40Kg
A120: STW627 | B120: 2485 | C120: Halteres Caoutchouc Hexagonales 42,5Kg
A121: STW628 | B121: 2071 | C121: Halteres Caoutchouc Hexagonales 45Kg
A122: STW629 | B122: 2486 | C122: Halteres Caoutchouc Hexagonales 47,5Kg
A123: STW630 | B123: 2074 | C123: Halteres Caoutchouc Hexagonales 50Kg
A124: RFW428 | B124: 2993 | C124: Halteres Vinyles Hexa 0,5Kg
A125: RFW429 | B125: 1616 | C125: Halteres Vinyles Hexa 1Kg
A126: RFW430 | B126: 2994 | C126: Halteres Vinyles Hexa 2Kg
A127: RFW431 | B127: 2995 | C127: Halteres Vinyles Hexa 3Kg
A128: RFW432 | B128: 2996 | C128: Halteres Vinyles Hexa 4Kg
A129: RFW433 | B129: 2997 | C129: Halteres Vinyles Hexa 5Kg
A130: RFA579 | B130: 1625 | C130: Home Trainer
A131: STW634 | B131: 2362 | C131: Hex Bar
A132: CRW152 | B132: 2969 | C132: Kettlebell 4Kg
A133: CRW153 | B133: 2970 | C133: Kettlebell 6Kg
A134: CRW154 | B134: 2971 | C134: Kettlebell 8Kg
A135: CRW155 | B135: 2972 | C135: Kettlebell 10Kg
A136: CRW156 | B136: 2973 | C136: Kettlebell 12Kg
A137: CRW157 | B137: 2974 | C137: Kettlebell 16Kg
A138: CRW158 | B138: 2975 | C138: Kettlebell 20Kg
A139: CRW159 | B139: 2976 | C139: Kettlebell 24Kg
A140: CRW160 | B140: 3529 | C140: Kettlebell 28Kg
A141: CRW161 | B141: 3530 | C141: Kettlebell 32Kg
A142: CRW162 | B142: 3531 | C142: Kettlebell 36Kg
A143: CRW163 | B143: 3532 | C143: Kettlebell 40Kg
A144: CRW164 | B144: 3533 | C144: Kettlebell 44Kg
A145: CRW165 | B145: 3534 | C145: Kettlebell 48Kg
A146: CRI169 | B146: 3393 | C146: Kettlebell Couleur 8Kg
A147: CRI170 | B147: 3394 | C147: Kettlebell Couleur 10Kg
A148: CRI171 | B148: 3395 | C148: Kettlebell Couleur 12Kg
A149: CRI172 | B149: 3648 | C149: Kettlebell Couleur 14Kg
A150: CRI173 | B150: 3649 | C150: Kettlebell Couleur 16Kg
A151: CRI174 | B151: 3650 | C151: Kettlebell Couleur 18Kg
A152: CRI175 | B152: 3651 | C152: Kettlebell Couleur 20Kg
A153: CRI176 | B153: 3652 | C153: Kettlebell Couleur 22Kg
A154: CRI177 | B154: 3653 | C154: Kettlebell Couleur 24Kg
A155: CRI178 | B155: 3654 | C155: Kettlebell Couleur 26Kg
A156: CRI179 | B156: 3655 | C156: Kettlebell Couleur 28Kg
A157: CRI180 | B157: 3656 | C157: Kettlebell Couleur 32Kg
A158: CRI181 | B158: 3657 | C158: Kettlebell Couleur 36Kg
A159: CRI182 | B159: 3658 | C159: Kettlebell Couleur 40Kg
A160: CRI183 | B160: 3659 | C160: Kettlebell Couleur 44Kg
A161: CRI184 | B161: 3660 | C161: Kettlebell Couleur 48Kg
A162: PTA689 | B162: 2322 | C162: Kit De Parcours
A163: RFW436 | B163: 2312 | C163: Kit Pump Couleur 20Kg
A164: RFW438 | B164: 2903 | C164: Kit Pump Couleur 8,5Kg
A165: RFW437 | B165: 3537 | C165: Kit Pump Noir 20Kg
A166: RFA881 | B166: 2358 | C166: Manchon Mousse
A167: CRI192 | B167: 1639 | C167: Medecine Ball 1Kg
A168: CRI193 | B168: 1640 | C168: Medecine Ball 2Kg
A169: CRI194 | B169: 1641 | C169: Medecine Ball 3Kg
A170: CRI195 | B170: 1642 | C170: Medecine Ball 4Kg
A171: CRI196 | B171: 1643 | C171: Medecine Ball 5Kg
A172: CRI200 | B172: 3421 | C172: Multi-Grip Chin-Up
A173: PTA693 | B173: 1677 | C173: Parachute De Resistance 140Cm
A174: RFA460 | B174: 1682 | C174: Pilates Ring
A175: STW638 | B175: 1684 | C175: Pinces Metal Stop Disque
A176: CRI290 | B176: 3966 | C176: Plateau d'haltérophilie
A177: RFW464 | B177: 1436 | C177: Plateau De Freeman
A178: PTA698 | B178: 1685 | C178: Plots De Vitesse
A179: CRW204 | B179: 3554 | C179: Plyobox Set
A180: CRI208 | B180: 3691 | C180: Power Bag 5Kg
A181: CRI209 | B181: 3692 | C181: Power Bag 10Kg
A182: CRI210 | B182: 3693 | C182: Power Bag 15Kg
A183: CRI211 | B183: 3694 | C183: Power Bag 20Kg
A184: CRI212 | B184: 3695 | C184: Power Bag 25Kg
A185: CRI217 | B185: 3697 | C185: Power Band Extra Light
A186: CRI216 | B186: 3696 | C186: Power Band Light
A187: CRI218 | B187: 3699 | C187: Power Band Medium
A188: CRI219 | B188: 3700 | C188: Power Band Strong
A189: CRI220 | B189: 3698 | C189: Power Band Extra Strong
A190: RFA483 | B190: 1696 | C190: Press Ball
A191: RFA487 | B191: 2364 | C191: Pull Boy
A192: RFW495 | B192: 1697 | C192: Rack 10 Kits Pump
A193: RFW496 | B193: 1699 | C193: Rack 20 Kits Pump A (gris)
A194: RFW497 | B194: 2904 | C194: Rack 20 Kits Pump B (noir)
A195: RFW509 | B195: 1704 | C195: Rack 9 Gymball
A196: STW642 | B196: 1718 | C196: Rack Accessoires
A197: STT646 | B197: 3555 | C197: Rack Barres Mural
A198: STW650 | B198: 3398 | C198: Rack Barres Vertical
A199: STT654 | B199: 1705 | C199: Rack Disques
A200: STW658 | B200: 1717 | C200: Rack Disques & Barres
A201: RFW501 | B201: 1709 | C201: Rack Domes Trainer
A202: RFW505 | B202: 1710 | C202: Rack Foam Roller
A203: RFW513 | B203: 2239 | C203: Rack Halteres Fitness Roulant
A204: STW662 | B204: 3777 | C204: Rack Haltères Hexagonaux
A205: RFA602 | B205: 1713 | C205: Rack Kettlebell
A206: CRW228 | B206: 2345 | C206: Rack 5 Medecine Ball
A207: RFW517 | B207: 1716 | C207: Rack Mural Ajustable Tapis
A208: CRW232 | B208: 2347 | C208: Rack Power Bag
A209: RFW521 | B209: 1719 | C209: Rack Tapis Roulant
A210: RFW529 | B210: 1726 | C210: Rouleau Bande Latex Light
A211: RFW530 | B211: 1727 | C211: Rouleau Bande Latex Medium
A212: RFW531 | B212: 3491 | C212: Rouleau Bande Latex Strong
A213: CRW236 | B213: 3712 | C213: Rumble Roller
A214: RFA819 | B214: 1945 | C214: Sac De Frappe
A215: RFA601 | B215: 1767 | C215: Set de Massage
A216: CRI241 | B216: 3738 | C216: Slamball 4Kg
A217: CRI242 | B217: 3739 | C217: Slamball 6Kg
A218: CRI243 | B218: 3740 | C218: Slamball 8Kg
A219: CRI244 | B219: 3741 | C219: Slamball 10Kg
A220: CRI245 | B220: 3742 | C220: Slamball 15Kg
A221: CRW249 | B221: 3729 | C221: Soft Plyobox Set
A222: STC666 | B222: 3630 | C222: Sol En Rouleau
A223: RFW557 | B223: 1738 | C223: Step Aerobic
A224: RFW558 | B224: 2310 | C224: Step Aerobic Avec Plots
A225: RFW559 | B225: 2687 | C225: Step Aerobic Sans Plots
A226: RFW558 | B226: 2310 | C226: Step Club
A227: CRI188 | B227: 3559 | C227: Suspension Trainer
A228: RFA565 | B228: 1744 | C228: Tapis D'Exercice TPE 140Cm, 15Mm
A229: RFA566 | B229: 1745 | C229: Tapis D'Exercice TPE 180Cm, 15Mm
A230: RFA564 | B230: 3560 | C230: Tapis D'Exercice 1M Gris/Noir
A231: RFA568 | B231: 1749 | C231: Tapis Nbr, 180Cm, 15Mm, noir
A232: RFA603 | B232: 1748 | C232: Tapis Nbr, 180Cm, 15Mm, beu
A233: CRI253 | B233: 3563 | C233: Timer
A234: CRI257 | B234: 2327 | C234: Traineau À Lestées
A235: RFA815 | B235: 2342 | C235: Wall Ball 3Kgs
A236: RFA816 | B236: 2343 | C236: Wall Ball 6Kgs
A237: RFA817 | B237: 2344 | C237: Wall Ball 9Kgs
A238: CRI410 | B238: 3397 | C238: Ab Slings
A239: CRI284 | B239: 2230 | C239: Banc commercial
A240: CRI450 | B240: 3458 | C240: Cage Crossfit Power
A241: CRI280 | B241: 3415 | C241: Chin-up Bar 1172mm
A242: CRI281 | B242: 3416 | C242: Chin-up Bar 1200mm
A243: CRI282 | B243: 3417 | C243: Chin-up Bar 1250mm
A244: CRI460 | B244: 3478 | C244: Cible Wall Ball
A245: CRI421 | B245: 3410 | C245: Cross Bar - 1080Mm
A246: CRI422 | B246: 3411 | C246: Cross Bar - 1800Mm
A247: CRI425 | B247: 3820 | C247: Cross Bar Length: 2815Mm
A248: CRI463 | B248: 3484 | C248: Dip Bars
A249: CRI462 | B249: 3483 | C249: Dip Horn
A250: CRI416 | B250: 3419 | C250: Double Chin-Up Bar - 1080Mm
A251: CRI417 | B251: 3420 | C251: Double Chin-Up Bar - 1800Mm
A252: CRI423 | B252: 3412 | C252: Elevation Cross Bar - 1552Mm
A253: CRI424 | B253: 3413 | C253: Elevation Cross Bar - 2119Mm
A254: CRI412 | B254: 3813 | C254: Elevation Cross Bar Length: 1215Mm
A255: CRI464 | B255: 3525 | C255: Ghd
A256: CRI466 | B256: 3641 | C256: Grip Ball
A257: CRI490 | B257: 2884 | C257: J-Hooks
A258: CRW224 | B258: 3705 | C258: Kettlebell Storage
A259: CRI470 | B259: 3547 | C259: Monkey Bar - 1080Mm
A260: CRI471 | B260: 3548 | C260: Monkey Bar - 1800Mm
A261: CRI472 | B261: 3549 | C261: Monkey Rack - 1080Mm
A262: CRI473 | B262: 3550 | C262: Monkey Rack - 1800Mm
A263: CRI419 | B263: 3423 | C263: Overpass - 1800Mm
A264: CRI418 | B264: 3422 | C264: Overpass- 1080Mm
A265: CRI475 | B265: 3552 | C265: Pegs Pour Power Band
A266: CRI476 | B266: 3690 | C266: Plyometric Box Board
A267: CRI477 | B267: 3689 | C267: Plate Forme Pliométrique
A268: CRI413 | B268: 3704 | C268: Plate Storage Sleeve
A269: CRI478 | B269: 3735 | C269: Shap Handle
A270: CRI482 | B270: 3480 | C270: Rotational Core
A271: CRI415 | B271: 3418 | C271: Sliding Pull Up System
A272: CRI286 | B272: 3743 | C272: Sling Bridge
A273: CRI414 | B273: 3779 | C273: Spotter Arms
A274: CRI287 | B274: 3399 | C274: Supine Board
A275: CRI283 | B275: 3562 | C275: Trampoline cage
A276: CRI420 | B276: 3424 | C276: Triangular Crosses - 1800Mm
A277: CRI480 | B277: 3759 | C277: Trampoline cage
A278: CRI288 | B278: 3706 | C278: Wall Board Storage
A279: CRI481 | B279: 3760 | C279: Upright Tube - 3685Mm
A280: RFW617 | B280: 1931 | C280: SR - RANGEMENT ACCESSOIRES
A281: RFW618 | B281: 1932 | C281: SR - RANGEMENT DISQUE BUMPER
A282: RFW619 | B282: 1933 | C282: SR - RANGEMENT HALTÈRE
A283: RFW620 | B283: 1934 | C283: SR - RANGEMENT KETTLEBELL
A284: RFW621 | B284: 1935 | C284: SR - RANGEMENT MEDECINE BALL
A285: RFW622 | B285: 1936 | C285: SR - RANGEMENT BARRE OLYMPIQUE
A286: RFW623 | B286: 1937 | C286: SR - RANGEMENT DISQUE
A287: RFW625 | B287: 1938 | C287: SR - POTEAU RACK CROSS TRAINING 1,5M
A288: RFW624 | B288: 1939 | C288: SR - POTEAU RACK CROSS TRAINING 1M
A289: RFW626 | B289: 1940 | C289: SR - RANGEMENT WALL BALL
A290: CRI292 | B290: 3703 | C290: Punching bag rack
A291: RFW498 | B291: 1992 | C291: RACK 20 KITS PUMP ROULANT
A292: RFW638 | B292: 1989 | C292: Balance Cushion
A293: STW674 | B293: 3584 | C293: Kettlebell Cast Iron 4kg
A294: STW675 | B294: 3585 | C294: Kettlebell Cast Iron 8kg
A295: STW677 | B295: 3587 | C295: Kettlebell Cast Iron 12kg
A296: STW678 | B296: 3588 | C296: Kettlebell Cast Iron 16kg